nct_id,brief_title,description,brief_title_concepts_list,brief_summary_concepts_list,tot_subj_affected,tot_subj_risk,relevance,citationSum,citationAvg,briefTitlePageRankScore,briefTitleAndSummaryCombinedPageRankScore,brief_title_matched_count,brief_summary_matched_count
NCT01695824,Left Atrial Appendage (LAA) Occluders After Catheter Ablation of Atrial Fibrillation,"The primary objective of this study is to assess combined end point (All stroke, Systemic      embolism, Cardiovascular death) between two groups.",C4284918;C0004238;C0162563;C0182025,C3887460;C0018017;C0013922;C0038454;C1552839;C0947630;C0011065,0,0,1,3,3,0.00350602,0.003714603,0,0
NCT00431834,Concomitant Utilization of Radio Frequency Energy for Atrial Fibrillation (CURE-AF) Study,"This investigation is a prospective, nonrandomized multicenter clinical trial evaluating the      outcome of patients with atrial fibrillation (AF) requiring concomitant open heart surgery      plus the Cardioblate Surgical Ablation System using the modified Maze III procedure. The      trial population includes patients requiring valve replacements or repairs, atrial septal      defect (ASD) repairs, patent foramen ovale (PFO) closure or coronary artery bypass graft      (CABG) procedures. The study objectives are to demonstrate that the Medtronic Cardioblate      Surgical Ablation System can safely and effectively treat permanent AF patients.",C0004238;C2347273;C4330907;C0034546;C0947630;C4699193,C0010055;C0004238;C0189745;C1096775;C1552578;C0035139;C0018017;C0184661;C0543467;C0547070;C0543467;C0547070;C0043240;C0043240;C0018792;C0030650;C0184252;C0947630;C0184661;C0723285;C0018792;C4699193,264,3675,0,7,7,0.003307627,0.003709135,0,0
NCT01117025,Combined Treatment of Resistant Hypertension and Atrial Fibrillation,"The purpose of this study is the comparative evaluation of systolic blood pressure (SBP)      lowering, atrial fibrillation (AF) recurrence and clinical data in patients with      paroxysmal/persistent AF and resistant hypertension, undergoing AF ablation alone or combined      with percutaneous renal denervation.",C0004238;C0009429;C0020538;C1514892,C0871470;C0004238;C1516606;C0020538;C0011307;C0220825;C1458156;C0547070;C0947630;C0439044;C0022646;C1306620;C1820370;C1514892;C0546816,0,0,0,82,41,0.003318401,0.003701072,0,0
NCT03062241,Ablation of Atrial Fibrillation in Heart Failure Patients,"~     The aim of the study is to evaluate the impact of cryoablation of atrial fibrillation in~     patients with severe chronic heart failure (CHF) on long term outcome of CHF and efficacy~     (endurance) of the procedure itself. The study hypothesis is that cryoablation in eligible~     patients with CHF and ICD/CRT (implantable cardioverter defibrillator / cardiac~     resynchronization therapy) implants reduce the number of recurrent CHF hospitalizations,~     mortality, need for mechanical support of LV (left ventricle) and heart transplant (primary~     endpoint) at 1 year observation in comparison to traditional (pharmacological) treatment..~   ",C0004238;C0018801;C0547070,C0264716;C0004238;C3841811;C0518031;C2355627;C0021102;C0018787;C2948600;C0019993;C0376495,0,0,-1,0,0,0.00486898,0.00369851,0,0
NCT00238706,Use of Radiofrequency Ablation to Eliminate Continuous Atrial Fibrillation in Patients Undergoing Mitral Valve Surgery,The aim of this prospective randomized clinical trial was to evaluate the early and late      outcome following left atrial radiofrequency ablation during MV surgery for the treatment of      continuous atrial fibrillation and to assess the functional effects of restoration of sinus      rhythm.,C0850292;C0004238;C0026264;C0543467;C1550655,C0206034;C0850292;C0004238;C0449982;C0087111;C0543467;C0018792;C0871269;C1518681;C0031843;C1444662;C0220825,0,0,0,33,33,0.003830571,0.003690781,0,0
NCT00684307,Prevention of Stroke and Systemic Embolic Events in Patients With Atrial Fibrillation,"The main purpose of this study is to provide dose-guiding information by assessing the safety      and tolerability of 4 different dosing regimens of an extended-release (ER) formulation of      AZD0837 compared with well-controlled, dose-adjusted Vitamin-K antagonists (VKA) (aiming for      an international normalized ratio (INR) 2.0 to 3.0) in patients with non-valvular atrial      fibrillation (AF) with one or more additional risk factors for stroke.",C0004238;C0199176;C0038454;C1550655;C1704212;C4019010,C0525032;C0232197;C0035648;C2945654;C0680255;C0042890;C0018792;C0038454;C0947630;C4684765;C1555587;C3242430;C2911690;C0381385,840,96455,1,11,11,0.003997888,0.003682577,0,0
NCT01597557,Intravenous Magnesium Infusion in Patients Undergoing Cardioversion of Atrial Fibrillation Trial,The proposed study is designed to evaluate the effect of an intravenous infusion of magnesium      sulfate in facilitating successful cardioversion of atrial fibrillation and in decreasing the      energy threshold (in J) required for successful cardioversion of atrial fibrillation into      sinus rhythm.,C0004238;C0013778;C0373675;C0574032;C1550655;C0085297,C0021440;C0004238;C0004238;C0013778;C0013778;C0232201;C0442797;C3245501;C1518681;C0424589;C0947630;C0373675;C0220825,0,0,0,0,0,0.003636275,0.003678711,0,0
NCT00259428,EURopean Trial In Atrial Fibrillation(AF) or Flutter (AFL) Patients Receiving Dronedarone for the maIntenance of Sinus Rhythm (EURIDIS),"~     To assess the efficacy of dronedarone versus placebo for the maintenance of normal sinus~     rhythm after electrical, pharmacological or spontaneous conversion of atrial~     fibrillation/atrial flutter (AF/AFL).~      To assess the efficacy of dronedarone versus placebo on AF/AFL-related symptoms.~      To assess the efficacy of dronedarone versus placebo on ventricular rate control in case of~     AF/AFL recurrence.~   ",C0232201;C0004238,C0004239;C0871269;C0032042;C0032042;C0032042;C0034897;C1457887,0,0,-1,126,126,0.005234137,0.003667939,0,0
NCT02072434,Edoxaban vs. Warfarin in Subjects Undergoing Cardioversion of Atrial Fibrillation,"The purpose of this study is to compare edoxaban (investigational drug) with warfarin and      enoxaparin, to see if it is safe and effective in preventing stroke and other blood clot      complications in subjects with atrial fibrillation whose doctors plan to treat them with an      electrical cardioversion. It is expected that 284 sites will recruit 2200 subjects from North      America, EU, Russia, Ukraine and Israel. Participants will be randomly allocated to receive      either treatment with edoxaban, or treatment with warfarin, plus enoxaparin if required.      Participants will have an equal chance of receiving either treatment. Participants will be in      the study for a maximum of 82 days. Study procedures will include physical examinations,      vital signs (pulse and sitting blood pressure), ECG (electrocardiogram), finger prick blood      clotting tests, blood samples, urine samples and completion of Quality of Life      questionnaires.      The study is expected to show that edoxaban will provide comparable incidence rates for      efficacy to warfarin plus enoxaparin, the current standard treatment, and will be at least as      safe as warfarin for the incidence rate for bleeding",C0004238;C0013778;C2975435;C0043031,C0542380;C0031809;C0013230;C0004238;C4684780;C0013798;C0518214;C0005823;C0034394;C0009566;C0178913;C0518766;C0206460;C0087086;C0206460;C0206460;C0087111;C0087111;C0087111;C2975435;C0043031;C2975435;C0043031;C3245501;C1328723;C2975435;C0043031;C0043031;C0019080;C0277814;C0038454;C0016129;C0947630;C0947630;C0947630;C0034107;C0033119;C0005767;C0392366;C0042036;C0947630;C0042789;C0184661;C1555587;C4055646;C4055646;C0729829,0,0,0,26,13,0.003570714,0.003666683,0,0
NCT01897545,Combined Treatment of Arterial Hypertension and Atrial Fibrillation,"The purpose of this study is the comparative evaluation of systolic blood pressure (SBP)      lowering, atrial fibrillation (AF) recurrence and clinical data in patients with      paroxysmal/persistent AF and resistant/non-resistant hypertension, undergoing AF ablation      alone or combined with percutaneous renal denervation.",C0004238;C0009429;C0020538;C0003842,C0871470;C0004238;C1516606;C0020538;C0011307;C0220825;C1458156;C0547070;C0947630;C0439044;C0022646;C1306620;C1820370;C1514892;C1514892;C0546816,0,0,0,18,18,0.003307408,0.003665627,0,0
NCT00820625,Long-Standing Persistant Atrial Fibrillation-Pulmonary Vein Isolation With or Without Ablation,"The chronic success rate, defined as freedom from any atrial tachyarrhythmias will increase      from 35% to 60% by ablation of complex fragmented atrial electrograms potentials in addition      to pulmonary vein isolation (PVI) as compared to PVI alone in patients with long-standing      persistent AF.",C0004238;C0034090;C0204727;C0547070,C0080203;C0034090;C0204727;C0547070;C0018792;C0018792;C0439044;C4684637;C4300452;C0939261;C0546816,0,0,0,5,5,0.004310991,0.003663542,0,0
NCT00419640,SAFE Study - Septal Pacing for Atrial Fibrillation Suppression Evaluation,"This is a randomized, parallel, single-blinded multi-center study. The objective is to      compare the long term clinical outcomes among the site of atrial pacing and to compare the      long term effect of the atrial fibrillation (AF) Suppression algorithm.",C0004238;C0301625;C0220825;C0947630;C0723285,C0004238;C0301625;C0018017;C0002045;C0087136;C0018792;C1518681;C0947630;C0404831;C4554418;C3272565,0,0,0,8,8,0.003656994,0.003663065,0,0
NCT02348723,Uninterrupted Dabigatran Etexilate in Comparison to Uninterrupted Warfarin in Pulmonary Vein Ablation (RE-CIRCUIT),"~     The primary objective of this trial is to assess the safety of an uninterrupted dabigatran~     etexilate periprocedural anticoagulant regimen compared to an uninterrupted warfarin regimen~     in Non-Valvular Atrial Fibrillation (NVAF) patients undergoing Atrial Fibrillation (AF)~     ablation in a PROBE (Prospective, randomized, open label, blinded end point) active~     controlled study.~      Secondary objectives are to assess additional safety endpoints and efficacy in this clinical~     setting.~      It is not intended to assess confirmatory hypothesis, this is an exploratory study.~   ",C1571583;C0043031;C0547070;C0034090,C0004238;C0004238;C0043031;C0547070;C0003280;C2348066;C0182400;C0180112,601,66248,-1,59,29.5,0.001556225,0.003658219,0,0
NCT01198275,n-3 Polyunsaturated Fatty Acids (PUFAs) in the Prevention of Atrial Fibrillation,The purpose of this study is to determine the effect of n-3 PUFAs in addition to amiodarone      and renin-angiotensin-aldosterone system (RAAS) inhibitors on the maintenance of sinus rhythm      after electrical conversion in patients with persistent Atrial fibrillation (AF).,C0004238;C0199176;C0015689,C0004238;C0232201;C0003018;C0002006;C0002598;C1518681;C0947630;C0015689;C0546816;C4082977,0,398,0,31,31,0.004123098,0.0036576,0,0
NCT01830543,A Study Exploring Two Strategies of Rivaroxaban (JNJ39039039; BAY-59-7939) and One of Oral Vitamin K Antagonist in Patients With Atrial Fibrillation Who Undergo Percutaneous Coronary Intervention,The primary purpose of this study is to evaluate the safety for 2 different rivaroxaban      treatment strategies and one Vitamin K Antagonist (VKA) treatment strategy utilizing various      combinations of dual antiplatelet therapy (DAPT) or low-dose aspirin (ASA) or clopidogrel (or      prasugrel or ticagrelor).,C1532338;C2267235;C0004238;C1739768;C0947630;C1550655;C0679199,C2267235;C1096021;C3539181;C1739768;C0070166;C0679199;C1999375;C0087111;C0087111;C1620287;C0679199;C3540008;C0004057;C0947630;C1550472;C0220825,3272,864788,1,91,15.16666667,0.003869818,0.00365587,0,0
NCT00982475,Alster Man and Machine: Comparison of Manual and Mechanical Remote Robotic Catheter Ablation for Drug-Refractory Atrial Fibrillation,Long term results after pulmonary vein isolation (PVI) with robotic navigation in patients      with drug refractory atrial fibrillation are not inferior to manual radiofrequency current      ablation.,C0004238;C0162563;C0024763;C0013227;C0882214;C0337246,C0004238;C0034090;C0204727;C0547070;C0024763;C0013227,0,0,0,0,0,0.003141858,0.003646566,0,0
NCT04218604,The 'Ablate By-LAW' Study,"~     Of all the determinants of lesion creation during atrial fibrillation (AF) ablation, left~     atrial wall thickness (LAWT), as measured with multi-detector cardiac tomography (MDCT) is~     one key element that has been evaluated in some retrospective analyses but is not yet used~     per protocol to modulate the radiofrequency delivery. Adapting ablation index (AI) to LAWT~     would be very useful in standardising the ablation procedure with parameters fitted to every~     patient, enabling the development of a personalized approach that will both: i) increase~     efficacy by performing transmural lesions to prevent the formation of conduction gaps in the~     initial lesion set, and ii) increase safety by preventing excessive RF delivery on thin wall~     areas related to procedural complications, such as cardiac perforation or atrio-esophageal~     fistula. The investigators sought to evaluate the feasibility, safety, efficacy and~     reproducibility of guiding AF ablation procedures with the integrated MDCT-derived LAWT~     information.~   ",0,C0004238;C0040395;C0547070;C0547070;C0547070;C1171285;C0547070;C0221198;C0221198;C0918012;C0009566;C0221198,0,0,-1,0,0,0.00036245,0.003635061,0,0
NCT00446966,Fish Oil for Reduction of Atrial Fibrillation After Cardiac Surgery,"The primary objective of this study is to determine if omega-3 polyunsaturated fatty acids      reduce atrial fibrillation and other outcomes after cardiac surgery. In this      placebo-controlled trial, patients undergoing elective coronary artery bypass graft surgery      with or without valve repair will be treated with omega-3 polyunsaturated fatty acids      perioperatively. The following hypotheses will be tested: 1. omega-3 polyunsaturated fatty      acids reduces the incidence of atrial fibrillation (AF) after cardiac surgery, 2. omega-3      polyunsaturated fatty acids, administered in the perioperative period for cardiac surgery,      decreases postoperative complication rates, and 3. omega-3 polyunsaturated fatty acids      decrease intensive care unit and hospital length-of-stay.",C0004238;C0018821;C1293152;C0016157,C0010055;C0032787;C0004238;C0004238;C0085559;C0018017;C0015689;C0018787;C0543467;C0032042;C0543467;C0015689;C0015689;C0018787;C0543467;C0015689;C0018787;C0543467;C0015689;C0043240;C0392366;C0025344;C0947630;C0184252;C0442797;C2911690;C0015689;C0015689;C0015689;C0015689;C0442797;C0018792;C0729829;C1546398;C0332155;C4082977,0,520,0,13,13,0.003366059,0.003625813,0,0
NCT01878981,Health Economics Evaluation of Catheter Ablation Versus Drug Therapy in Atrial Fibrillation (AF) in China,"To generate real world evidence to compare clinical outcomes and patient health-related      quality of life, resulting from catheter ablation therapy with clinical outcome and patient      health-related quality of life resulting from drug therapy in China. An economic model will      be constructed, and using the clinical events evidence collected in this study, and China      long-term disease progression and local disease cost data to perform a cost-effectiveness      evaluation of Catheter Ablation versus Drug Therapy in AF (Paroxysmal plus Persistent AF)      patients.",C0004238;C0162563;C0013216;C0220825;C1328956,C0242656;C0162563;C0162563;C0518214;C0518214;C0013554;C0277565;C4553491;C0013216;C0013216;C0220825;C0087111;C0947630;C3245479;C0233492;C0233492;C0011164;C0235480;C3272565;C3272565;C3272565,0,0,0,1,1,0.003465108,0.003619271,0,0
NCT00784316,Intravenous Metoprolol Versus Intravenous Amiodarone in the Prevention of Atrial Fibrillation After Cardiac Surgery,The aim of the study is to test the efficiency of intravenous administration of metoprolol      versus intravenous administration of amiodarone in the prevention of atrial fibrillation      after cardiac surgery.,C0004238;C0018821;C0025859;C0002598;C0199176;C0085297;C0085297,C0021440;C0021440;C0004238;C0025859;C0002598;C0199176;C0018787;C0543467;C0947630;C0392366;C0231184,0,0,0,3,3,0.003299211,0.0036169,0,0
NCT01858779,Know Your Pulse Post Stroke-Measurement of Peripheral Pulse for Detection of Atrial Fibrillation After Ischemic Stroke,"Atrial fibrillation (AF) is the most common cause of cardioembolism and a leading cause of      ischemic stroke. The diagnosis of AF after cerebral ischemia is difficult to establish even      during the treatment at specialised stroke units, as paroxysmal episodes may terminate      spontaneously before arrival at the hospital and do not always show early recurrence.      However, the diagnosis of AF is of particular clinical relevance since adaequate      anticoagulation is one of the most effective secondary preventive treatments in stroke. The      detection rate of AF after stroke increases progressively by extending the duration and      intensity of cardiac monitoring. For this purpose innovative medical devices and implantable      event recorders have been suggested. However, high socioeconomic expenses, malcompliance and      the invasiveness of some of these approaches currently limit their use to a minority of      affected patients, while the growing number of stroke survivors is lacking access to free and      simple screening tools.      For primary prevention, the measurement of the peripheral pulse (MPP) is currently the only      guideline-recommended screening method among individuals aged 65 years or older. In contrast,      MPP has never been applied in the setting of secondary stroke prevention, probably because      several factors were expected to interfere with this simple technique, including sensomotor      and neuropsychiologic handicaps of stroke patients 18. This study investigates feasibility      and validity of MPP in this cohort (pilot phase) and compares daily MPP for 6 months with      repeated holter-ECG in patients after ischemic stroke.",C0004238;C0948008;C1511790;C0038454;C0034107;C0034107;C3843236,C0004238;C0150496;C0033144;C0917798;C1277289;C0948008;C0003281;C0025080;C0948008;C1458156;C0087111;C0011900;C0332218;C0087111;C0011900;C0027627;C0182913;C0199230;C0282423;C0199230;C0027627;C0231172;C0332148;C0542559;C3245511;C0038454;C0038454;C0038454;C0038454;C0025663;C0038454;C0034107;C0947630;C3843802;C1553407;C0021102;C0723323;C0723323;C0202165;C1511790;C0332534;C0449900;C4055646;C1561542;C0015733;C3272565,0,0,0,1,1,0.003394454,0.00360235,0,0
NCT02578979,Serial ECG Versus Holter to Detect Atrial Fibrillation in Elderly Ischemic Stroke Patients,"Paroxysmal atrial fibrillation is often undetected because characteristics such as short      duration, episodic, and frequently asymptomatic nature make it challenging to diagnose at the      bedside, leading to suboptimal secondary prevention. It is not uncommon for paroxysmal atrial      fibrillation to be undetected in a single electrocardiogram (ECG) on admission. Conventional      24-hour Holter monitoring is often used to detect paroxysmal atrial fibrillation. However,      systematic review suggests Holter monitoring will identify atrial fibrillation in only an      additional 4.6% of patients, no better than detection rates observed in groups lacking      routine monitoring. On the other hand, for ischemic stroke patients with sinus rhythm at      baseline but paroxysmal atrial fibrillation still suspected, no recommendation beyond      repeated 12-lead ECGs is made in the United Kingdom guideline. Serial 12-lead ECG has been      used to detect possible paroxysmal atrial fibrillation among acute ischemic stroke patients      and found 15 new cases of atrial fibrillation in 133 acute ischemic stroke patients (11.3%)      without atrial fibrillation at baseline. The optimal investigation strategy, including      modality, duration of investigation, and patient subgroup remains undefined, not only for      efficacy in the detection of atrial fibrillation, but also cost-effectiveness in healthcare      systems. The objective of this project is to conduct a pragmatic multicenter randomized      controlled trial for the comparison of serial 12-lead ECG once daily for 5 days and 24-hour      Holter to detect paroxysmal atrial fibrillation in acute ischemic stroke patients without      atrial fibrillation identified by baseline ECG or history.",C0004238;C0948008;C1550655,C0235480;C0235480;C0235480;C0235480;C0235480;C0679699;C0004238;C0004238;C0004238;C0004238;C0004238;C0013798;C1955832;C0948008;C0948008;C0948008;C0948008;C1552578;C1552578;C4553491;C0231221;C0232197;C0232201;C0150369;C0150369;C0150369;C0086388;C0184666;C0282423;C0018017;C0011900;C0332149;C0679199;C0262512;C0018792;C0087136;C0442726;C1552839;C0442726;C0031082;C0442726;C1273517;C0018563;C1273517;C1578513;C0282440;C1550043;C4684838;C0022396;C0442726;C0442726;C1511790;C1511790;C0332534;C3858576;C0332534;C0729829;C0728774;C0728774;C1547664;C0728774,0,0,0,0,0,0.004817584,0.003601052,0,0
NCT00753259,Atrial Fibrillation (AF) Clinic to Improve the Treatment of Patients With Atrial Fibrillation.,"-  Randomized controlled trial comparing specialized AF Clinic with 'care as usual'        -  Hypothesis: treatment of AF patients in the AF-Clinic by a nurse, specialised in AF,           using guideline-based dedicated software, under supervision of a cardiologist, is           efficient, safe and not inferior to care as usual by a cardiologists.",C0004238;C0004238;C0087111;C1550655;C0184511,C0038842;C0087111;C0282423;C0037585;C0282440;C3812868,0,0,0,49,12.25,0.004347423,0.003596431,0,0
NCT00367757,STAR-AF:Substrate Versus Trigger Ablation for Reduction of Atrial Fibrillation Trial,"Patient Population: Patients with AF that is symptomatic and refractory to at least one      antiarrhythmic medication. Patients must have AF that is paroxysmal (>4 episodes within 6      months, two episodes >6 hours within 1 year) or persistent (sustained episode <6 months      terminated by cardioversion or drug).      Purpose: To compare a trigger-based technique (pulmonary vein isolation) to a substrate-based      technique (high-frequency, fractionated EGMs) to a combined approach for AF ablation",C0004238;C1293152;C0547070,C0003195;C0034090;C0013778;C0013227;C1553407;C0204727;C0547070;C1550655;C0032930;C1561543;C0013227;C0231221;C1550655;C1550655;C2347273;C1561542;C1561542;C0546816,0,0,0,41,41,0.004706801,0.003569453,0,0
NCT01107184,Remote Ischemic Conditioning and Atrial Fibrillation After Coronary Artery Bypass Grafting (CABG),Recent studies indicate that remote ischemic conditioning can protect the heart and other      organs during cardiac surgery. The investigators aim to investigate whether such a stimulus      can reduce the incidence of atrial fibrillation or other complications following coronary      artery bypass surgery.,C0010055;C0004238;C0009647;C0022116,C0004238;C0009566;C0009647;C0018787;C0947630;C0018787;C0543467;C0543467;C0178784;C0003842;C0741847;C0018787;C0022116,0,0,0,4,4,0.003286134,0.003551563,0,0
NCT01970501,Genetically Targeted Therapy for the Prevention of Symptomatic Atrial Fibrillation in Patients With Heart Failure,This study is being done to compare the effects of bucindolol hydrochloride (bucindolol) to      metoprolol succinate (Toprol-XL) on the recurrence of symptomatic atrial fibrillation/atrial      flutter in patients with heart failure who have a specific genotype for the beta-1 adrenergic      receptor.,C0004238;C2985566;C0018801;C0199176;C1550655;C0231221,C2930687;C0724633;C0004238;C0018801;C0054196;C1458156;C0723783;C1552740;C1285573;C0016385;C0018792;C0947630;C0231221;C0001637;C1518681;C0700651,0,0,0,0,0,0.003936539,0.003534654,0,0
NCT01471795,The Epidemiology of Ventricular Assist Device-Related Infections,"~     Infections often occur after ventricular assist devices (VADs) are placed. These infections~     can be very serious. The goal of this study is to understand why these infections occur.~     Bacteria (germs) normally live on our skin and in our noses. After surgery, they can infect~     the VAD. The investigators will collect cultures of your skin and nose before and after~     surgery. The investigators will compare these bacteria to bacteria that cause infections.~     Their genes will be compared to see which ones help the bacteria cause infection.~   ",C3714514,C0028429;C3714514;C3714514;C3714514;C3714514;C3714514,0,0,-1,49,24.5,0.003624502,0.003521127,0,0
NCT01977859,BNP Pharmacodynamics and Effects on Metabolism in Lean and Obese Subjects,"~     The purpose of this study is to collect data to help researchers better understand the~     various causes of obesity, which may lead to the development of new obesity treatment~     options.~   ",C0025519,C0028754;C0028754,0,0,-1,0,0,0.003624502,0.003521127,0,0
NCT00000556,Atrial Fibrillation Follow-up Investigation of Rhythm Management (AFFIRM),To compare two standard treatment strategies for atrial fibrillation: ventricular rate      control and anticoagulation vs. rhythm control and anticoagulation.,C0004238;C0220825;C0871269;C0376636,C0004238;C4684780;C0003281;C0003281;C0018827;C0679199;C0871269,0,0,0,20,10,0.00365487,0.003517724,0,0
