nct_id,brief_title,page_rank_score_brief_title,page_rank_score_brief_title_summary_combined
NCT01227889,A Study Comparing GSK2118436 to Dacarbazine (DTIC) in Previously Untreated Subjects With BRAF Mutation Positive Advanced (Stage III) or Metastatic (Stage IV) Melanoma,0.0010938749210278,0.0010341611041809102
NCT01216696,Ipilimumab in Patients With Advanced Melanoma and Spontaneous Preexisting Immune Response to NY-ESO-1,0.0011432203291881619,0.0011231828182664844
NCT01216787,"RO4929097 in Treating Patients With Stage IIIB, Stage IIIC, or Stage IV Melanoma That Can Be Removed by Surgery",0.0011674484868655966,0.0012898386932013188
NCT01256359,Docetaxel With or Without AZD6244 in Melanoma,0.0014536248192060723,0.0012392832324633432
NCT01245062,GSK1120212 vs Chemotherapy in Advanced or Metastatic BRAF V600E/K Mutation-positive Melanoma,0.0008994125139250799,0.0009977133587918197
NCT01245556,Safety and Efficacy Study of BMS-908662 in Combination With Ipilimumab in Subjects With Advanced Melanoma,0.0010772409272309718,0.0013677008284610854
NCT01280565,A Phase 3 Study to Compare Efficacy and Safety of Masitinib to Dacarbazine in the Treatment of Patients With Non-Resectable or Metastatic Stage 3 or Stage 4 Melanoma Carrying a Mutation in the Juxta Membrane Domain of C-Kit,0.001332456055212043,0.0010497492188755162
NCT01281722,Role of SLURP-1 in Melanoma and Melanoma Stem Cells,0.0008531401325465316,0.0008188626862986
NCT01239134,Trial of TRX518 (Anti-GITR mAb) in Stage III or IV Malignant Melanoma or Other Solid Tumors,0.0009845487500925345,0.0010496879621513596
NCT01211262,Study to Assess the Tolerability of a Bispecific Targeted Biologic IMCgp100 in Malignant Melanoma,0.0008880577394819822,0.0009990041537786037
NCT01205815,Storage and Research Use of Human Bio-specimens From Melanoma Patients and Clinical Testing for Assignment of Treatment,0.001288279711264603,0.0010987172273953527
NCT01247623,Trial With Telomerase Peptide Vaccine In Combination With Temozolomide in Patients With Advanced Malignant Melanoma,0.0011301606577816907,0.0013341692368101967
NCT01274338,Ipilimumab or High-Dose Interferon Alfa-2b in Treating Patients With High-Risk Stage III-IV Melanoma That Has Been Removed by Surgery,0.001124868733719886,0.0013146331575955071
NCT01209676,IMCgp100 in Advanced Unresectable Melanoma,0.0010036697603779633,0.0007846514051852733
NCT01264731,Combination Therapy of Topical Imiquimod Plus Multipeptide Vaccination for Cutaneous Metastases of Melanoma,0.0007183612294272023,0.0008617744646342245
NCT01264081,Lapatinib in Stage IV Melanoma With ERBB4 Mutations,0.0011909212053981808,0.001195761522181759
NCT01278940,Trial of Vaccine Therapy With mRNA- Transfected Dendritic Cells in Patients With Advanced Malignant Melanoma,0.0012175291793690072,0.0009822312602475486
NCT01258855,Aldesleukin With or Without Ziv-Aflibercept in Treating Patients With Stage III-IV Melanoma That Cannot Be Removed by Surgery,0.0010879967485385672,0.0012713501255018477
NCT02941744,A Clinical Trial: Adjuvant Low-dose Ipilimumab + Nivolumab After Resection of Melanoma Macrometastases,0.0007414279609953307,0.0008341630248347617
NCT02990416,A-dmDT390-bisFv(UCHT1) Fusion Protein With Ionizing Radiation and Pembrolizumab for the Treatment of Stage IV Melanoma,0.0008427890416354895,0.000949294211837867
NCT02990611,Real-Life Efficacy and Safety of Nivolumab Monotherapy or in Combination With Ipilimumab in Patients With Advanced (Unresectable or Metastatic) Melanoma,0.0011771305566384838,0.0011395803905260922
NCT02917473,Comparison of Two Strategies for Counseling Skin Examination and Sun Protection in First-degree Relatives of Patients With Melanoma,0.0009411583972689686,0.0008827813465334194
NCT02907827,Whole-body DW-MRI and cfDNA Analysis for the Surveillance of Melanoma Patients at High Risk for Recurrence.,0.0009935151913433864,0.0006759773408559497
NCT02907086,Circulating Tumor Material in Colorectal Cancer and Melanoma,0.0010695279191272355,0.0010489129460763084
NCT02975700,A Study of PLX3397 in Patients With Unresectable or Metastatic KIT-mutated Melanoma,0.001288609191687146,0.0013325055576979702
NCT02938728,Definition of an Immune Signature Predictive of Anti-PD1 (Programmed Death-1) Antibody in the Treatment of Advanced Melanoma,0.0008243413619569469,0.0012734439198558716
NCT02981303,Study of Imprime PGG and Pembrolizumab in Advanced Melanoma and Triple Negative Breast Cancer,0.0009458476879039166,0.001104117394677076
NCT02902029,Evaluating the Efficacy and Safety of a Sequencing Schedule of Cobimetinib Plus Vemurafenib Followed by Immunotherapy With an Anti- PD-L1 Antibody in Patients With Unresectable or Metastatic BRAF V600 Mutant Melanoma,0.0010363197735759238,0.0009925669492203421
NCT02970981,Study of Combination of Ipilimumab and Nivolumab in Patients With Melanoma,0.001214651251163721,0.0013553785116028328
NCT02909348,Immunophenotyping of Melanoma Patients on Treatment With Pembrolizumab,0.0011347873939245594,0.0010350713329541792
NCT02939300,Ipilimumab and Nivolumab in Leptomeningeal Metastases From Melanoma,0.0009149179529810021,0.0010650796886354406
NCT02994498,DCB-BO1301 for Advanced Melanoma,0.0016929682068813478,0.0012901544788759634
NCT02978625,Talimogene Laherparepvec and Nivolumab in Treating Patients With Refractory Lymphomas or Advanced or Refractory Non-melanoma Skin Cancers,0.0011035736805314732,0.0012551174873332014
NCT02905266,A Safety and Efficacy Study of Multiple Administration Regimens for Nivolumab Plus Ipilimumab in Subjects With Melanoma,0.00089707453386246,0.001014374163518702
NCT02989064,"MAGE-A10ᶜ⁷⁹⁶T for Urothelial Cancer, Melanoma or Head and Neck Cancers",0.0010421751873831635,0.0009012372869809371
NCT02965716,Talimogene Laherparepvec and Pembrolizumab in Treating Patients With Stage III-IV Melanoma,0.0013494437161882334,0.0013484032097980817
NCT02962947,MELABLOCK: A Clinical Trial on the Efficacy and Safety of Propranolol 80 mg in Melanoma Patients,0.0012204330631640013,0.0011586275795735447
NCT02974803,Concurrent Dabrafenib and Trametinib With Sterotactic Radiation in Patients With BRAF Mutation-Positive Malignant Melanoma and Brain Metastases,0.0010094910728384243,0.0009535227133426287
NCT02993315,Melanoma Patients Immunized With Natural DenDritic Cells,0.0015526887861715309,0.0011192158778215585
NCT02915666,A Clinical Trial of Patients With Melanoma,0.0015340150073470031,0.0011173657980811335
NCT02983006,Study of DS-8273a With Nivolumab in Unresectable Stage III or Stage IV Melanoma,0.0010164508129813176,0.001111036241310625
NCT02910557,Postmarketing Prospective Study of Melanoma Patients Treated With IMLYGIC® to Characterize Risk of Herpetic Infection,0.0012082189775871324,0.001099463749145916
NCT02967692,"A Study of the Anti-PD1 Antibody PDR001, in Combination With Dabrafenib and Trametinib in Advanced Melanoma",0.0009533065548264777,0.0009835459898731248
NCT02908672,A Study of Atezolizumab Plus Cobimetinib and Vemurafenib Versus Placebo Plus Cobimetinib and Vemurafenib in Previously Untreated BRAFv600 Mutation-Positive Participants With Metastatic or Unresectable Locally Advanced Melanoma,0.00097784289725248,0.0009358325259698938
NCT02507947,SPECTAmel: Screening Patients With Melanoma Tumors for Efficient Clinical Trial Access,0.0010942341499211178,0.0010063564403177336
NCT02507076,Isolated Limb Perfusion With Melphalan in Treating Patients With Stage IIIB-IV Melanoma or Sarcoma,0.0010206454386756526,0.0011398702593284113
NCT02519322,Neoadjuvant and Adjuvant Checkpoint Blockade in Patients With Clinical Stage III or Oligometastatic Stage IV Melanoma,0.001131463771448268,0.001160537120826499
NCT02573259,"A Dose Escalation Study Of PF-06801591 In Melanoma, Head And Neck Cancer (SCCHN), Ovarian, Sarcoma, Hodgkin Lymphoma or Other Solid Tumors",0.0008198406790119306,0.0007910947665575293
NCT02508909,Videoscopic Ilioinguinal Lymphadenectomy for Melanoma,0.0014506189293849111,0.0006726198849822156
NCT02545075,A Comparative Study in Chinese Subjects With Chemotherapy Naïve Stage IV Melanoma Receiving Ipilimumab (3 mg/kg) vs. Dacarbazine,0.000853653756275923,0.0010212304192088783
NCT02553642,Relationship Between Tumor Mutation Burden and Predicted Neo-antigen Burden in Patients With Advanced Melanoma or Bladder Cancer Treated With Nivolumab or Nivolumab Plus Ipilimumab (CA209-260),0.0010967538464619548,0.0010736741216647986
NCT02537600,Vemurafenib and Cobimetinib Combination in BRAF Mutated Melanoma With Brain Metastasis,0.0008098435113459456,0.00113685193700106
NCT02511119,Application of Genomic Techniques and Image Processing Using Artificial Intelligence to Obtain a Predictor Model Risk of Melanoma,0.000696853425247771,0.0007490851511742536
NCT02574377,myDC/pDC in Stage III Melanoma Patients,0.0016727462566609114,0.0012034292513998426
NCT02574533,Pilot Study of Vigil™ + Pembrolizumab for Advanced Melanoma,0.0010125913442231465,0.0012536841021653024
NCT02509598,"A Study Comparing Lymphoseek® and Vital Blue Dye as Lymphoid Tissue Targeting Agents in Pediatric Patients With Melanoma, Rhabdomyosarcoma, or Other Solid Tumors Who Are Undergoing Lymph Node Mapping",0.0010944508481502229,0.0009373589871999554
NCT02565992,Phase I Study of Intratumoral CAVATAK™ and Pembrolizumab in Subjects With Advanced Melanoma,0.0011560774855946879,0.001014027102771911
NCT02599402,Nivolumab Combined With Ipilimumab Followed by Nivolumab Monotherapy as First-Line Treatment for Patients With Advanced Melanoma,0.001145603988418555,0.0013287875211664536
NCT02506153,"High-Dose Recombinant Interferon Alfa-2B, Ipilimumab, or Pembrolizumab in Treating Patients With Stage III-IV High Risk Melanoma That Has Been Removed by Surgery",0.0011275686788602898,0.0011208315493833644
NCT02581228,"Multi-Centre, Retrospective, Open Label Study, to Validate ML-PrediCare by Patients With Melanoma Under 1st and 2nd Lines of Immunotherapy",0.0011441083055790883,0.0011049759284864336
NCT02562625,Trial of Pembrolizumab and Radiotherapy in Melanoma,0.0010785229411146087,0.001092299782270548
NCT02575404,GR-MD-02 Plus Pembrolizumab in Melanoma Patients,0.0015576092866015443,0.0019076887945290075
NCT02501551,"Regorafenib, C-kit Mutated Malignant Melanoma, 2nd Line Therapy",0.0008973353531635346,0.000815140789629685
NCT02523313,Immunotherapy With Nivolumab or Nivolumab Plus Ipilimumab vs. Double Placebo for Stage IV Melanoma w. NED,0.0008680459020376191,0.0008196901019685101
NCT02587650,Trial of TKF Inhibition in Unresectable Stage III/IV BRAF/NRAS WT Melanoma,0.0009926289321846216,0.0010802062288726856
NCT00685750,Expression Analysis of Specific Markers in Non-small Cell Lung Cancer or Melanoma,0.0007247398811463303,0.00104036116394775
NCT00626405,Bevacizumab and Temozolomide or Bevacizumab and Paclitaxel Albumin-Stabilized Nanoparticle Formulation and Carboplatin in Treating Patients With Stage IV Malignant Melanoma That Cannot Be Removed by Surgery,0.0010956546127876788,0.0011252719388582385
NCT00626860,The Use of Dendritic Cell/Tumor Hybridomas as a Novel Tumor Vaccine in Patients With Advance Melanoma,0.0011279338872468997,0.0013966715747139565
NCT00616564,Phase II Trial of (IL-2) With Priming and (GM-CSF) in Patients With Advanced Melanoma,0.0016872753789608722,0.001253341837433527
NCT00667901,Riluzole in Treating Patients With Stage III or Stage IV Melanoma That Can Be Removed by Surgery,0.0011726180388929159,0.0013087843497081749
NCT00667082,"NPI-0052 and Vorinostat in Patients With Non-small Cell Lung Cancer, Pancreatic Cancer, Melanoma or Lymphoma",0.000967037042677423,0.0006706741876034365
NCT00667953,Study of Temzolomide and Gleevec in Advanced Melanoma,0.0011306015423038318,0.001177183742283012
NCT00623766,Evaluation of Tumor Response to Ipilimumab in the Treatment of Melanoma With Brain Metastases,0.0008193658009906513,0.0014466073941620955
NCT00636168,Efficacy Study of Ipilimumab Versus Placebo to Prevent Recurrence After Complete Resection of High Risk Stage III Melanoma,0.0009135698613182459,0.0008391347326232111
NCT00673361,"Pilot Trial of ""Chemo-Switch"" Regimen to Treat Advanced Melanoma",0.000954748714604975,0.0009549389444929551
NCT00610311,Anti-gp100 Cells Plus ALVAC gp100 Vaccine to Treat Advanced Melanoma,0.0008784807275135109,0.0011834791434730306
NCT00610857,Safety and Efficacy of Combination HDI and Anti-CTLA4 for Recurrent Inoperable Stage III or Stage IV Melanoma,0.001107969672632554,0.0009618100526999561
NCT00625768,Study of AS1409 in Patients With Either Metastatic Renal Cell Carcinoma or Metastatic Malignant Melanoma,0.0011601062376857115,0.0011753202080042413
NCT00683670,Dendritic Cells (White Blood Cells) Vaccination for Advanced Melanoma,0.000873152981443003,0.0010867712370907009
NCT00665470,Chemotherapy Followed by gp100 Lymphocytes and Aldesleukin to Treat Melanoma,0.0007606048306126702,0.0012948532814306395
NCT00672542,Immunotherapy of Melanoma With Tumor Antigen RNA and Small Inhibitory RNA Transfected Autologous Dendritic Cells,0.0008069811605179233,0.0010354295537792157
NCT00672321,"Answering Questions About Vitamin D Supplementation and Sun Exposure in Patients Who Have Undergone Surgery for Stage IB, Stage II, or Stage IIIA Melanoma",0.0009952293657387494,0.0007257494420971569
NCT00669019,Saracatinib in Treating Patients With Stage III or Stage IV Melanoma That Cannot Be Removed By Surgery,0.0011717237648243976,0.0012101297825794857
NCT00658892,Monoclonal Antibody Therapy in Treating Patients With Stage IV Melanoma,0.0013426054112444545,0.0009157039738185075
NCT00658437,CY503 for the Treatment of Malignant Melanoma Stage IV After Failure of Prior Therapy,0.0010226607324252696,0.0012330892755483003
NCT00651703,Safety and Immunogenicity of CYT004-MelQbG10 Vaccine With and Without Adjuvant in Advanced Stage Melanoma Patients,0.0010888384711512133,0.0011982070981749712
NCT00612222,Anti-MART-1 F5 Cells Plus ALVAC MART-1 Vaccine to Treat Advanced Melanoma,0.0009939957539743674,0.00118786951625107
NCT00612664,"Phase II, 2nd Line Melanoma - RAND Monotherapy",0.0014551920819305382,0.0011468101945897517
NCT00675727,Safety Study of CADI-05 in Patients With Advanced Stage Melanoma,0.0013417718460997559,0.0012495936869760613
NCT00688090,Safety and Immune Response to a Multi-component Immune Based Therapy (MKC1106-MT) for Patients With Melanoma.,0.0010155882688154992,0.0010669411701797228
NCT00601861,Effect of rIL-21 on Metastases in Lymph Nodes in Melanoma Skin Cancer,0.0007571412353350489,0.0007357517884961811
NCT00661336,A Phase I Trial of Normothermic Isolated Limb Infusion (ILI) With Melphalan Plus Buthionine Sulfoximine (BSO) in Patients With Locally Advanced Malignant Melanoma,0.001056948841511512,0.0010435298140199026
NCT00602576,Temozolomide and Sorafenib in Treating Patients With Metastatic or Unresectable Melanoma,0.0010777594624882248,0.0010570952533592401
NCT00615095,Differential Risks for Melanoma: p16 and DNA Repair,0.0014506528774767117,0.0007819431915348058
NCT00615160,PTK/ZK in Disseminated Malignant Melanoma,0.001450693722745973,0.0009455037214076147
NCT00698100,"Vaccination of AJCC Stage IIB, IIC, III and IV Melanoma Patients With Human and Mouse Tyrosinase DNA Vaccines",0.0010993898211564754,0.0010174491621203429
NCT00671554,Trial of Melaxin Cancer Vaccine Plus Bacillus Calmette-Guerin (BCG) to Treat Malignant Melanoma,0.001028313937268623,0.0010890165301208306
NCT00671918,Trial of Lymphoseek in Intraoperative Localization of Lymph Nodes in Breast Cancer and Melanoma,0.000704666935298876,0.0006291982831314205
NCT00398073,"Vaccine Therapy in Treating Patients With Stage IIB, Stage IIC, Stage III, or Stage IV Melanoma",0.001217411230587593,0.0011961102175145353
NCT00349206,"Sorafenib and Temsirolimus in Treating Patients With Metastatic, Recurrent, or Unresectable Melanoma",0.0010634799689310391,0.0010572094427446404
NCT00306553,Safety and Immunogenicity of a Melan-A VLP Vaccine in Advanced Stage Melanoma Patients,0.001112280800368296,0.0012280420970564503
NCT00306566,Safety and Immunogenicity of a Melan-A VLP Vaccine in Early Stage Melanoma Patients,0.0010921049957352447,0.0011293959773126018
NCT00306514,Safety and Immunogenicity of a Melan-A VLP Vaccine in Advanced Stage Melanoma Patients,0.001112280800368296,0.0012097315898125871
NCT00358319,Phase I/II Trial of Valproic Acid and Karenitecin for Melanoma,0.001022425829792442,0.001046540681891098
NCT00383292,A Study of LY573636 in Treating Patients With Malignant Melanoma,0.001755885322770282,0.0013180033434836392
NCT00383851,Randomized Trial of ATN-224 and Temozolomide in Advanced Melanoma,0.0009758146447826926,0.0011406968014290918
NCT00328861,Natural Killer Cells Plus IL-2 Following Chemotherapy to Treat Advanced Melanoma or Kidney Cancer,0.0008584392968126742,0.0013898988880542444
NCT00346008,Studying Genes to Identify Melanoma in Patients in Iceland and Their Family Members,0.0015261906849186413,0.0008544172828202019
NCT00368615,Characterization of the Melanoma-Specific Immune Response,0.0008525956057258961,0.0010241914751895906
NCT00370136,Sentinel Node With Ultrasound Contrast in Melanoma,0.0008310467036407313,0.0005374269792572794
NCT00350597,GM-CSF as Adjuvant Therapy of Melanoma,0.0014551206522656196,0.0008805410787366355
NCT00348088,Melanoma Biomarker Study,0.001271736012242769,0.0009254290428558503
NCT00304200,Temodar and Sutent as Therapy for Melanoma,0.0008951160247837145,0.0009800529734690507
NCT00397982,Temsirolimus and Bevacizumab in Treating Patients With Stage III or Stage IV Malignant Melanoma,0.001167886111418585,0.001033541199426766
NCT00394134,Targeted Intervention for Melanoma Prevention,0.0010244335151624448,0.0007030845619424592
NCT00365937,Immunization of Disease-Free Melanoma Patients With Different HLA-A2 Peptides,0.0010737927390736457,0.0008956882764064031
NCT00356460,Safety and Efficacy Study of GC1008 to Treat Renal Cell Carcinoma or Malignant Melanoma,0.0012560158978572986,0.0009183451670174951
NCT00313235,Combined Modality Treatment for Patients With Stage IV Melanoma,0.001341981395559125,0.0012738279021439391
NCT00387751,Bevacizumab and Sorafenib in Treating Patients With Unresectable Stage III or Stage IV Malignant Melanoma,0.0011604931183225014,0.0010568139531487153
NCT00391300,Bioelectric Field Imaging in Diagnosing Melanoma and Other Skin Cancers in Patients With Skin Lesions,0.0009605240326141445,0.0007467571027874316
NCT00341991,Molecular Epidemiology of Cutaneous Malignant Melanoma,0.0010248935585762304,0.0007449174919403603
NCT00357461,Ipilimumab With or Without Vaccine Therapy in Treating Patients With Previously Treated Stage IV Melanoma,0.0012507600137373683,0.0012188197211792367
NCT00395070,A Phase 3 Pivotal Trial Comparing Allovectin-7® Alone vs Chemotherapy Alone in Patients With Stage 3 or Stage 4 Melanoma,0.0011748836045864764,0.0011514474399412535
NCT00300612,Vaccine Treatment for Advanced Malignant Melanoma,0.0010375597907212606,0.0014088427516756978
NCT00390338,Vaccine Therapy in Treating Patients With Stage III or Stage IV Melanoma,0.0012898380975264656,0.0012379529865871564
NCT00317759,Fludarabine Followed By Adoptive Immunotherapy in Treating Patients With Stage IV Melanoma,0.0011651184659548614,0.0013253478680256788
NCT00327600,Safety and Efficacy Trial of Imexon Plus DTIC in Advanced Malignant Melanoma,0.0009709174800171403,0.00106827387813135
NCT00339222,Family Study of Melanoma in Italy,0.0014491462581061002,0.0007370474081623207
NCT00324155,Dacarbazine and Ipilimumab vs. Dacarbazine With Placebo in Untreated Unresectable Stage III or IV Melanoma,0.0008440436681153037,0.000981291951451807
NCT00324727,Hepatic Arterial Infusion With Melphalan Compared With Standard Therapy in Treating Patients With Unresectable Liver Metastases Due to Melanoma,0.0010227481142789706,0.0010776046618467885
NCT00323206,Phase I Trial of Intratumoral pIL-12 Electroporation in Malignant Melanoma,0.0010292963106361959,0.0010383161180143074
NCT00791271,Parallel Phase I/II Trial of Decitabine and Peg-Interferon in Melanoma: Phase I Portion,0.0008400930567910673,0.0009039153716202052
NCT00723710,Effect of Proactive Management of Side Effects on Treatment Compliance in Malignant Melanoma Patients on High-dose Intron A Therapy (Study P04600),0.0011153654354874646,0.0009996815971674608
NCT00794235,Monocentric Pilot Study Investigating the Metabolic Activity of Melanoma in Vivo During Sorafenib and Dacarbazine,0.0008518755092589717,0.0009596782232017279
NCT00790010,Bevacizumab Plus Ipilimumab in Patients With Unresectable Stage III or IV Melanoma,0.001154205367582515,0.001131904441744894
NCT00746746,A Phase II Study of an Anti-Tumor Immunotherapy Regimen Comprised of Pegylated Interferon-Alpha 2b and HyperAcute Melanoma Vaccine for Subjects With Advanced Melanoma,0.0009285172613512238,0.0009732516953638085
NCT00749684,Efficacy and Safety of High-dose Interferon Alfa-2b (Intron A®) for the Adjuvant Treatment of Malignant Melanoma (Study P04083),0.0009007135521226305,0.000839448125239933
NCT00716495,"Safety and Pharmacodynamic Study of a New Formulation, AGI - 101H Vaccine in the Treatment of Advanced Melanoma",0.0009933960332054483,0.0010277701345214442
NCT00726739,Aldesleukin With or Without Vaccine Therapy in Treating Patients With Stage IV Melanoma,0.0012042501355946286,0.001183431222473423
NCT00733798,A Safety and Efficacy Study of Intravenous 131I-TM601 in Adult Patients With Malignant Melanoma,0.001393181359893279,0.0015910526387742157
NCT00700882,"Dasatinib in Treating Patients With Locally Advanced or Metastatic Mucosal Melanoma, Acral Melanoma, or Vulvovaginal Melanoma That Cannot Be Removed By Surgery",0.0011081311520957002,0.0010434716419966722
NCT00769704,Efficacy and Safety Study of Talimogene Laherparepvec Compared to Granulocyte Macrophage Colony Stimulating Factor (GM-CSF) in Melanoma,0.0010121204396575261,0.001116062327589292
NCT00796445,"A Phase III Study to Test the Benefit of a New Kind of Anti-cancer Treatment in Patients With Melanoma, After Surgical Removal of Their Tumor",0.0011402814988369983,0.001128782258461837
NCT00707161,Radiation Therapy and Concurrent Cisplatin Chemotherapy for Locally Advanced or Metastatic Malignant Melanoma,0.0008479494867006455,0.0011203359871895715
NCT00788775,"Nilotinib in TKI Resistant or Intolerant Patients With Metastatic Mucosal, Acral, or Chronically Sun Damaged Melanoma",0.0009881087385026233,0.0009435223993283191
NCT00755976,Sulindac and Epirubicin in Treating Patients With Metastatic Malignant Melanoma,0.001098346686044261,0.001058097888094872
NCT00706992,Anti-MART-1 F5 Lymphocytes to Treat High-Risk Melanoma Patients,0.0012415891419439037,0.0014181529851982658
NCT00722098,Comparison Study of Dendritic Cell Vaccine With and Without Cyclophosphamide to Treat Stage IV Melanoma Patients,0.0011795715553504088,0.001186378332505487
NCT00776945,Feasibility and Functionality of fPAM Imaging in Melanoma,0.0010338403225543494,0.0006545575273221014
NCT00743496,"A Phase I Trial Of The Humanized Anti-GD2 Antibody In Children And Adolescents With Neuroblastoma, Osteosarcoma, Ewing Sarcoma and Melanoma",0.0007402517138990301,0.0009470846935891158
NCT00705640,Vaccine Therapy in Treating Patients With Advanced Melanoma,0.0013781770152279035,0.0012679968138687668
NCT00729950,Study of MDX-010 in Subjects With Unresectable Stage III or Stage IV Malignant Melanoma,0.0011229631982353108,0.0011892535013552667
NCT00445783,Study of Families With Melanoma,0.0017944866535682719,0.0011070783289912798
NCT00466687,Erlotinib and Bevacizumab in Treating Patients With Stage IV Melanoma,0.0011713136175530992,0.0009810284760974968
NCT00477906,M-Vax + Low Dose Interleukin-2 Versus Placebo Vaccine in Metastatic Melanoma in Patients With Stage IV Melanoma,0.0010480077815819844,0.0013558194646852344
NCT00450255,VEGF Trap in Treating Patients With Recurrent Stage III or Stage IV Melanoma That Cannot Be Removed by Surgery,0.001171723764824398,0.0010920570604009445
NCT00450593,Identifying Gene Mutations in Patients With Melanoma and in Families With a History of Hereditary Melanoma,0.0012128752439638725,0.0011066352405797264
NCT00457418,High-Dose PEG-Intron Pharmacokinetic Study in Patients With Melanoma (Study P04831 AM2),0.0011405999030910362,0.0011472370277635965
NCT00492505,"Sorafenib, Tamoxifen, and Cisplatin in Treating Patients With High-Risk Stage III Melanoma",0.0010481148232250402,0.0010462787433368126
NCT00412828,A Phase I/II Study of CR011-vcMMAE in Subjects With Unresectable Stage III or Stage IV Melanoma,0.0010401626931369258,0.0009974786078181508
NCT00409383,Abraxane and Temodar Plus Genasense in Advanced Melanoma,0.0008439078255343922,0.0009949060624796844
NCT00429312,A Study of Recombinant Vaccinia Virus to Treat Malignant Melanoma,0.0010061130733471217,0.0013983447964816724
NCT00472459,PDT With Metvix® 160 mg/g Cream in Organ Transplant Recipients With Non-melanoma Skin Cancer,0.0007396997864632829,0.0009511742342754088
NCT00463892,High-resolution Magnetic Resonance Imaging (MRI) Scans to Look for Spread of Melanoma to Nearby Lymph Nodes,0.0007129427886265216,0.0009434575054123611
NCT00424515,Imatinib in Patients With Mucosal or Acral/Lentiginous Melanoma,0.0012150570753340644,0.0009299093259667956
NCT00436605,Dasatinib in Treating Patients With Stage III Melanoma That Cannot Be Removed By Surgery or Stage IV Melanoma,0.001172556826114719,0.001152567469834906
NCT00462280,Lovastatin in Treating Patients At High Risk of Melanoma,0.0012180482860776052,0.001403255821813604
NCT00462423,"Abraxane and Avastin as Therapy for Patients With Malignant Melanoma, a Phase II Study",0.001174437376693247,0.0010711025178161678
NCT00462982,Sunitinib in Treating Patients With Brain Metastases Caused by Kidney Cancer or Melanoma,0.001081969403387478,0.0011407933983300777
NCT00447356,High-Dose Interferon Alfa in Treating Patients With Stage II or StageIII Melanoma,0.0010866734877862994,0.0009534766157807873
