nct_id,brief_title,page_rank_score_brief_title,page_rank_score_brief_title_summary_combined
NCT01028222,A Study of AMNN107 in the Treatment of Metastatic and/or Inoperable Melanoma Harboring a c-Kit Mutation,0.000981054644955052,0.0014249483744998728
NCT01010984,LC Bead Embolization Agent With Doxorubicin in the Treatment Liver Metastasis From Melanoma,0.0007464213316033081,0.0011076576680699504
NCT01021059,A Phase I Study of Intravenous Recombinant Human IL-15 in Adults With Refractory Metastatic Malignant Melanoma and Metastatic Renal Cell Cancer,0.0008726786234929842,0.0014647724334646973
NCT01024231,Dose-escalation Study of Combination BMS-936558 (MDX-1106) and Ipilimumab in Subjects With Unresectable Stage III or Stage IV Malignant Melanoma,0.0010715677570289908,0.0011212384900552137
NCT01002560,The Identification of Novel Prognostic Markers in Melanoma,0.0008455104576009511,0.0010162882497313733
NCT01077050,SciBase International Melanoma Pivotal Study,0.0017944866535682719,0.000784061311249855
NCT01005472,Temozolomide and Sunitinib Malate in Treating Patients With Stage III or Stage IV Malignant Melanoma,0.0011752090722181637,0.0011256678524741851
NCT01092585,Tesetaxel as Second-line Therapy for Patients With Advanced Melanoma and Normal Serum LDH,0.0010922182957907999,0.0010758725463501984
NCT01092728,"Treatment With Dasatinib in Patients With Acral Lentiginous, Mucosal, or Chronic Sun-damaged Melanoma",0.0010013875509312167,0.0011901063291157726
NCT01011530,Dose Escalation Study of MLN4924 in Adults With Melanoma,0.0017944866535682719,0.001162787581803072
NCT01009775,A Study of YM155 Plus Docetaxel in Subjects With Stage III (Unresectable) or Stage IV Melanoma,0.0010426917529060757,0.0012032421331692378
NCT01079741,Safety Study of Adjuvant Vaccine to Treat Melanoma Patients,0.0014096932219285303,0.0011090417176203918
NCT01066390,A Study on the Safety and Immunogenicity of Combined Intradermal and Intravenous Administration of an Autologous mRNA Electroporated Dendritic Cell Vaccine in Patients With Previously Treated Unresectable Stage III or IV Melanoma,0.0011758194110810896,0.001248888775418559
NCT02425475,FLuorescence Identification of Melanoma by a Multicenter Based Algorithm (FLIMMA),0.0010273913278815788,0.0004973231222744506
NCT02425306,Safety Study of a Helper Peptide Vaccine Plus Adjuvant Combinations for the Treatment of Melanoma,0.0009777686251974324,0.0010272231367727217
NCT02400385,A Phase II Trial of Sunitinib and Nivolumab for KIT-mutated Advanced Melanoma,0.0009762468406793076,0.0010229867656943177
NCT02442466,Proof of Concept Study With an Endothelin Receptor B Inhibitor (BQ-788) for Human Melanoma,0.0008896377871237825,0.0008162948571850473
NCT02457065,Skin Care Behaviors Among Melanoma Survivors and Their Families,0.0010224463012528746,0.000745962285291775
NCT02410733,Evaluation of the Safety and Tolerability of i.v. Administration of a Cancer Vaccine in Patients With Advanced Melanoma,0.0010666399546273712,0.0013602356771626372
NCT02410863,Biopsy- and Biology-driven Optimization of Targeted Therapy in Subjects With Advanced Melanoma,0.0008446958828041893,0.0010809342402018712
NCT02437279,Study to Identify the Optimal Adjuvant Combination Scheme of Ipilimumab and Nivolumab in Melanoma Patients,0.0011686323757303973,0.0013153589098163956
NCT02437305,Melanoma Perception and Health Literacy in People of Color,0.0008280903420839399,0.0006759488260918263
NCT02437136,Ph1b/2 Dose-Escalation Study of Entinostat With Pembrolizumab in NSCLC With Expansion Cohorts in NSCLC and Melanoma,0.0009081553240468161,0.0009574757924828177
NCT02492815,"PAN-EU Utilization, Effectiveness and Safety of Ipilimumab Administered in EAP Patients With Advanced Melanoma",0.0011286185954261926,0.0012669234527899983
NCT02452424,A Combination Clinical Study of PLX3397 and Pembrolizumab To Treat Advanced Melanoma and Other Solid Tumors,0.0009670280928882957,0.0011959175242889537
NCT02452294,Buparlisib in Melanoma Patients Suffering From Brain Metastases (BUMPER),0.0010730026673805096,0.0010380620073963277
NCT02452281,Pilot Study to Evaluate the Effects of a Vaccine (HSPPC-96) Combined With Ipilimumab in Patients With Advanced Melanoma,0.0012459619625664257,0.0013936639252262785
NCT02470273,Diagnostic Imaging Study for the Melanoma Advanced Imaging Dermatoscope (mAID),0.0009994351840946585,0.0007793862278234079
NCT02402699,Ipilimumab 60-month Pharmacovigilance Protocol for Advanced Melanoma Patients Who Are Hepatitis B and/or Hepatitis C Virus Positive in Taiwan,0.0010884023337558266,0.0007743164799243996
NCT02427893,Trial of Vemurafenib and Cobimetinib in Patients With Advanced BRAFV600 Mutant Melanoma,0.001189493558938727,0.0009066354234731641
NCT02434354,A Tissue Collection Study of Pembrolizumab (MK-3475) in Subjects With Resectable Advanced Melanoma,0.000954446203621292,0.0009795737021075655
NCT02434107,"Complete Lymph Node Dissection vs Watchful Waiting in Patients With Malignant Melanoma (Thickness of 1,0mm+ and Evidence of Metastases in the Sentinel Node)",0.0009659779448980883,0.000831355777012943
NCT02413827,A Study of Varlilumab (Anti-CD27) and Ipilimumab and CDX-1401 in Patients With Unresectable Stage III or IV Melanoma,0.0012341821705562645,0.0012085767561838504
NCT02403778,Ipilimumab and All-Trans Retinoic Acid Combination Treatment of Stage IV Melanoma,0.0009119695577736886,0.0013334998242016552
NCT02460068,A Study of Fotemustine(FTM) Vs FTM and Ipilimumab (IPI) or IPI and Nivolumab in Melanoma Brain Metastasis,0.000971951670688232,0.001029784285325234
NCT02451488,Neoadjuvant Granulocyte-Macrophage Colony-Stimulating Factor (GM-CSF) in Cutaneous Stage L-lll Melanoma,0.0007369542179523181,0.0007063238648674762
NCT02447939,Pharmacokinetics of Repeat Oral Doses of Dabrafenib and the Combination of Dabrafenib and Trametinib in Chinese Subjects With Melanoma,0.0008028576183734622,0.0009404054163312075
NCT02424916,Adoptive Transfer of Specific Melanoma Antigens CD8+ T Cells in Metastatic Melanoma Patients: a Phase I/II Study,0.0011048386788546968,0.0010557085431291407
NCT00101166,Universal Granulocyte-Macrophage Colony-Stimulating Factor (GM-CSF)-Producing and CD40L Expressing Bystander Cell Line for Tumor Vaccine in Melanoma,0.0006937342561218053,0.0009058941761019583
NCT00104845,"Vaccine Therapy in Treating Patients With Stage IIB, Stage IIC, Stage III, or Stage IV Melanoma",0.001217411230587593,0.0012726855526269262
NCT00104884,FR901228 in Treating Patients With Unresectable Stage III or Stage IV Malignant Melanoma,0.0012954004363712357,0.00125901134696573
NCT00104988,S0508: Thalidomide and Temozolomide in Treating Patients With Stage IV Melanoma That Cannot Be Removed By Surgery,0.0011143849235727898,0.0011320805747361024
NCT00104897,17-N-Allylamino-17-Demethoxygeldanamycin in Treating Patients With Metastatic Malignant Melanoma,0.0012611027405974974,0.0011356238486103193
NCT00121225,Vorinostat in Treating Patients With Metastatic or Unresectable Melanoma,0.0011393220376023317,0.0012015594634331302
NCT00184067,Continuation Booster Trial After a Vaccine Combining Tyrosinase/GP100/MART-1 Peptides Emulsified With Montanide ISA 51 With or Without GM-CSF for Patients With Melanoma,0.0010114073674779738,0.0010706008021708424
NCT00179608,Study of the Combination of Lenalidomide and DTIC (Dacarbazine) in Patients With Metastatic Malignant Melanoma Previously Untreated With Systemic Chemotherapy,0.0011346834731939736,0.0010441097984734786
NCT00110019,Carboplatin and Paclitaxel With or Without Sorafenib Tosylate in Treating Patients With Stage III or Stage IV Melanoma That Cannot Be Removed by Surgery,0.0011508268668223498,0.0013329660017511187
NCT00110994,Treatment for Subjects With Unresectable Stage III or Stage IV Melanoma,0.001028032856131942,0.001065096645652427
NCT00119249,Sorafenib in Treating Patients With Stage III or Stage IV Melanoma That Cannot Be Removed By Surgery,0.0011775348163280213,0.0011778698772643673
NCT00142454,NY-ESO-1 Protein Vaccine With Imiquimod in Melanoma (Adjuvant Setting),0.0007576437522171509,0.0010347940149069387
NCT00125749,Vaccination of Patients With Stage IV Melanoma With Dendritic Cells,0.0011951178589264247,0.0013493446457990758
NCT00109863,Hu14.18-Interleukin-2 Fusion Protein in Treating Patients With Advanced Melanoma,0.0013411017150511725,0.0013383897059219706
NCT00160992,Adoptive Cell Transfer Combined With Peptide Vaccination in Transiently Immunosuppressed Melanoma Patients,0.0009732528552323128,0.0008885226907640573
NCT00111007,A Treatment Combination for Patients With Unresectable Stage III or Stage IV Melanoma,0.0012232915829018109,0.0012412956262131075
NCT00111696,Study of the Tumor Saturation and Biological Activity of MEDI-522 (Abergrin) in Patients With Advanced Malignant Melanoma,0.0011842770361255354,0.0014324411251506368
NCT00128583,Vaccine Therapy in Treating Patients With Malignant Melanoma,0.0015787104876690944,0.0012662319689736956
NCT00199901,"Study of NY-ESO-1 ISCOMATRIX® in Patients With High-risk, Resected Melanoma",0.0011469180715928521,0.0012403837088679657
NCT00199342,"A Study of a Monoclonal Antibody, KW-2871, in Patients With Advanced Melanoma",0.0012256157133231406,0.0009560032568129903
NCT00118313,"Vaccine Therapy With or Without Imiquimod in Treating Patients Who Have Undergone Surgery for Stage II, Stage III, or Stage IV Melanoma",0.0011685716037513044,0.001287864254775255
NCT00118274,"Vaccine Therapy With or Without Cyclophosphamide in Treating Patients Who Have Undergone Surgery for Stage II, Stage III, or Stage IV Melanoma",0.00116953265122896,0.0013241427351916388
NCT00147550,"MEK Inhibitor PD-325901 To Treat Advanced Breast Cancer, Colon Cancer, And Melanoma.",0.0008483403885567452,0.001051874318917529
NCT00112242,Immunotherapy of Stage III/IV Melanoma Patients,0.001343113772594543,0.0010474480919428783
NCT00112216,Immunotherapy of Melanoma Patients,0.001548063200096874,0.001101351527783406
NCT00112229,Immunotherapy of HLA-A2 Positive Stage III/IV Melanoma Patients,0.0011754418362919332,0.0013739521089673936
NCT00153569,Multiepitope Peptide Vaccination in Melanoma,0.0010586668332141554,0.0008379290921173821
NCT00116363,Safety and Efficacy Study of INGN 241 Gene Therapy in Patients With In Transit Melanoma,0.0012099728932458513,0.001590213875887365
NCT00107159,Vaccine Therapy in Treating Patients With Unresected Stage III or Stage IV Melanoma,0.0012024449332157646,0.001237755623220337
NCT00108875,"Survivin Peptide Vaccination for Patients With Advanced Melanoma, Pancreatic, Colon and Cervical Cancer",0.001053808092896105,0.0012075741526059935
NCT00145041,Pharmacokinetic Study of Liposomal Vincristine in Patients With Malignant Melanoma & Hepatic Dysfunction,0.001086406633727758,0.0010426094603419034
NCT00126685,Vaccine Therapy in Treating Patients With Stage IV Melanoma,0.0013812566106214097,0.0011961460588338759
NCT00197912,Dendritic Cell Based Therapy of Malignant Melanoma,0.0011350408017754363,0.0011232209429510134
NCT02143050,"Study of Dabrafenib, Trametinib and Metformin for Melanoma Patients",0.0011508986197447117,0.001096743111605821
NCT02180061,Study of Pembrolizumab (MK-3475) in Participants With Advanced Melanoma (MK-3475-041/KEYNOTE-041),0.0011560774855946879,0.0013148094618346592
NCT02130466,A Study of the Safety and Efficacy of Pembrolizumab (MK-3475) in Combination With Trametinib and Dabrafenib in Participants With Advanced Melanoma (MK-3475-022/KEYNOTE-022),0.0009679474530005404,0.0009767953078414072
NCT02177110,A Translational Systems Medicine Approach to Provide Predictive Capacity for Therapy Response in Advanced or Metastatic Malignant Melanoma,0.0008542669753081845,0.001001445886783827
NCT02112032,Treatment of Advanced Melanoma With MK-3475 and Peginterferon,0.001018112398613034,0.0011032923802974368
NCT02166255,"APN401 in Treating Patients With Melanoma, Kidney Cancer, Pancreatic Cancer, or Other Solid Tumors That Are Metastatic or Cannot Be Removed By Surgery",0.0010496318628785849,0.001186511078743464
NCT02159066,"LGX818 and MEK162 in Combination With a Third Agent (BKM120, LEE011, BGJ398 or INC280) in Advanced BRAF Melanoma",0.0009967467885733854,0.0010691389117461262
NCT02147951,"Expanded Access Protocol of Talimogene Laherparepvec for Subjects With Unresected, Stage lllB to IVM1c Melanoma",0.0008761600893979222,0.001346475728327169
NCT02193581,Non-invasive Melanoma Assessment Using a Topical Fluorescence Reagent and Optical Imaging,0.0006995676052205524,0.0006966732151274231
NCT02106598,"Targeted Silica Nanoparticles for Image-Guided Intraoperative Sentinel Lymph Node Mapping in Head and Neck Melanoma, Breast and Gynecologic Malignancies",0.0006822781519588551,0.0009529202694814371
NCT02129075,CDX-1401 and Poly-ICLC Vaccine Therapy With or Without CDX-301in Treating Patients With Stage IIB-IV Melanoma,0.0011207186314578118,0.001254427615957938
NCT02138292,A Phase 1B Clinical Trial of Trametinib Plus Digoxin in Patients With Unresectable or Metastatic BRAF Wild-type Melanoma,0.001036118632752894,0.001320836110926654
NCT02190838,Comparison of Melatonin or Metformin and Dacarbazine Combination Versus Dacarbazine Alone in Disseminated Melanoma,0.0007178665912120895,0.0008421848009215686
NCT02120222,Evaluating SINE KPT-330 in Treating Patients With Melanoma That Cannot Be Removed By Surgery,0.0013050736048534671,0.0012440670342630407
NCT02158520,Paclitaxel Albumin-Stabilized Nanoparticle Formulation and Bevacizumab or Ipilimumab as First-Line Therapy in Treating Patients With Stage IV Melanoma That Cannot Be Removed by Surgery,0.0011197328244530041,0.001340390298833773
NCT02156804,"A Single-Arm, Open-Label, Multicenter Clinical Trial With Nivolumab (BMS-936558) for Subjects With Histologically Confirmed Stage III (Unresectable) or Stage IV Melanoma Progressing Post Prior Treatment Containing an Anti-CTLA4 Monoclonal Antibody (CheckMate 172)",0.0008819586244076742,0.0010328917015672552
NCT02196181,Dabrafenib and Trametinib in Treating Patients With Stage III-IV BRAF Mutant Melanoma That Cannot Be Removed by Surgery,0.0011075611430548529,0.0012653315959522782
NCT02155322,A Phase II Study of Pegylated Interferon Alfa-2b for the Adjuvant Treatment of Melanoma Subjects in Russia (MK-4031-400),0.001079944820677882,0.001760011629694004
NCT02115243,Trial of Neoadjuvant Ipilimumab Followed by Melphalan Via Isolated Limb Infusion for Patients With Unresectable In-transit Extremity Melanoma,0.0010300959384444057,0.0011470497333735965
NCT02115139,GEM STUDY: Radiation And Yervoy in Patients With Melanoma and Brain Metastases,0.0011504594411697617,0.0011752825512478748
NCT02142218,Expanded Access Program With Nivolumab to Treat Melanoma,0.0010528156308839388,0.0011272465681133688
NCT02142335,Rituxan and Abraxane for the Treatment of Patients With Inoperable Stage III and IV Malignant Melanoma,0.001116652043450421,0.0012923417912360587
NCT02142244,Fluorescence Surgery for Sentinel Node Identification in Melanoma,0.0008895621095247616,0.0007351628706310511
NCT02145910,Vemurafenib Combined With Whole Brain Radiation Therapy or Radiosurgery in Patients With BRAF Mutation-Positive Melanoma and Brain Metastases,0.0009946955732464968,0.0011736914125320883
NCT02141542,Phase I Clinical Trial of Tremelimumab Plus MEDI3617 in Patients With Unresectable Stage III or Stage IV Melanoma,0.0011541098972577403,0.0010762123662530184
NCT01174238,A Two Arm Trial of Axitinib and Carboplatin/Paclitaxel in Melanoma (CC# 10852),0.0008376202642141999,0.0009468335136614438
NCT01120275,Gamma-Secretase/Notch Signalling Pathway Inhibitor RO4929097 in Treating Patients With Stage IV Melanoma,0.0013397156589239094,0.0011593795371560467
NCT01106040,Breast and Melanoma Trial With Lymphoseek to Identify Lymph Nodes,0.0008393379138480989,0.0006014520070045292
NCT01127594,Evaluate Safety/Tolerability Intra-Arterial Temozolomide in Patients w/Extremity Melanoma by Isolated Limb Infusion,0.0009859089705879988,0.0012298955790336847
NCT01127451,Study of Denileukin Diftitox in Patients With Stage IIIC and Stage IV Melanoma,0.00124211147963722,0.0013195975790028325
NCT01189383,"IL15 Dendritic Cell Vaccine for Patients With Resected Stage III (A, B or C) or Stage IV Melanoma",0.0011710266848390545,0.0012984095426053107
NCT01183936,Trial of Surgical Excision Margins in Thick Primary Melanoma,0.0010968572734142042,0.0009696151070932326
NCT01138410,Study of a DNA Immunotherapy to Treat Melanoma,0.001276831656225399,0.001123975264289813
NCT01133977,E7080 (Lenvatinib) in Combination With Dacarbazine Versus Dacarbazine Alone as First Line Therapy in Patients With Stage IV Melanoma,0.00107144543717586,0.0008654666090406395
NCT01191294,Evaluation of a Simulation Training Tool to Identify Lesions Requiring Further Screening for Melanoma,0.0007115529884156644,0.0005040703522221663
NCT01121718,NIR-Guided Sentinel Lymph Node Mapping in Melanoma,0.001024522040563307,0.000770244472595581
NCT01107665,Pazopanib and Paclitaxel as First-Line Treatment for Subjects With Unresectable Stage III and Stage IV Melanoma,0.0008776463194138934,0.0011270567512536547
NCT01134614,Ipilimumab With or Without Sargramostim in Treating Patients With Stage III or Stage IV Melanoma That Cannot Be Removed by Surgery,0.0011988133420595304,0.0011467737808879593
NCT01137006,"An Open-Label, Dose-Escalation Study of IMC-20D7S In Patients With Malignant Melanoma",0.0013953527529665505,0.0013084047819305097
NCT01124734,High Dose Interleukin-2 Followed by Intermittent Low Dose Temozolomide in Patients With Melanoma,0.0009916260905652985,0.0009979414564292113
NCT01118832,Using High Resolution Function Imaging To Detect Melanoma and Dysplastic Nevi,0.0007173035974478661,0.0005836693986232439
NCT01168050,Efficacy of Nilotinib in First or Second Line Treatment of Primary Melanomas Stage III Unresectable Melanomas.,0.0008676593205594657,0.0008864204490676119
NCT01176474,Vaccine Combining Multiple Class I Peptides and Montanide ISA 51VG With Escalating Doses of Anti-PD-1 Antibody Nivolumab or Ipilimumab With Nivolumab For Patients With Resected Stages IIIC/ IV Melanoma,0.0010429050634163041,0.001027304892195433
NCT01136967,"An Open-Label, 2-Cohort, Multicenter, Study of Lenvatinib in Previously Treated Subjects With Unresectable Stage III or Stage IV Melanoma",0.001005060970168292,0.001125216221482131
NCT02089685,Safety and Tolerability of Pembrolizumab (MK-3475) + Pegylated Interferon Alfa-2b and Pembrolizumab+ Ipilimumab in Participants With Advanced Melanoma or Renal Cell Carcinoma (MK-3475-029/KEYNOTE-29),0.000837008232287915,0.0009535454571699476
NCT02071940,PLX3397 KIT in Acral aNd mucOsal Melanoma,0.002777704469023434,0.0012971217406422602
NCT02039947,Study to Evaluate Treatment of Dabrafenib Plus Trametinib in Subjects With BRAF Mutation-Positive Melanoma That Has Metastasized to the Brain,0.0008909932232411559,0.0009103280265862901
NCT02068196,A National Phase IV Study With Ipilimumab for Patients With Advanced Malignant Melanoma.,0.0013663586088378853,0.0009786949310308863
NCT02054520,Immunotherapy Study for Patients With Stage IV Melanoma,0.0013303329578848943,0.0011968729650666356
NCT02009384,Ipilimumab Administered to Stage IIIC Stage IV Melanoma After Reg. T Cell Depletion With Denileukin Diftitox,0.000873533345985349,0.0009682528970261602
NCT02009397,A Phase I/II Open-Label Study of Ipilimumab and GM-CSF Administered to Unresectable Stage IIIC and Stage IV Melanoma Patients,0.0012534522273007801,0.001224388637194486
NCT02062359,T Cell Receptor Immunotherapy Targeting NY-ESO-1 for Patients With NY-ESO-1 Expressing Melanoma,0.0012522207184122716,0.0013218178203851653
NCT02094391,"Trial of Ipilimumab After Isolated Limb Perfusion, in Patients With Metastases Melanoma",0.0011238261801784495,0.00092409224362441
NCT02094872,Molecularly Targeted Therapy in Treating Patients With BRAF Wild-type Melanoma That is Metastatic,0.0012621222029328921,0.001156217201174522
NCT02036086,Study of Neo-adjuvant Use of Vemurafenib Plus Cobimetinib for BRAF Mutant Melanoma With Palpable Lymph Node Metastases,0.0008691379479318427,0.0011348338550076476
NCT02083354,Study to Investigate the Objective Response Rate of Dabrafenib in Combination With Trametinib in Subjects With BRAF V600 Mutation-Positive Melanoma,0.0008587570268472994,0.000980969968174241
NCT02056522,Non-invasive Melanoma Assessment Using a Topical Fluorescence Reagent and Optical Imaging,0.0006995676052205524,0.0006966732151274231
NCT02074605,Cognitive Effects of Interferon in Patients With Melanoma,0.0015370303906687489,0.0009688311525215448
NCT02085070,MK-3475 in Melanoma and NSCLC Patients With Brain Metastases,0.0012315400090251265,0.0013377653553674563
NCT02029729,RTA 408 in the Treatment of Advanced Solid Tumors (NSCLC & Melanoma) - DISCOVER,0.0008673408124030898,0.001023921713557102
NCT02058953,"CNS and Extracranial Tumor Tissues, CSF, and Blood From Patients With Melanoma Brain Metastases",0.0010347099948497243,0.0009724981826080547
NCT02050321,A Phase II Study of Vemurafenib Combined With Acitretin in Patients With Advanced Melanoma,0.001237508945517656,0.0010520869925425994
NCT02088762,Impact of Excision Margins on Survival and Recurrence Rate in Patients With Thick Melanoma (>2mm),0.0012192607199339402,0.0007301294041996669
NCT02077114,Vaccination With Peptides in Combination With Either Ipilimumab or Vemurafenib for the Treatment of Unresectable Stage III or IV Malignant Melanoma,0.0009125814947317997,0.001053662763681448
NCT02097732,Ipilimumab Induction in Patients With Melanoma Brain Metastases Receiving Stereotactic Radiosurgery,0.00104756089126585,0.0011568310301152648
NCT02032810,Phase I of Histone Deacetylase (HDAC) Inhibitor Panobinostat With Ipilimumab With Unresectable III/IV Melanoma,0.0008286066883191224,0.0009780602390129308
NCT02020707,Paclitaxel Albumin-Stabilized Nanoparticle Formulation and Bevacizumab in Treating Patients With Stage IV Melanoma That Cannot Be Removed by Surgery or Gynecological Cancers,0.001087202425590523,0.0012493232146455083
NCT00938223,"Evaluation of the Immunogenicity of Vaccination With Multiple Synthetic Melanoma Peptides With Granulocyte-macrophage Colony-stimulating Factor (GM-CSF)-In-Adjuvant, in Patients With Advanced Melanoma",0.001064645129278288,0.0010461368056300616
NCT00928902,"Trial for the Evaluation of the Effect of Systemic Low-dose Interleukin-2 (IL-2) on the Immunogenicity of a Vaccine Comprising Synthetic Melanoma Peptides Administered With Granulocyte-macrophage Colony-stimulating Factor (GM-CSF)-In-Adjuvant, in Patients With High Risk Melanoma",0.0009905756458039483,0.0010521318469471478
NCT00945269,"Therapeutic Autologous Lymphocytes, Aldesleukin, and Denileukin Diftitox in Treating Patients With Stage III-IV Melanoma",0.0010752487988910499,0.001100787090852717
NCT00942162,A Study to Test the Benefit of a New Anti-cancer Treatment in Patients With Unresectable Advanced Melanoma,0.0012489268548592659,0.0012274005062416617
NCT00936221,Comparison of AZD6244 in Combination With Dacarbazine Versus (vs) Dacarbazine Alone in BRAF Mutation Positive Melanoma Patients,0.0010100174800850422,0.0009701815336492229
NCT00910650,Study of Gene Modified Immune Cells in Patients With Advanced Melanoma,0.001244644861562936,0.0013265282112379431
NCT00966173,International Melanoma Algorithm Training Study - IMATS,0.001010942367759635,0.0007552249559215319
NCT00920907,Comparison of Ipilimumab Manufactured by 2 Different Processes in Participants With Advanced Melanoma,0.0008401887540272248,0.0010630347123163017
NCT00972933,Immunogenicity and Biomarker Analysis of Neoadjuvant Ipilimumab for Melanoma,0.0008125761312254852,0.0010503018123738535
NCT00901966,Sun Exposure and Melanoma in Agricultural Workers,0.0014506127259666117,0.0006920117066871585
NCT00963664,Evaluation of Interferon-Lovastatin Therapy for Malignant Melanoma,0.0008152957148749438,0.001182734055885031
NCT00963261,Quality of Life and Psychological Well-being in Patients With Malignant Melanoma,0.0012145319440191253,0.0011193768499370318
NCT00923169,Part 2 of Phase 1 Study of GC1008 to Treat Advanced Melanoma (Part 2 Will Only Accept and Treat Patients With Advanced Malignant Melanoma),0.0012191427286473578,0.0013702993516919635
NCT00978913,Transfected Dendritic Cell Based Therapy for Patients With Breast Cancer or Malignant Melanoma,0.0011359028123974371,0.001324187140175101
NCT00979693,Psilocybin-Assisted Psychotherapy for Anxiety in People With Stage IV Melanoma,0.0008403578157019742,0.0007583368322459572
NCT00940004,Toll-like Receptor (TLR) Ligand Matured Dendritic Cell Vaccination in Melanoma Patients,0.0010891189412498676,0.001099453433011905
NCT00977145,Evaluating the Safety and the Biological Effects of Intratumoral Interferon Gamma and a Peptide-Based Vaccine in Patients With Melanoma,0.0010104269596063508,0.0011718763461432834
NCT00974610,"Study of Blood Samples From Patients With Malignant Melanoma, Metastatic Breast Cancer, Advanced Lung Cancer, Pancreatic Cancer, or Colorectal Cancer. ICORG 07-12",0.00116248662939574,0.0009376519656913477
NCT00976573,"Carboplatin, Paclitaxel, and Bevacizumab With or Without Everolimus in Treating Patients With Metastatic Malignant Melanoma",0.0010023769119638334,0.0010056564438452053
NCT00912730,A Pilot Study of Intraoperative Gamma Camera Imaging During Sentinel Node Biopsy for Melanoma,0.0008918370339045954,0.000900898467884713
NCT00912418,"Pilot Study for the Evaluation of the Efficacy of Vaccination With Autologous Tumor Cells Plus Granulocyte-macrophage Colony-stimulating Factor (GM-CSF) - in - Adjuvant, Followed by Systemic Low-dose-interleukin-2 (IL-2) Administration, in Patients With High Risk Melanoma",0.0011469947924761784,0.0010197284999163162
