nct_id,brief_title,page_rank_score_brief_title,page_rank_score_brief_title_summary_combined
NCT02302105,Randomized Trial of Prostate Only or Pelvic RT in High Risk Prostate Cancer,0.000400227865395685,0.000527978239773153
NCT02364531,A Canadian Observational Study in Metastatic Cancer of the Prostate: A Study of ZYTIGA Use in the Community Urology Setting,0.00047533864698802203,0.0005436912240242387
NCT02346253,High-Dose Brachytherapy in Treating Patients With Prostate Cancer,0.0005768951207714034,0.0006363734077495377
NCT02346526,A Biomarker Study of Standard-of-care Radium-223 Chloride for Metastatic Castration-resistant Prostate Cancer,0.00047654915577332067,0.00046019097097145116
NCT02346578,Comparative Study of Alternative Antiandrogen (AA) Therapy and Early Initiating of Enzalutamide for Castration-resistant Prostate Cancer (CRPC) After Combined Androgen Blockade (CAB) Therapy.,0.00043753232104498023,0.0005549718093052422
NCT02394223,FFOCT for the Diagnosis of Prostate Cancer,0.0007098876784296392,0.0004199932304157799
NCT02342054,Single Fraction Real-time High-Dose-Rate Brachytherapy in Patients With Low and Intermediate Risk Prostate Cancer,0.00048704361443887504,0.0005860521766306307
NCT02342626,Devel. and Eval. of an Active Surveillance Decision Aid for Men With Low or Intermediate Grade Prostate Cancer,0.0003785919898415051,0.00036832474004406895
NCT02303327,Comparative Study of Radiotherapy Treatments to Treat High Risk Prostate Cancer Patients,0.0005486930292222718,0.00042653481126560017
NCT02303054,MRI-Targeted Focal Ablation of the Prostate in Men With Prostate Cancer,0.0005114414196566195,0.0005291296214210753
NCT02319837,Safety and Efficacy Study of Enzalutamide Plus Leuprolide in Patients With Nonmetastatic Prostate Cancer (EMBARK),0.0005825115548032787,0.0006723693198578706
NCT02319239,Prostate Cancer Stereotactic Radiotherapy,0.0006964903314841802,0.0005243797040549197
NCT02333435,Effects of EPA on Prostate Cancer Cells Proliferation and Quality of Life,0.0004215808507187139,0.0006293953711800711
NCT02307552,Transurethral Ultrasonic Imaging For Detection and Classification of Prostate Cancer,0.00042084892128782314,0.0004251247901208166
NCT02382094,Clinical Trial to Study Quality of Life in Prostate Cancer Patients by Randomizing Anti-androgen Versus Total Androgen Blockage Prior to Curative Intended Radiation Therapy,0.0005690371011890699,0.0005908580349696386
NCT02313298,Stereotactic Body Radiotherapy for Organ Confined Prostate Cancer,0.0004993470635094452,0.0004486806638651883
NCT02313623,MR-US Image Fusion Targeted Biopsy for Single-cell Prostate Cancer Research,0.0004218751060477286,0.00034676464022353993
NCT02353832,Stereotactic Ablative Radiotherapy (SABR) for Low Risk Prostate Cancer With Injectable Rectal Spacer,0.0003932794720653612,0.00042043080930063363
NCT02353715,"Men With Metastatic Castrate-Resistant Prostate Cancer Treated With Either Sipuleucel-T (Provenge®), Abiraterone Acetate (Zytiga®) or Enzalutamide (Xtandi®) Undergoing Cardiopulmonary EXercise Testing",0.00040772474178342645,0.0004682039779663287
NCT02353819,Stereotactic Ablative Radiotherapy (SABR) of Pelvis and Prostate Targets For High Risk Prostate Cancer,0.0004089684727726395,0.0006115192785361063
NCT02325557,ADXS31-142 Alone and in Combination With Pembrolizumab (MK-3475) in Patients With Prostate Cancer - KEYNOTE-046,0.0005115321349353054,0.0005510171057623021
NCT02326805,PROSTVAC (PSA-TRICOM) in Preventing Disease Progression in Patients With Localized Prostate Cancer Undergoing Active Surveillance,0.0005112736494268111,0.0005659908246498884
NCT02326246,MRI in Active Surveillance of Prostate Cancer,0.0007082125761873666,0.0004631876300019844
NCT02311049,Hypofractionated Radiotherapy for Prostate Cancer,0.0006984497319487539,0.0005226842653560987
NCT02311764,Carboplatin in Castration-resistant Prostate Cancer,0.00047113598698810493,0.0006594657907203419
NCT02339701,Stereotactic Body Radiotherapy vs Intensity-modulated Radiotherapy in Prostate Cancer,0.0005428607563491884,0.00049696553034868
NCT01350180,Assessing DNA Changes in High Risk Prostate Cancer to Determine Prognosis,0.0004283923355735798,0.0006350589014707531
NCT01308567,Cabazitaxel Versus Docetaxel Both With Prednisone in Patients With Metastatic Castration Resistant Prostate Cancer,0.0005446212308585723,0.0005484961643762652
NCT01308580,Cabazitaxel at 20 mg/m² Compared to 25 mg/m² With Prednisone for the Treatment of Metastatic Castration Resistant Prostate Cancer,0.00045419349833568845,0.0005125398340300527
NCT01324583,Dose Escalation Study With Cabazitaxel in Combination With Daily Prednisolone in Patients With Hormone Refractory Prostate Cancer,0.000552157364783921,0.0006165693024032752
NCT01351688,An Open Label Prostate Cancer Study in Japanese Patients,0.0006432268950375236,0.0005517383980565536
NCT01378091,Study of Lenalidomide and Docetaxel in Subjects With Androgen Independent Prostate Cancer,0.000460923082065415,0.0004989867713866079
NCT01340599,Defined Green Tea Catechin Extract in Treating Patients With Localized Prostate Cancer Undergoing Surgery,0.0005701841312323149,0.0005524392151292112
NCT01326286,Comparative Effectiveness Analysis of Surgery and Radiation (CEASAR) for Localized Prostate Cancer,0.00046360144455642597,0.0004763172261411969
NCT01326312,Effect of GTx-758 on Total and Free Testosterone Levels in Men With Prostate Cancer,0.0004182493058840459,0.0006994141775235388
NCT01385293,BKM120 in Metastatic Castration-resistant Prostate Cancer,0.0004994772176768562,0.0005365501588079482
NCT01385059,Axitinib Before Surgery in Treating Patients With High-Risk Prostate Cancer,0.0005231628863398587,0.0005847828166047136
NCT01341652,Phase II PAP Plus GM-CSF Versus GM-CSF Alone for Non-metastatic Prostate Cancer,0.0005396739035183088,0.00047966575340794616
NCT01383863,A Long-term Observational Study Cohort in Patients With Advanced Prostate Cancer,0.000593800432129555,0.0005550134431701778
NCT01331083,A Phase II Study of PX-866 in Patients With Recurrent or Metastatic Castration Resistant Prostate Cancer,0.0006059920412242161,0.0006577297147015152
NCT01393730,Abiraterone Acetate Combined With Dutasteride for Metastatic Castrate Resistant Prostate Cancer,0.00043939994484292665,0.0005428693352926533
NCT01303692,Comparison of Bone Mineral Loss in Prostate Cancer Patients Who is Receiving GnRH Agonist and -Plus Anti-androgen Agent,0.0004826380919676445,0.00043318699304870507
NCT01320280,"BIBW 2992 (Afatinib) for the Treatment of Patients With HER2-positive, Hormone-refractory Prostate Cancer",0.0005995371071643223,0.0006031767573511656
NCT01320735,Observational Program to Assess Use of Intermittent Adjuvant Deprivation Therapy With Leuprorelin (Lucrin Depot) in Patients With Advanced Prostate Cancer (PCa) in Russia,0.0005144074625868081,0.0005388562304771968
NCT01325311,Cholecalciferol and Genistein Before Surgery in Treating Patients With Early Stage Prostate Cancer,0.0004923482465682467,0.0006236140949497196
NCT01374087,"Study to Assess the Efficacy of Brachytherapy With or Without Hormone Therapy, Using Triptorelin 22.5mg in Patients With Recurrence of Prostate Cancer",0.0005520647789421219,0.0005413720221093555
NCT01357512,Evaluation of Diagnostic Value of 3-T Magnetic Resonance Imaging (MRI) in Suspected Prostate Cancer,0.00040122554865941993,0.0004585189728390422
NCT01360840,EMD 525797 in Subjects With Asymptomatic or Mildly Symptomatic Metastatic Castrate-resistant Prostate Cancer,0.0004327105578219154,0.0004543890071479429
NCT01302041,A Study to Test if Enzalutamide is Effective and Safe in Prostate Cancer Patients Who Have Never Had Hormone Therapy,0.0005629992936196912,0.000636898913684621
NCT01386684,Real Life Evaluation of Lupron in the Management of Prostate Cancer: A Canadian Post Marketing Observational Study,0.0004431457792806139,0.0006500141932710289
NCT01398657,Cryotherapy With or Without Short-term Adjuvant Androgen-Deprivation Therapy in Prostate Cancer,0.000470987818672173,0.0005316060710681402
NCT01359189,Evaluation of a Transrectal Scintigraphic Detector(ProxiScanTM) for Detection of Primary Prostate Cancer,0.0004336983837320653,0.00038936795859634325
NCT01310894,Efficacy and Safety Study of TOOKAD® Soluble for Localised Prostate Cancer Compared to Active Surveillance.,0.0006110167391255005,0.00043161365588381456
NCT01366053,Hormone Sensitive Prostate Cancer Patients Switched to Degarelix Therapy After Failing on GnRH Agonists,0.0005034634117948236,0.0005392061521078246
NCT01322490,"A Randomized, Double-blind, Phase 3 Efficacy Trial of PROSTVAC-V/F +/- GM-CSF in Men With Asymptomatic or Minimally Symptomatic Metastatic Castrate-Resistant Prostate Cancer",0.0004137241462283954,0.0005117802788376432
NCT01344564,Initiation of Androgen Deprivation Therapy for Prostate Cancer Using Degarelix Followed by Leuprolide,0.00039197053885122525,0.0004595054988198252
NCT01376661,Outcome Assessment of an Active Surveillance Program for Low Risk Prostate Cancer: An Observational Study,0.000434200442514709,0.00048691261007679875
NCT01376674,T-cell-immunity During Standard Radiotherapy in Localised Prostate Cancer,0.0004512967557696311,0.0003824961684997616
NCT01342367,Feasibility of Hormones and Radiation for Intermediate or High Risk Prostate Cancer,0.0004656463129966842,0.000501655081310052
NCT01338831,Phase I Study of LFA102 in Patients With Prolactin Receptor-positive Castration-resistant Prostate Cancer or Prolactin Receptor-positive Metastatic Breast Cancer,0.000564041296697434,0.0005448186420619261
NCT01338012,Sipuleucel-T in Metastatic Castrate Resistant Prostate Cancer (CRPC) Patients Previously Treated on Dendreon Study P-11 (NCT00779402),0.0005927878288455736,0.00048632258667411675
NCT01347320,Preoperative Magnetic Resonance (MR) Imaging of Prostate Cancer,0.0005063943947163966,0.00036892862352468504
NCT01347788,Cabozantinib (XL184) in Men With Castrate-Resistant Prostate Cancer,0.0005425252175644662,0.0005066039263534909
NCT01347476,Aggressive Prostate Cancers in Elderly Patients,0.0006815300030156992,0.0006319143007951406
NCT01316458,Glivec in Prostate Cancer Patients With Rising PSA Following Radical Prostectomy,0.000567558063229165,0.0005712547056620465
NCT01368588,Androgen-Deprivation Therapy and Radiation Therapy in Treating Patients With Prostate Cancer,0.000580313875557396,0.000674972855478548
NCT01368055,Hypofractionated Proton Radiation Therapy for Low and Intermediate Risk Prostate Cancer,0.0004263577185342814,0.0003836289431860595
NCT01317641,Safety and Pharmacokinetics Study of ODM-201 in Castrate Resistant Prostate Cancer,0.0005340321526066019,0.0008878592079059561
NCT01317199,Effects of Two Doses of MPX Capsules on Rising Prostate-specific Antigen Levels in Men Following Initial Therapy for Prostate Cancer,0.0004045592330136328,0.0004177753638423018
NCT01377389,Ipilimumab + Androgen Deprivation Therapy in Prostate Cancer,0.0005089261303022633,0.000417223533460333
NCT01377753,MR Image Guided Therapy in Prostate Cancer,0.0006937874391318647,0.0005587204739875436
NCT01306890,A Registry of Sipuleucel-T Therapy in Men With Advanced Prostate Cancer,0.0004354304795179444,0.0007072586064550146
NCT01354951,"Assessing the Potential for Reduced Toxicity Using Focal Brachytherapy in Early Stage, Low Volume Prostate Cancer",0.0003777294432758821,0.0005068654635053529
NCT01300104,Feasibility Study on a Nordic Lifestyle Intervention Trial Among Men With Prostate Cancer,0.0005016429370569459,0.00036769120496380056
NCT01309672,S1014 Abiraterone Acetate in Treating Patients With Prostate Cancer Who Have Undergone Initial Hormone Therapy,0.0005817082077977225,0.0004907220709085627
NCT01313273,Study of Lanreotide in Non Metastatic Castration-resistant Prostate Cancer Patients,0.0005906675599846277,0.0005869708359438606
NCT01313559,"Pasireotide (SOM230) With or Without Everolimus in Treating Patients With Hormone Resistant, Chemotherapy Naive Prostate Cancer",0.0005104809477186221,0.0005668369831287756
NCT01352429,Mild Hypofractionation With Proton Therapy or Intensity Modulated Radiation Therapy (IMRT) for Intermediate-Risk Prostate Cancer,0.00039514484566050196,0.0004859361335107904
NCT01352598,Stereotactic Body Radiotherapy for Prostate Cancer,0.0006974742482084422,0.0006100535023642843
NCT01352208,Phase I/II Study of ASP9521 in Castrate-Resistant Prostate Cancer (CRPC) Patients,0.0006751588343241689,0.0007774888573272511
NCT01335204,Ph Ib/IIa Study of Cabazitaxel Plus Bavituximab in Castration-resistant Prostate Cancer,0.0004713350650085145,0.0005522710139259573
NCT01394042,Prostate Cancer Imaging With Radioactive Tracer and Ultrasound Detector Compared to MRI and ProstaScint,0.0003659223756347501,0.00040815400439187443
NCT01394263,Study of Histrelin Subdermal Implant in Patients With Prostate Cancer,0.0005742238266509415,0.0005518912824342137
NCT01365182,Improving Urinary Continence and Quality of Life in Prostate Cancer Patients,0.0006869629892605156,0.00044260061452143626
NCT00815672,Exercise for Prostate Cancer Patients,0.0006864323957720638,0.0006158579067990194
NCT00815750,Decision Making in Unaffected First-Degree Relatives of Prostate Cancer Patients,0.0005028716704348054,0.00047167155568722253
NCT00887432,Cholecalciferol Supplement in Treating Patients With Localized Prostate Cancer Undergoing Observation,0.0005105775593259246,0.0005750392481288284
NCT00822510,Telephone Counseling: Men With Prostate Cancer & Partners,0.0004960088520100848,0.00036077624579905655
NCT00834392,Exercise in Men With Prostate Cancer,0.0007011626355927863,0.0004537450182897637
NCT00868868,Pedometer and Exercise Study in Prostate Cancer Patients With Hormonal Therapy,0.0005601457510876976,0.0005925422254880185
NCT00868595,MTD Study of Vaccine BP-GMAX-CD1 Plus AP1903 to Treat Castrate Resistant Prostate Cancer,0.000535171285887409,0.0005559398981368782
NCT00871585,Evaluation of Prostate-Specific Antigen (PSA) Levels in Patients With Advanced Prostate Cancer Treated With Bicalutamide,0.0005033949329770617,0.0005711635239294217
NCT00856102,Exercise and Cognitive-psychosocial Functions in Men With Prostate Cancer Receiving Androgen Depletion Therapy,0.00041110388390958486,0.000362223802071604
NCT00853164,A Pilot Study of Physical Activity for Improving Quality of Life in Prostate Cancer Patients on Androgen Deprivation Therapy (ADT),0.0005453030257715738,0.0005789052357048876
NCT00877617,Quality of Life in Men With High Risk Localized Prostate Cancer,0.000517245001760743,0.0003530001182584532
NCT00811265,Safety Evaluation of ExAblate MRgFUS for Prostate Cancer,0.000723708041969676,0.0006877906681078661
NCT00811031,Preoperative Docetaxel for Localized Progressive Castration-resistant Prostate Cancer (CRPC),0.0004928078419963817,0.0005402086841426765
NCT00898274,Study of Blood Samples From Older Patients at High Risk of Developing Prostate Cancer and From Healthy Male Participants,0.0005850551410829869,0.0005531805428087539
NCT00898833,Plasma and Urine Samples From Patients With Hormone-Refractory Prostate Cancer Enrolled on Clinical Trials CALGB-9480 or CALGB-9583,0.0005088005919531614,0.0004494888454426328
NCT00824902,Evaluation Ultrasound Elasticity/Tissue Strain-Hardening Imaging for Prostate Cancer Patients Undergoing Radical Prostatectomy,0.00048798199299659507,0.0004282711116114017
NCT00881725,A Study of Pre-operative Metformin in Prostate Cancer,0.0006027526248319055,0.0005653575421152296
NCT00872157,BMTP-11 in Patients With Castrate-Resistant Prostate Cancer With Bone Mets,0.0005958226475711963,0.00069858808715844
NCT00828633,Health-Related Quality of Life in Gay Men With Localized Prostate Cancer,0.00042216380789728903,0.0005163458839733033
NCT00828308,"Neoadjuvant Weekly Ixabepilone for High Risk, Clinically Localized Prostate Cancer",0.0004000174661320891,0.0005551562895975068
NCT00884273,Investigation of the Effect of Degarelix in Terms of Prostate Volume Reduction in Prostate Cancer Patients,0.0004912468055197946,0.00048537441168564554
NCT00816452,Awareness to Osteopenia's Treatment by Bisphosphonate in Male Suffering From Prostate Cancer,0.000396414320622072,0.0005229313834251336
NCT00831233,Symptomatic Study Investigating Degarelix in Patients Suffering From Prostate Cancer,0.0005506283132553632,0.000579446915211294
NCT00831623,Study of Hypofractionated Proton Beam Radiation Therapy for Prostate Cancer,0.0006034493043390426,0.0006165117064757606
NCT00831467,Safety and Efficacy Trial of a RNActive®-Derived Prostate Cancer Vaccine in Hormone Refractory Disease,0.00041864533730351144,0.0005606606504567489
NCT00831792,TKI258 in Castrate Resistant Prostate Cancer,0.0007620671210440582,0.0004945726342567107
NCT00831142,Characterization of Prostate Cancer With 3T MR,0.0013257273503292514,0.0004336358549009421
NCT00818623,Investigation of a New Trial Drug (FE200486) in Prostate Cancer Patients,0.0005756281096675353,0.0005386670156700665
NCT00882232,Cross-linked Hyaluronan Gel Reduces Rectal Toxicity Due to Radiation Therapy for Prostate Cancer,0.0004086535784925945,0.0005292711374769591
NCT00830635,Multimedia Educational Program for Patients With Early-Stage Prostate Cancer or Breast Cancer,0.000475681173103577,0.0004066266880414521
NCT00860158,Neoadjuvant Dasatinib Plus LHRH Analogue Therapy in High-Risk Localized Prostate Cancer,0.00041183022718138885,0.0005218335133201428
NCT00804245,C-11 Choline PET-CT Scan in Finding Metastases in Patients With Newly Diagnosed High-Risk Prostate Cancer,0.0004820731062897788,0.0003731806293284976
NCT00859781,177Lu Radiolabeled Monoclonal Antibody HuJ591 (177Lu-J591) and Ketoconazole in Patients With Prostate Cancer,0.0005056926932291103,0.0005349616992739022
NCT00859729,Dose Finding Study of a DNA Vaccine Delivered With Intradermal Electroporation in Patients With Prostate Cancer,0.0005444217246191642,0.00046555285701399324
NCT00859027,Effect Of Risedronate On Bone Mass In Older Men Receiving Neoadjuvant Therapy For Prostate Cancer,0.0003854190510004655,0.00031010096182116243
NCT00852007,A Study Evaluating Vaccination of Prostate Cancer Patients With Self Dendritic Cells Expressing MUC1,0.000577320666839219,0.00043177217450668826
NCT00870714,Neoadjuvant Therapy With Docetaxel and Ketoconazole in Patients With High-Risk Prostate Cancer: A Pilot Study,0.0005643845025820698,0.0005805333952107035
NCT00891345,Safety Study of a Cytotoxic Lymphocytes (CTL) Based Prostate Cancer Therapy,0.0004843558801659037,0.0005367521257076536
NCT00861614,Study of Immunotherapy to Treat Advanced Prostate Cancer,0.0005205939903072458,0.0006249506158078523
NCT00861471,Docetaxel (Taxotere) and Imatinib Mesylate (Gleevec) in Hormone Refractory Prostate Cancer,0.0003993930719590375,0.000507692123227417
NCT00849121,Two-Arm Study of a DNA Vaccine Encoding Prostatic Acid Phosphatase (PAP) in Patients With Non-Metastatic Castrate-Resistant Prostate Cancer,0.0005491345311079147,0.0005281024738594593
NCT00849082,Radiation Therapy With or Without Goserelin and Cyproterone in Treating Patients With Prostate Cancer,0.0005334967347477962,0.0005350072419257486
NCT00855647,Hypofractionated Radiotherapy for Localized Prostate Cancer (With CyberKnife or With IMRT),0.0005003411312392652,0.0005601594141572982
NCT00844792,Study of Antioxidants on Prostate Tumors in Men Undergoing Radical Prostatectomy for Prostate Cancer,0.000445091545854776,0.00041911759057963456
NCT00895115,Vitamin E Supplements in Preventing Cancer in Patients at Risk of Prostate Cancer or Who Have Prostate Cancer,0.0005055556046096568,0.0004756646102213974
NCT00895466,Efficacy and Safety Study of the Therapeutic Vaccine PEP223 in Prostate Cancer Patients,0.0006124608551909791,0.0007302688168195681
NCT00895310,Use of Low Dose Ketoconazole in Prostate Cancer That Does Not Respond to Hormone Therapy and Prior Chemotherapy,0.0003992919946007723,0.00041086696397758256
NCT00848601,"Safety of SGI-1776, A PIM Kinase Inhibitor in Refractory Prostate Cancer and Relapsed/Refractory Non Hodgkin's Lymphoma",0.00041740881395737646,0.00043145835638743537
NCT00809458,Biomarker Study of Neoadjuvant Vitamin E in Patients With Locally Treatable Prostate Cancer,0.0005521420313963354,0.0005217836225079288
NCT00833248,Neoadjuvant Study Investigating Degarelix in Patients Suffering From Prostate Cancer,0.0005540388185314671,0.0006081394338880368
NCT00899184,DNA Changes in Patients With Prostate Cancer,0.0006835472668059349,0.0005222323411254388
NCT00899912,Changes in DNA After Radiation Therapy in Patients With Prostate Cancer,0.0005948256899445106,0.0005372360750998928
NCT00899665,Proteases in Patients With Prostate Cancer That Has Spread to the Bone,0.0005611368131607248,0.0005301885608697621
NCT00893035,Evaluation of an Apoptotic Test for Predicting Late Toxicities After Radiotherapy in Breast and Prostate Cancer Patients,0.0005111621991548467,0.0006357389429969208
NCT00801242,Intermittent Treatment With Degarelix of Patients Suffering From Prostate Cancer,0.0005162807399780409,0.0005082384232679458
NCT00801996,"Epidemiologic, Clinical and Genetic Profile of Prostate Cancer in Arab Countries",0.000505970488310198,0.0003929969403690842
NCT00819247,The Efficacy and Safety of FE 200486 in Treatment of Patients Suffering From Prostate Cancer,0.0006005335057243768,0.00046418825886072824
NCT00819156,Dose Finding Trial With a New Treatment (Degarelix) for Prostate Cancer,0.0004630919625499566,0.00039523436094917805
NCT00869739,Helping African American Prostate Cancer Survivors and Their Partners Cope With Challenges After Surgery for Prostate Cancer,0.00042608363244499146,0.00028025699698980614
NCT00805701,Study Assessing The Efficacy And Safety Of Avodart (Dutasteride) At Improving Urinary Symptoms In Men With Prostate Cancer Who Are Undergoing Seed Implantation,0.00043079532409391467,0.0004019063286625722
NCT00805883,MRI Targeted Focal Laser Thermal Therapy of Prostate Cancer Followed by Radical Prostatectomy,0.0004649888359668054,0.0006154211790197889
NCT00890006,Advanced Imaging for Radiotherapy Treatment Planning and Guidance for Low-Intermediate Risk Prostate Cancer (Margin),0.00044116177905353205,0.0004907871202040723
NCT00823771,A Pilot Study to Assess the Follow-up of Prostate Cancer Patients Who Have Undergone Radiotherapy Treatment,0.0006388667599292101,0.0005644999792200025
NCT00879619,"Taxotere/Prednisone Plus Sunitinib in Chemotherapy-Naïve, Hormone Refractory Prostate Cancer Patients",0.000491893210500424,0.0005637199788090764
NCT00846976,Treatment Protocol to Monitor the Safety of a 200 mg Dose of Bicalutamide in Patients With Advanced Prostate Cancer,0.0004995771506680935,0.00042981840251609733
NCT01644136,Microspheres in Preventing Lymphatic Fluid Collection After Surgery in Patients With Prostate Cancer,0.00047775785291965216,0.0004279066762059049
NCT01642732,Study of Everolimus Added to Combined Hormonal and Radiation Therapy for High Risk Prostate Cancer,0.0004902981762907025,0.0005376387887700109
NCT01650285,Cabazitaxel and Radiation For Patients With Pathologically Determined Stage 3 Prostate Cancer and/or Patients With PSA Elevation (>0.1- < 2.0 ng/mL),0.0005085743963717733,0.0005693174586661389
NCT01650350,"Low Dose Naltrexone for Metastatic Melanoma, Castrate Resistant Prostate Cancer and Renal Cancer",0.00039275830409866167,0.0004685620873125471
NCT01634061,Phase Ib of Abiraterone Acetate Plus BEZ235 or BKM120 in Castration-resistant Prostate Cancer (CRPC) Patients,0.0005545190505740046,0.0007054929274035849
NCT01687049,Red Yeast Rice in Subjects With Clinically Localized Prostate Cancer Undergoing Active Surveillance,0.0003912609592757415,0.00031054639309983055
NCT01673581,Shared Decision Making in Low Risk Prostate Cancer,0.000498808261372356,0.0004833429644612593
NCT01655836,High-Dose Rate Brachytherapy and Stereotactic Body Radiation Therapy in Treating Patients With Prostate Cancer,0.0005605267741231321,0.0005421107995393484
NCT01630967,Efficacy Study of Switching to a Lutenizing Hormone-releasing Hormone (LHRH) Antagonist From a LHRH Agonist to Treat Progressive Castrate Resistant Prostate Cancer (CRPC),0.00044180305596927343,0.0004109857026300647
NCT01697384,Study to Evaluate Efficacy and Safety of Histrelin Subdermal Implant in Men With Advanced Prostate Cancer,0.00045764626361332434,0.0004701949559687743
NCT01676480,The Effect of Endurance Training on Body Composition and Insulin Sensitivity in Prostate Cancer Patients Receiving Androgen Deprivation Therapy,0.00048539146014853294,0.0005304770319732169
NCT01607879,Use of β-hydroxy-β-methylbutyrate to Counteract Muscle Loss in Men With Prostate Cancer on Androgen Ablation,0.00041741309860624946,0.000476786203767166
NCT01607008,MRI for Assessing Prostate Cancer Response,0.0006995192055181603,0.0005417737328910167
NCT01620593,Castration Compared to Castration Plus Metformin as First Line Treatment for Patients With Advanced Prostate Cancer,0.0005111192161234508,0.0004814602465617944
NCT01620515,"Two-Dose Level Evaluation of NX-1207 for the Treatment of Low Risk, Localized (T1c) Prostate Cancer",0.0004099377044426154,0.00048449823113718956
NCT01647789,A Study of Oral CFG920 in Patients With Castration Resistant Prostate Cancer,0.0006195434821134165,0.0005829402441349415
NCT01695473,Neoadjuvant BKM120 in High-risk Prostate Cancer,0.0005201439737758704,0.0004254616030561147
NCT01695044,A Study of PSMA ADC in Subjects With Metastatic Castration-resistant Prostate Cancer (mCRPC),0.0005194320228144528,0.000477781040766665
NCT01656304,Bevacizumab in Treating Patients With Relapsed Prostate Cancer That Did Not Respond to Hormone Therapy,0.0005202121286489449,0.0005215741774008759
NCT01656161,"Study on Efficacy, Pharmacokinetics, and Safety of Two Subcutaneous Injections of Triptorelin Embonate 6 Month Formulation in Patients With Advanced Prostate Cancer",0.000545280443554605,0.0004577446310434001
