nct_id,brief_title,page_rank_score_brief_title,page_rank_score_brief_title_summary_combined
NCT01762241,Xbox Kinect Training in Men With Prostate Cancer,0.000695492829920533,0.0004991097466330338
NCT01762956,Pelvic Floor Muscles Training in Men Undergoing Radiotherapy for Prostate Cancer: Randomized Controlled Trial,0.00039147055962290844,0.0005248389248640264
NCT01731912,Degarelix Acetate Before and During Radiation Therapy in Treating Patients With Prostate Cancer,0.0005930312301120249,0.0005771082448967709
NCT01710098,Treatment of Prostate Cancer With Firmagon®,0.0005490461829773261,0.0004278656469629843
NCT01769950,Choline-PET for Evaluating the Incidence of Nodal Metastases Among Newly Diagnosed Patients of Prostate Cancer,0.0004965787537401135,0.0003827380439180525
NCT01766492,Quality of Life in Patients With Clinically Localized Prostate Cancer Treated With Radiosurgery,0.0005132216582576314,0.0006184754484043513
NCT01766869,Improving Cancer Foci Detection in Prostate Cancer Using Multiparametric MRI/MRS,0.0003692493114051509,0.0005260468181427497
NCT01784757,Bioavailability Study of ODM-201 in Subjects With Metastatic Chemotherapy-naive Castration-resistant Prostate Cancer,0.0004971043941114379,0.0005753060935486644
NCT01784913,A Phase I/IIa Study of UV1 Vaccine in Patients With Prostate Cancer,0.0006447689719018755,0.0005250680575377824
NCT01727154,Immune Monitoring Protocol in Men With Prostate Cancer Enrolled in a Clinical Trial of Sipuleucel-T,0.0003667008432972973,0.0004762663443194132
NCT01723475,First-in-man Dose Escalation Study of BAY2010112 in Patients With Prostate Cancer,0.0007863871542273082,0.0006227104311892274
NCT01759836,Impact of Adjuvant Statin Therapy in Patients Who Underwent Radical Prostatectomy for Locally Advanced Prostate Cancer,0.0005338431851563024,0.0006238232182334251
NCT01759771,Vitamin D3 Supplementation for Low-Risk Prostate Cancer: A Randomized Trial,0.00038759743653022185,0.00042093651778809366
NCT01744366,One Month Degarelix/Comparator Treatment for Prostate Cancer in Chinese Population,0.0004617590379305338,0.0006773983184242989
NCT01767363,WEUSKOP5723: Prostate Cancer Study,0.0008499808471902634,0.0005389886684578585
NCT01704027,Safety Study of Pelvic and Prostatic SIB-IMRT With Long-term Androgen Deprivation for High Risk Localized Prostate Cancer,0.0004568746929220652,0.0006178142436537379
NCT01704274,GTN Therapy on Biomarkers of Immune Escape in Men With Biochemical Recurrence of Prostate Cancer After Primary Therapy,0.0004193725140638408,0.0006059587322844994
NCT01795365,Active Surveillance of 2 Groups of Patients With Localized Prostate Cancer,0.0005674620390544786,0.0004855381825392197
NCT01795703,A Phase 2 Study to Evaluate Safety and Efficacy of Abiraterone in Participants With Prostate Cancer Who Have Received Docetaxel,0.00045970993730626503,0.0005903982505425856
NCT01707966,Orteronel Maintenance Therapy in Patients With Metastatic Castration Resistant Prostate Cancer and Non-progressive Disease After First-line Docetaxel Therapy,0.000564253853057999,0.0005008923156264941
NCT01741116,Dovitinib(TKI258) in Patients With Castration-resistant Prostate Cancer,0.0006142541695355443,0.0005481504923334377
NCT01732549,A Proof of Concept Study of Maintenance Therapy With Tasquinimod in Patients With Metastatic Castrate-resistant Prostate Cancer Who Are Not Progressing After a First Line Docetaxel Based Chemotherapy,0.0005893835385002418,0.0004994901100192434
NCT01729676,Impact of the Geographical FACTor on the Prostate Cancer Stage at Hormonal Therapy Initiation,0.00043569953290157183,0.000389637416210005
NCT01737242,UK Genetic Prostate Cancer Study: Epidemiology and Molecular Genetics Studies,0.0004505961896335595,0.00040667420804437664
NCT01737151,Stereotactic Body Radiation Therapy in Treating Patients With Low- and Intermediate-Risk Prostate Cancer,0.0005651569847434545,0.0005301282672857814
NCT01761812,Multiparametric MRI for Prostate Cancer Localization and Characterization: New Methods,0.00041706966816993616,0.0003892385414084577
NCT01751451,"3-arm Study of Abiraterone Acetate Alone, Abiraterone Acetate Plus Degarelix, a GnRH Antagonist, and Degarelix Alone for Patients With Prostate Cancer With a Rising PSA or a Rising PSA and Nodal Disease Following Definitive Radical Prostatectomy",0.0005436434056110852,0.0006247617618380086
NCT01794403,Radiation Hypofractionation Via Extended Versus Accelerated Therapy (HEAT) For Prostate Cancer,0.0004465723688366359,0.00036920222655782465
NCT01790126,The Role of Highly Selective Androgen Receptor (AR) Targeted Therapy in Men With Biochemically Relapsed Hormone Sensitive Prostate Cancer,0.0003783615130492294,0.0004999313930767554
NCT01790451,Safety and Efficacy of Irreversible Electroporation in Ablation of Prostate Cancer in Humans,0.0004995997163210413,0.00042529233265667474
NCT01792024,MR-Guided Laser Interstitial Thermal Therapy in Treating Patients With Prostate Cancer,0.0005623477376073029,0.0005529557145622214
NCT01706458,Provenge With or Without pTVG-HP DNA Booster Vaccine in Prostate Cancer,0.00041898634610945646,0.0004974496887408524
NCT01756638,A Phase 2 Study to Evaluate Safety and Efficacy of Abiraterone in Participants With Prostate Cancer,0.0005155641291866216,0.000581671415140105
NCT01716702,A Feasibility Study of an Online Intervention for Sexual Rehabilitation in Prostate Cancer,0.00041972292131459073,0.00048099468881593555
NCT01715064,Acute Effects of Exercise on the Cortical Silent Period in Prostate Cancer Patients,0.000471571519374607,0.0005235159042963905
NCT01715129,Induction and Maintenance of Castration After Subcutaneous Injections of Triptorelin Pamoate in Patients With Prostate Cancer,0.0004837237684989523,0.00037986416065386786
NCT01715285,"A Study of Abiraterone Acetate Plus Low-Dose Prednisone Plus Androgen Deprivation Therapy (ADT) Versus ADT Alone in Newly Diagnosed Participants With High-Risk, Metastatic Hormone-Naive Prostate Cancer (mHNPC)",0.0004736465050677782,0.0005173531136645435
NCT01799278,A Phase II Trial of MLN8237 in Patients With Metastatic Castrate Resistant and Neuroendocrine Prostate Cancer,0.0006224678690490095,0.0005270654051321322
NCT01799694,Stem Cells Treatment for the Local Urinary Incontinence After a Radical Prostate Cancer Surgery (HULPURO),0.00040633410235244515,0.000581231015879447
NCT01764646,Hypofractionated Radiation Therapy in Prostate Cancer,0.0006984497319487539,0.000499134753705702
NCT01764347,Magnetic Resonance Imaging-Transrectal Ultrasound Fusion Image-Guided Prostate Biopsy Following Radical Prostatectomy in Patients With Prostate Cancer,0.000476847016893205,0.0004633763023168804
NCT01780701,Magnetic Resonance Spectroscopic Imaging Study of Prostatic Fats to Distinguish the Difference Between High and Low Risk Prostate Cancer,0.0004378473298230123,0.00044764468082419127
NCT01780220,Safety and Efficacy of Radiotherapy Combined With a 6-month LH-RH Agonist and Abiraterone Hormone Therapy Treatment in Biochemically-relapsing Prostate Cancer Following Surgery,0.0004387869360930576,0.0005163293979187634
NCT01753297,A Study of Immediate 9 Months Adjuvant Hormone Therapy With Triptorelin 11.25 mg Versus Active Surveillance After Radical Prostatectomy in High Risk Prostate Cancer Patients.,0.0005605204926675343,0.0005720484951547339
NCT01796028,Metformin-Docetaxel Association in Metastatic Hormone-refractory Prostate Cancer,0.000422301180574775,0.0006705465918434701
NCT01763944,Carbohydrate Restriction and Prostate Cancer Growth,0.0004960081998089953,0.000364106599893987
NCT01793077,"Observational, Non-interventional, Non Comparative Real Life Data Collection of Depo-Eligard® 7.5 mg, 22.5 mg and 45 mg in Male Prostate Cancer Patients",0.00048179327384732145,0.0005058201209794561
NCT01734681,Phase 2 Study of G-202 in Patients With Chemotherapy-Naïve Metastatic Castrate-Resistant Prostate Cancer,0.0005974637033859336,0.0006823961841154784
NCT01705652,Study to Assess the Activity of Nexrutine® in Prostate Cancer Patients,0.0006418106000034788,0.000536577677046572
NCT01733836,Prostate Cancer Active Surveillance Metformin Trial,0.0005078220388393519,0.0005052721104653718
NCT01726894,Focal Therapy for Localised Prostate Cancer Using Irreversible Electroporation,0.0005492928099600486,0.0004950367269926191
NCT01735396,Abiraterone Acetate Trial in African American Prostate Cancer Patients,0.0006911140065562991,0.0005270644281283401
NCT01709734,"A 2 Part, Phase 2 Trial of Galeterone in the Treatment of Castration Resistant Prostate Cancer",0.00045891022500661163,0.0006722206119762482
NCT01786031,Prostate Cancer Evaluation of TaRgets in Genito Urinary Screening Program,0.00043170875591441916,0.0005248754874156283
NCT01711892,Health Effects of Soccer Training in Men With Prostate Cancer Receiving Androgen Deprivation Therapy,0.0004252950003343343,0.00044696908824894187
NCT01717677,"Evaluation of Four Treatment Modalities in Prostate Cancer With Low or ""Early Intermediate"" Risk",0.00043578183060992757,0.0006337966782558661
NCT01717053,"Abiraterone, Radiotherapy and Short-Term Androgen Deprivation in Unfavorable Localized Prostate Cancer",0.0004256239816506345,0.0003488387370188861
NCT01745718,Clinical Study Evaluating Targeted Biopsies and Cytological Imprints in Prostate Cancer,0.0004584440088628855,0.0004738427669757265
NCT01739062,The ProCaRis Study: Prostate Cancer Risk Assessment in General Practice,0.0004491898559830237,0.0004236711534336549
NCT01750398,Bipolar Androgen-based Therapy for Prostate Cancer (BAT),0.0005687145627284818,0.0005754487532040924
NCT01774071,Study of 89Zr-DFO-MSTP2109A in Patients With Prostate Cancer,0.0006404708666522191,0.000543784816991048
NCT02895854,LDR Brachytherapy Versus SBRT for Low and Intermediate Risk Prostate Cancer Patients,0.0005157087133252324,0.0004756337437534633
NCT02825628,Study of ODX (Osteodex) in Metastatic Castration Resistant Prostate Cancer (CRPC),0.0004905131260690081,0.0005158088441856531
NCT02825875,Study of the Clinical Utility of PSMA Imaging in the Evaluation of Men With Prostate Cancer,0.0004748816046607974,0.0004155924298727728
NCT02844699,"A Multicenter Randomized Double-blind Placebo-controlled Pilot Study of Safety, Pharmacodynamics and Efficacy of Different Treatments of Immunotherapeutic Drug Mobilan (M-VM3) in Patients With Diagnosed Prostate Cancer",0.0005685349419352632,0.0005472563235070017
NCT02840552,The Safety and Efficacy of 18F-Fluoromethylcholine (18F-FCH) PET/CT in Prostate Cancer,0.0005126013483263545,0.00038852973988866046
NCT02840617,ICG-based Fluorescence Imaging in Localization of Prostate Cancer and Metastatic Lymph Nodes,0.0004034799610252748,0.0004292349964815673
NCT02816983,SBRT for Oligometastatic Castration-Refractory Prostate Cancer,0.000735944183949932,0.0005141007595116644
NCT02816840,PET-CT/MRI in the Radiotherapy for Prostate Cancer,0.0005566707001976718,0.00044836738103338136
NCT02869412,Computer-Based Behavior Change Guide in Increasing Physical Activity in Patients With Prostate Cancer Who Have Received Androgen Deprivation Therapy,0.0004766698710314433,0.0004903987432519984
NCT02869282,STUDY OF THE EXPRESSION OF CIRCULATING AND INTRA-TUMORAL CHEMOKINES IN PATIENTS WITH PROSTATE CANCER,0.0004970580588922415,0.0004567350168026408
NCT02869594,Institut Paoli Calmettes Prostate Cancer Database,0.0006944618232638064,0.0007735866684667831
NCT02803086,"Longitudinal Evaluation of Intestinal, Haematological and Urinary Toxicity From Pelvic Irradiation for Prostate Cancer",0.0004044597516431042,0.000490781144768478
NCT02803437,"Drug Use Investigation of Xofigo, Castration Resistant Prostate Cancer With Bone Metastases",0.00041241406819003565,0.00047662648718921
NCT02874014,"Prospective Evaluation of Hypofractionation Proton Beam Therapy With Concurrent Treatment of the Prostate and Pelvic Nodes for Clinically Localized, High Risk or Unfavorable Intermediate Risk Prostate Cancer",0.0004233131960208932,0.0004973480731064273
NCT02830165,Stereotactic Body Radiation Therapy in Treating Patients With High-Risk Prostate Cancer Undergoing Surgery,0.0005250896785571344,0.0005940726699697798
NCT02854982,Impact on Quality of Life 3 Years After Diagnosis of Prostate Cancer,0.0005123848981449311,0.0007194017782501443
NCT02846870,Visually Enhanced Education About Prostate Cancer,0.000696104408644635,0.0005373086537336997
NCT02831920,CEUS Targeted Biopsies Compared to mpMRI Targeted and Systematic Biopsies for the Detection of Prostate Cancer,0.0005052941295961682,0.00042249442162927174
NCT02826772,"Safety, Tolerability, and PK of GT0918 (Proxalutamide) in Subjects With Metastatic Castrate Prostate Cancer",0.0005347206954033542,0.0005332427429069793
NCT02809690,18F-FMAU PET/CT in Diagnosing and Characterizing Prostate Cancer,0.0005233136576392114,0.00042767994361608434
NCT02867345,PD-1 Knockout Engineered T Cells for Castration Resistant Prostate Cancer,0.00047295336863591706,0.000693339686093426
NCT02867020,Study of Abiraterone Acetate Plus ADT Versus APALUTAMIDE Versus Abiraterone and APALUTAMIDE in Patients With Advanced Prostate Cancer With Non-castrate Testosterone Levels,0.0005518325008896461,0.0004790372923197742
NCT02810886,Prospective Evaluation of 68Ga-PSMA PET-CT for Recurrence Detection of Prostate Cancer and Its Impact on Patient Management,0.0004963546368922382,0.0004766752837038378
NCT02814968,18F-FDG PET/CT and Whole Body MRI for Staging and Response Prediction in Castration-resistant Prostate Cancer Patients Receiving Enzalutamide,0.0005176722225237873,0.0006003549467124699
NCT02814669,Safety and Tolerability of Atezolizumab (ATZ) in Combination With Radium-223 Dichloride (R-223-D) in Metastatic Castrate-Resistant Prostate Cancer (CRPC) Progressed Following Treatment With an Androgen Pathway Inhibitor,0.0004437962998204511,0.0005055481214647171
NCT02852122,The Role of C-11 Choline PET in Patients With Prostate Cancer,0.0005146826722148233,0.00048534527968707134
NCT02813226,Assessment of New Molecular Imaging Strategies for Prostate Cancer,0.0004174160776752076,0.0005426929520656031
NCT02813408,"A Study to Investigate the Impact of Abiraterone Acetate and Enzalutamide on Health-related Quality of Life, Participant-Reported Outcomes, and Medical Resource Use in Metastatic Castration-resistant Prostate Cancer Participants",0.000487193321951913,0.00040526009502530604
NCT02873117,Evaluation of the Potential Association Between 5α-reductase Inhibitors Prescription and Occurrence of High Grade Prostate Cancers,0.0003748599952333989,0.00042987791804206745
NCT02873013,Asia Study Group of Prostate Cancer (A-CaP Study),0.0006019770478904211,0.0004838439568725597
NCT02853097,Cell-Free DNA and RNA in Blood fromMetastatic Prostate Cancer Patients,0.0005611355909088415,0.0006090183518046169
NCT02899312,PSMA PET/CT for Prostate Cancer,0.0007180281075919257,0.0005151036913089025
NCT02899104,Navigant Study- Treatment Patterns in mCRPC (Metastatic Castrate Resistant Prostate Cancer ),0.0005372813498900367,0.000553047068217327
NCT02815033,11C or 18F-Choline PET/CT and Whole Body MRI for Staging and Response Prediction in Metastatic Hormono-Sensitive Prostate Cancer Patients Receiving Enzalutamide,0.0005032787671913266,0.0005952465822280566
NCT02805452,Solifenacin Succinate for Treatment of Urinary Toxicity Occurring During Radiotherapy of Prostatic Cancer,0.0004439391833565233,0.0005582042737059065
NCT02849990,"Androgen Receptor Antagonist ARN-509, Abiraterone Acetate, Prednisone, Degarelix, and Indomethacin in Treating Patients With Localized Prostate Cancer Before Surgery",0.0004885168056843723,0.0005328330436919905
NCT02811809,Apalutamide Plus Intermittent Hormone Therapy Versus Intermittent Hormone Therapy Alone in Prostate Cancer,0.00039632919767769437,0.0005293950490124397
NCT03103321,Decision Aids in Improving Knowledge in Patients With Prostate Cancer,0.0005591645990972545,0.0006296426809461827
NCT03103724,A Phase II Study Evaluating the Efficacy of Enzalutamide and the Role of ARv7 in Metastatic Castration Resistant Prostate Cancer (mCRPC) Patients With Visceral Disease.,0.0005873440326530099,0.0005178334036114536
NCT03101176,Multiparametric Ultrasound Imaging in Prostate Cancer,0.0005018850347909343,0.00029173744080074137
NCT03101046,Treatment of Metastatic Castrate Resistant Prostate Cancer Patients According to Circulating Tumor Cells Kinetic,0.0005581035357795922,0.0005978614674602063
NCT03104907,Prostatic Artery Embolization for Obstructive Uropathy Due to Locally Advanced Prostate Cancer,0.00038599881238175244,0.00041115018045450165
NCT03100981,Online Mindfulness for Women Treated for Breast Cancer and Men Treated for Prostate Cancer,0.0004971255691634624,0.00048387919780170936
NCT01574846,Prospective Multicentre Non-interventional Study of VANTAS® for the Treatment of Patients With Advanced Prostate Cancer,0.0005954598325278914,0.0005570351440358688
NCT01545154,The Use of Transperineal Ultrasound for Radiation Therapy Treatment Planning and Image Guidance in the Treatment of Prostate Cancer,0.0004207630056291526,0.0005556770978322735
NCT01545882,A Phase II Study of Degarelix in the Management of Non-Metastatic Hormone-Refractory Prostate Cancer,0.0004567110325757922,0.0004752489836439545
NCT01517451,Radiation and Androgen Ablation for Prostate Cancer,0.0005445515911295409,0.0008044490752079135
NCT01511536,Cabazitaxel and Abiraterone Acetate in Patients With Metastatic Castrate-Resistant Prostate Cancer,0.0005330978177216228,0.0005082648303527425
NCT01511874,Efficacy and Safety Study of ELIGARD 22.5mg With Prostate Cancer,0.0006015222578845492,0.0010179241224660292
NCT01560858,Treatment Patterns Among Patients With Prostate Cancer Prior to Diagnosis of a Castration-resistant State,0.0005572859528638003,0.0006446823331070742
NCT01510288,Phase 1 Trial of Ipilimumab and GVAX in Patients With Metastatic Castration-resistant Prostate Cancer,0.0005417486078054934,0.0005097115828094177
NCT01599793,Magnetic Resonance Imaging in Measuring the Effect of Cabozantinib on Bone Metastases in Patients With Castrate Resistant Prostate Cancer,0.0005005011477952261,0.0005252335995870552
NCT01599182,Metabolic Effects of Treatment in Intermediate and High-Risk Prostate Cancer,0.0004278303697167524,0.0004912375915998322
NCT01514669,Analyzing the Composition of Tears and Blood for Discovery of Novel Signatures of Aggressive Prostate Cancer,0.0003791916669375194,0.0005181788813774468
NCT01522443,Study of Cabozantinib (XL184) Versus Mitoxantrone Plus Prednisone in Men With Previously Treated Symptomatic Castration-resistant Prostate Cancer,0.00046183460985112093,0.00048714961744425803
NCT01522118,MR-guided Focused Ultrasound Treatment of Prostate Cancer: Focal Therapy for Locally Non-Advanced Disease,0.00043351823593682545,0.0005849136510855112
NCT01550237,Curative Image Guided Radiotherapy for Prostate Cancer,0.00045499990432473205,0.00037517675700970727
NCT01542021,Androgen Deprivation Therapy Prior to Prostatectomy for Patients With Intermediate and High Risk Prostate Cancer,0.0005012390282085804,0.00047453784746681095
NCT01518283,Study of Weekly Cabazitaxel for Advanced Prostate Cancer,0.000522023303724266,0.0005516886032314429
NCT01520441,BOTOX in Men With Prostate Cancer With Lower Urinary Tract Symptoms(LUTS)/Benign Prostatic Hyperplasia (BPH),0.0003773775505914055,0.00040044397763465173
NCT01596816,Hypofractionated Stereotactic Boost in Prostate Cancer,0.0006954974316627188,0.0006182310742146226
NCT01583920,Focal Salvage HDR Brachytherapy for the Treatment of Prostate Cancer,0.0004621075160593379,0.00046663377160579086
NCT01555632,Atorvastatin Calcium in Preventing Metabolic Syndrome in Patients With Prostate Cancer Receiving Long-Term Androgen-Deprivation Therapy,0.0005122204097945563,0.0006679926690040218
NCT01521949,Study of Acai Juice in Asymptomatic or Minimally Symptomatic Prostate Cancer Patients With Rising PSA,0.0005751666079930344,0.0005495858432122081
NCT01566045,MRI/TRUS Fusion Guided Prostate Biopsy- An Improved Way to Detect and Quantify Prostate Cancer,0.00039252236638439436,0.0004926044025113616
NCT01525914,Response of Patients on Surveillance for Prostate Cancer to Dutasteride,0.0005074217483228305,0.0005646005642869621
NCT01562522,Evaluation of the Effect of Psycho-oncological Intervention on Well-being of Patients With Advanced Prostate Cancer on LHRH Analogs and Their Partners. A Randomized Controlled Pilot Study.,0.000559071795320729,0.0006218894015628678
NCT01562223,Studying Repeated DCE-MRI and DWI in Patients Diagnosed With Prostate Cancer,0.0005099440750305689,0.0005045135418791831
NCT01578902,Hypofractionated Accelerated Radiotherapy for Low Risk Localized Prostate Cancer,0.0005431081310527612,0.0006751577954545805
NCT01578356,Oncological and Functional Outcomes After Radical Prostatectomy for Prostate Cancer: Comparing Open With Robot-assisted Surgery,0.00043687744465433984,0.00030225351815854986
NCT01578655,Comparison of Cabazitaxel/Prednisone Alone or in Combination With Custirsen for 2nd Line Chemotherapy in Prostate Cancer,0.0003752354494227089,0.0004859281621014403
NCT01558492,"Carboplatin and Paclitaxel in Patients With Metastatic, Castrate-Resistant Prostate Cancer",0.0005262115185185424,0.0004935228224646114
NCT01558219,Second-line Chemotherapy in Castration Resistant Prostate Cancer,0.00047883452475877303,0.0005460397816836523
NCT01546987,"Hormone Therapy, Radiation Therapy, and Steroid 17alpha-monooxygenase TAK-700 in Treating Patients With High-Risk Prostate Cancer",0.0005483162117209678,0.0005865210491864172
NCT01546623,A Phase 3 Comparative Study of TAP-144-SR(6M) in Prostate Cancer Patients Previously Treated With Hormonal Therapy,0.0005750232824701763,0.0007239956544888618
NCT01540994,Stereotactic Body Radiation Therapy (SBRT) for Prostate Cancer,0.0006977502793574741,0.0006516342653058408
NCT01540071,Trial of NRX 194204 in Castration- and Taxane-Resistant Prostate Cancer,0.0004706553096847408,0.0004977364039519608
NCT01565928,Safety and Tolerability Study of MDV3100 in Combination With Docetaxel in Men With Advanced Prostate Cancer,0.0004689504104554707,0.0005719325892308782
NCT01547299,Study of Enzalutamide (Formerly MDV3100) as a Neoadjuvant Therapy for Patients Undergoing Prostatectomy for Localized Prostate Cancer,0.0005589093867063512,0.0007345048522825754
NCT01572701,Pilot Study of 99mTc-MIP-1404 SPECT/CT Imaging in Men With Prostate Cancer Undergoing Prostatectomy and/or Pelvic Lymph Node Dissection,0.00043050181552795676,0.0004870164486600799
NCT01553188,AMG 386 and Abiraterone for Advanced Prostate Cancer,0.0005293803144270526,0.0006496243840053915
NCT01534052,A Study to Assess the Safety of Continued Administration of MDV3100 in Subjects With Prostate Cancer Who Showed Benefit From Prior Exposure to MDV3100,0.0004977634255362022,0.0007989087410806276
NCT01530984,Ipilimumab and GMCSF Immunotherapy for Prostate Cancer,0.0005013942087739759,0.0005680461895957206
NCT01530295,Biochemical Recurrence Rate of Radical Prostatectomy Combined With Neoadjuvant and Adjuvant Chemotherapy in High Risk Prostate Cancer,0.00038572184564934103,0.00063120381805713
NCT01533753,Quality of Life Study Using Gabapentin Versus Venlafaxine in Treating Hot Flashes in Patients With Prostate Cancer,0.0005365723503045506,0.0005794319237027544
NCT01584960,The Effect of Endurance Training in Patients With Prostate Cancer,0.0006815215227799459,0.00046357648744093836
NCT01535898,"Application of High Resolution Diffusion-weighted MR Imaging Pulse Sequence in Head and Neck, and Prostate Cancers",0.0003677967447424607,0.0004334094313092983
NCT01505075,Safety and Efficacy Study of Hypofractionated Radiotherapy and Androgen Deprivation Therapy for Prostate Cancer,0.0005079151644364494,0.0006641170661949592
NCT01581749,Evaluation of Truebeam for Low-Intermediate Risk Prostate Cancer,0.0004397823657066335,0.00047343084838796974
NCT01595087,A Phase I/II Study of ODX (Osteodex) in Metastatic Castration Resistant Prostate Cancer (CRPC),0.0004905131260690081,0.00046281492640026464
NCT01589939,Reduced Planning Target Volume (PTV) Margins for the Treatment of Prostate Cancer Using the Calypso 4D Localization System,0.0003965141553767866,0.000462080538345932
NCT01548807,Phase 1 Trial of the Mammalian Target of Rapamycin (mTOR) Inhibitor Everolimus Plus Radiation Therapy (RT) for Salvage Treatment of Biochemical Recurrence in Prostate Cancer Patients Following Prostatectomy,0.0004980936781410237,0.0005424012316475102
NCT01594593,Acceptance-Based Treatment for Prostate Cancer Distress,0.0005486055620085525,0.00047557194127224514
NCT01501630,Role of PET/CT With Fluorine-18 Tracers of Bone Metastases in Prostate Cancer,0.0003815877233163341,0.00031621886872961814
NCT01513733,The CATCH Prostate Cancer Trial: Cabazitaxel And Tasquinimod in Men With Prostate Cancer,0.0004183440726612839,0.0004805079546595326
NCT01516866,Sodium Fluoride (NaF) Positron Emission Tomography/Computed Tomography (PET/CT) in Patients With Metastatic Castrate-resistant Prostate Cancer (CRPC) With Microtubule Directed Chemo or AR-directed Therapy,0.0005459960796148123,0.0005446968737997645
NCT01516762,Radium-223 Dichloride (BAY88-8223) in Castration-Resistant (Hormone-Refractory) Prostate Cancer Patients With Bone Metastases,0.0005250400812706531,0.0005053324752586867
NCT02265536,A Study of LY3022855 In Participants With Breast or Prostate Cancer,0.0006062087908299653,0.0005822692122516226
NCT02265159,Intervention Trial Evaluating Focal Therapy Using High Intensity Focused Ultrasound for the Treatment of Prostate Cancer,0.0004279150991164577,0.0004820992609696628
NCT02203513,"A Phase II Single Arm Pilot Study of the Chk1/2 Inhibitor (LY2606368) in BRCA1/2 Mutation Associated Breast or Ovarian Cancer, Triple Negative Breast Cancer, High Grade Serous Ovarian Cancer, and Metastatic Castrate-Resistant Prostate Cancer",0.0004621836677602079,0.000621491549487981
