nct_id,brief_title,page_rank_score_brief_title,page_rank_score_brief_title_summary_combined
NCT01417182,Biodistribution and Pharmacokinetic Study of 18F-DCFBC Prostate Specific Membrane Antigen Based PET in Patients With Advanced Prostate Cancer,0.0005610279105919253,0.0006168554527484218
NCT01417676,DAPROCA Pelvic Lymph Node Irradiation to Prostate for High Risk Prostate Cancer: Phase I/II Study,0.0004732782273284573,0.0005554659199302618
NCT01491971,Intramuscular Injections of Degarelix Administered in 1-Month Dosing Regimens in Patients With Prostate Cancer,0.0005112159719995502,0.0006603072475433218
NCT01450683,Study of Itraconazole in Castrate-resistant Prostate Cancer (CRPC) Post-chemotherapy,0.00047748267168529754,0.0005177529059099589
NCT01409876,HistScanning- Based PDR Brachytherapy in Prostate Cancer HistoScanning- Based Interstitial PDR Brachytherapy,0.0005033059933645922,0.00039935674673492115
NCT01409200,Neoadjuvant Axitinib in Prostate Cancer,0.0005036505429152231,0.0004904675032691804
NCT01409473,Stereotactic Body Radiotherapy (SBRT) With Concurrent Boost for Low- and Intermediate-Risk Prostate Cancer,0.0005045480849883144,0.0005461816292311572
NCT01431391,Sequencing of Sipuleucel-T and ADT in Men With Non-metastatic Prostate Cancer,0.0004461121937083646,0.0005761345107931796
NCT01433913,Metformin Hydrochloride in Treating Patients With Prostate Cancer Undergoing Surgery,0.000570350516252198,0.0006017567898520257
NCT01410656,Prostate Cancer Survivors Moving Toward Exercise (PROMOTE) Trial,0.0005009113635585553,0.00041082106359957934
NCT01410942,Multimodal Therapy for the Treatment of Fatigue in Patients With Prostate Cancer Receiving Radiotherapy With Androgen Deprivation Therapy,0.000534619852909329,0.0005581011634791659
NCT01441713,Treatment Frequency and Satisfaction in Patients With Advanced Prostate Cancer,0.0005268449881411855,0.0005279323423077636
NCT01441687,Comparing the Reliability of Expressed Prostatic Secretion (EPS) and Post Massage Urine (PMU) for the Prediction of Prostate Cancer Biopsy Outcome,0.0003719734737886098,0.0004507904867447607
NCT01492751,Effectiveness of Localized Prostate Cancer Treatments,0.0005521662655887615,0.0005707944579467803
NCT01492270,Imaging for Significant Prostate Cancer Risk Evaluation,0.000525757470714741,0.0003648368387216604
NCT01492972,Hypo-fractionated Radiation Therapy With or Without Androgen Suppression for Intermediate Risk Prostate Cancer,0.0004554068246862469,0.000519890729669125
NCT01434290,Radiation Therapy in Treating Patients With Prostate Cancer,0.0007256059347794378,0.0005880069424942687
NCT01411319,A Phase I Trial of MRI-Guided Lattice Extreme Ablative Dose Radiotherapy For Prostate Cancer,0.0004108926259695192,0.00043742203923593425
NCT01422850,Safety Study of Repeated Dosing of a Cytotoxic Lymphocytes (CTL) Based Prostate Cancer Therapy,0.0004607636562826634,0.0005004371633472036
NCT01478412,An Evaluation of Polymer Based Fiducials for Use in Imaging Patients Receiving Treatment for Prostate Cancer,0.0005569741153710584,0.0005198167077020943
NCT01478308,Metformin With Standard Taxotere and Prednisone in the Treatment of Castration Resistant Prostate Cancer,0.00043122940720618553,0.0005352905777798864
NCT01478828,Pre-Prostatectomy Lovastatin on Prostate Cancer,0.0005025149559916662,0.0003657419883349118
NCT01439542,FASTR: Fairly Brief Androgen Suppression and Stereotactic Radiotherapy for High Risk Prostate Cancer,0.000431395512191565,0.0005038949227680736
NCT01481441,Quantification of Contrast Enhanced Ultrasound (CEUS) in the Detection of Prostate Cancer,0.0004214147622616467,0.00039709845800405886
NCT01481233,Oral Colchicine in Men With Castrate Resistant Prostate Cancer,0.0005414036200993697,0.0005490520116576712
NCT01497431,Se-Methyl-Seleno-L-Cysteine or Selenomethionine in Preventing Prostate Cancer in Healthy Participants,0.0004957854436785217,0.0004663358491301785
NCT01497925,Ph 1 Trial of ADI-PEG 20 Plus Docetaxel in Solid Tumors With Emphasis on Prostate Cancer and Non-Small Cell Lung Cancer,0.0003825211819564832,0.0003928179717032982
NCT01415375,Prostate Cancer Education in African American Men,0.000696104408644635,0.0005241298042063343
NCT01415960,Efficacy and Safety of Leuprolide Acetate 22.5 mg Depot in Treatment of Prostate Cancer,0.0005509274043473491,0.00046153974995937305
NCT01446731,Dendritic Cell Vaccination and Docetaxel for Patients With Prostate Cancer,0.0005233153168674364,0.0005583114738778166
NCT01487863,Concurrent Versus Sequential Treatment With Sipuleucel-T and Abiraterone in Men With Metastatic Castrate Resistant Prostate Cancer (mCRPC),0.00041393507634154733,0.0005024061123270973
NCT01487902,The Role of Androgen Deprivation Treatment (ADT) in Docetaxe-Prednisolone Chemotherapy for Castrate-Resistant Prostatic Cancer,0.00044195615561284707,0.000554737066548825
NCT01420861,GTx-758 on Serum Prostate-specific Antigen (PSA) in Men With Castrate Resistant Prostate Cancer,0.0003967985525142304,0.0005723316572869803
NCT01420250,Cabazitaxel With Radiation and Hormone Therapy for Prostate Cancer,0.0004685030515045722,0.0005243344950195685
NCT01420965,"Sipuleucel-T, CT-011, and Cyclophosphamide for Advanced Prostate Cancer",0.0004391533111065317,0.0005215336037504966
NCT01401972,Conventional Ultrasound for Imaging of Prostate Cancer Extent and Response in Human Cancer Patients,0.0004803596636431527,0.0005244906655217799
NCT01428869,"Combination Statin, Acetylsalicylic Acid and Dutasteride Use in Prostate Cancer",0.00038661700819428646,0.0004266333789981603
NCT01447186,Adaptation of the American Cancer Society (ACS) Early Detection of Prostate Cancer Patient Decision Aid for Spanish Speaking Men,0.00048090611726857513,0.0003889299893579591
NCT01484808,The Utility of PSADv (PSA Density Velocity) While on Dutasteride for Predicting Prostate Cancer Incidence and Grade and Stage,0.0003848771027753133,0.00038839708419668615
NCT01414296,Extended Study of Prostate-specific Membrane Antigen Antibody-Drug Conjugate in Subjects With Prostate Cancer,0.00042745465517073864,0.0004699969651187824
NCT01414283,Prostate-specific Membrane Antigen Antibody-Drug Conjugate in Subjects With Prostate Cancer,0.0003736625157423815,0.0005260753243283606
NCT01414712,Circulating Tumor Cells in Prostate Cancer Patients,0.0006825146745162432,0.0006451594818015241
NCT01436214,Dose-Escalation and Safety Study of APC-100 for the Treatment of Prostate Cancer,0.0006536889469161223,0.0009479572092168294
NCT01436968,Phase 3 Study of ProstAtak® Immunotherapy With Standard Radiation Therapy for Localized Prostate Cancer,0.00046001087931643814,0.0005883689941332621
NCT01296139,Ferumoxytol Enhanced MRI for the Detection of Lymph Node Involvement in Prostate Cancer,0.00041787127053092985,0.0004930238258818438
NCT01296243,"Tesetaxel in Chemotherapy-naive Patients With Progressive, Castration-resistant Prostate Cancer",0.0005247822753148638,0.0005559245625115042
NCT01284608,Metabolic Changes in Prostate Cancer Patients With Androgen-ablation Therapy (AAT),0.0005136924817567351,0.0004866158096001228
NCT01284920,"A Study of MDV3100 to Evaluate Safety, Tolerability, Pharmacokinetics and Efficacy of in Prostate Cancer Patients",0.0005893132740155978,0.0007272268045900239
NCT01221168,Epidemiologic and Genetic Study on Familial Prostate Cancer,0.000601993037049704,0.0005622860443170378
NCT01253642,Phenelzine Sulfate and Docetaxel in Treating Patients With Prostate Cancer With Progressive Disease After First-Line Therapy With Docetaxel,0.0004944337358995796,0.0005476186289623089
NCT01253213,BR55 in Prostate Cancer: an Exploratory Clinical Trial,0.0006988253550157449,0.00044503251364417547
NCT01287845,PET/CT (Positron Emission Tomography/Computed Tomography) Imaging for Safety and Tolerability and Diagnostic Performance of BAY1075553 in Patients With Prostate Cancer and Healthy Volunteers,0.0004921118001519145,0.0006177918577800887
NCT01275872,Effect of Guided Imagery and Progressive Muscle Relaxation as a Means to Improve the Psychological Well-being and the Quality of Life for Patients With Breast and Prostate Cancer,0.0004707195118417007,0.00045404817462727697
NCT01275651,Biomarkers in Bone Marrow and Blood Samples From Patients With Prostate Cancer Treated With Ketoconazole,0.0004766119067034828,0.0005093855357861707
NCT01267266,Saracatinib in Treating Patients With Prostate Cancer,0.0006812985874745455,0.0005665301734685463
NCT01254279,Early Access to Cabazitaxel in Patients With Metastatic Hormone Refractory Prostate Cancer Previously Treated With a Docetaxel-containing Regimen,0.000520846289079711,0.0004949387738687754
NCT01225471,Novel Peptide Vaccination for Patients With Advanced Prostate Cancer,0.0005225058802254297,0.0006523400636954559
NCT01220973,Atorvastatin Calcium and Celecoxib in Treating Patients With Rising PSA Levels After Local Therapy for Prostate Cancer,0.00047919397724245595,0.0004542822374179986
NCT01220869,A Study of Degarelix in Taiwanese Patients With Prostate Cancer,0.0006469731941895785,0.0008920756907633091
NCT01220427,Micro-RNA Expression Profiles in High Risk Prostate Cancer,0.0003890131495830267,0.00053383789494791
NCT01238172,Diet in Altering Disease Progression in Patients With Prostate Cancer on Active Surveillance,0.0005124194210951631,0.0005165872458880903
NCT01277562,Pilot Study of Secondary Causes of Osteopenia/Osteoporosis in Adults With Breast and Prostate Cancer,0.0004346165359168587,0.0005369213175488267
NCT01279785,A Pilot Study of 123I-MIP-1072 SPECT/CT Imaging With Optional Compact Gamma Camera Probe Imaging in Men With Prostate Cancer Undergoing Prostatectomy,0.0004262528370122478,0.00041038803131905475
NCT01215799,Study of Bafetinib (INNO-406) as Treatment for Patients With Hormone-Refractory Prostate Cancer,0.0006085697140139282,0.0008367362453102932
NCT01215526,"A Study Into the Effectivity and Safety of Firmagon, Prescribed for Treatment of Patients With Advanced Prostate Cancer",0.0005797645470113356,0.000596967528995068
NCT01226576,Focal MR-Guided Focused Ultrasound Treatment of Localized Low-Intermediate Risk Prostate Cancer: Feasibility Study,0.00040095648884978845,0.0004538801024295194
NCT01226888,Changes in Brown Adipose Tissue Activity In Men Receiving Androgen Deprivation Therapy for Prostate Cancer,0.0003887979966766786,0.000342583154401248
NCT01226004,Multi-Institutional Registry for Prostate Cancer Radiosurgery,0.00038130059759084107,0.00034621830607853824
NCT01204710,A Study of IMC-3G3 in Prostate Cancer,0.0008499808471902634,0.00046774010591910076
NCT01205321,"PET/CT Imaging for Radiation Dosimetry, Plasma Pharmacokinetics, Biodistribution, Safety and Tolerability and Diagnostic Performance of BAY86-7548 in Patients With Prostate Cancer and Healthy Volunteers",0.00048805012285214595,0.00037810884206227407
NCT01240551,F-18 Sodium Fluoride in Prostate Cancer,0.0004962257839393465,0.0005417912901431026
NCT01214291,Efficacy and Safety Study of Toremifene Citrate for the Reduction in the Risk of New Bone Fracture Occurrences in Men With Prostate Cancer,0.0004496091693640033,0.0006072307980933375
NCT01224405,"Prostate Cancer, Androgen Deprivation Withdrawal and Intermittent Chemotherapy",0.00039870921020114406,0.0005027807305911059
NCT01200810,Bicalutamide and RO4929097 in Treating Patients With Previously Treated Prostate Cancer,0.0006864167621899403,0.0005808275927436171
NCT01252693,"International,Multi-Center,Open Label,Randomized Study Assessing the Safety and Efficacy of a Monthly Dosing Regimen of Ozarelix Versus Goserelin Depot in Men With Prostate Cancer",0.0004238776745190742,0.00043497016527325376
NCT01272648,Rehabilitation After Radiotherapy for Prostate Cancer,0.0005410864025904317,0.0003768199019242898
NCT01272050,Radiation Therapy in Treating Patients With Relapsed Prostate Cancer After Surgery,0.0005452378740012086,0.0004698516480442696
NCT01229618,Hyperpolarized Pyruvate Injection in Subjects With Prostate Cancer,0.00041619711418093813,0.00045830142992100444
NCT01242748,A Degarelix Trial in Patients With Prostate Cancer,0.0006897509987579181,0.0005763568820125771
NCT01250717,Docetaxel Followed by Radical Prostatectomy in Patients With High Risk Localized Prostate Cancer,0.000538774407282945,0.0006229487634540472
NCT01251861,Bicalutamide With or Without Akt Inhibitor MK2206 in Treating Patients With Previously Treated Prostate Cancer,0.0005622211032887502,0.0006486077124827012
NCT01230866,Study of Hypo-fractionated Proton Radiation for Low Risk Prostate Cancer,0.0005334086929518652,0.0006228264785159911
NCT01292291,MRI in Diagnosing Prostate Cancer,0.0007098876784296392,0.00039260965281589664
NCT01206036,CESAR Study in Prostate Cancer With Temsirolimus Added to Standard Docetaxel Therapy (CEPTAS),0.000479120798580229,0.0005883367093889861
NCT01234311,A Study of Tasquinimod in Men With Metastatic Castrate Resistant Prostate Cancer,0.0005024239555596826,0.0004690898032784664
NCT01234350,Post Authorisation Safety Study (PASS) on Patients With Advanced Prostate Cancer,0.0006624624349025391,0.000514455883613026
NCT01265953,"Chemoprevention of Prostate Cancer, HDAC Inhibition and DNA Methylation",0.0004960081640238801,0.000371812815488716
NCT01217697,Study of Abiraterone Acetate in Patients With Advanced Prostate Cancer,0.0005981818786477464,0.0005790425586082465
NCT02934685,IG-VMAT for Localized Prostate Cancer,0.0013257273503292514,0.0003598435751174654
NCT02934776,Prospective Cohort Study of the Ability of MRI/DTI to Diagnose Prostate Cancer,0.0006118090631117231,0.000815893894179259
NCT02969564,18F-NaF-PET/MR vs 99mTc-MDP-SPECT/CT to Detect Bone Metastases in Prostate Cancer Patients.,0.0004843790493204511,0.00048423563154483066
NCT02917161,Prostatic Artery Embolization Before Radical Prostatectomy in Prostate Cancer: A Proof-of-concept Study,0.00044171441544386703,0.0004723769014742858
NCT02911350,"Safety Study of Combination of Hormone Therapy, Paclitaxel and Radiation Therapy to Treat Prostate Cancer",0.00047531540688894075,0.0006600271308394759
NCT02911922,Randomized Trial of Image -Guided Stereotactic Radiation Therapy (IG-SRT) in Prostate Cancer,0.0003841569630911218,0.0005402716347659487
NCT02954289,Cooking Class Intervention Project for Men With Prostate Cancer and Their Partners,0.0004172888779128246,0.0004854032652705757
NCT02964351,microRNA Profiles Identification in Adeno Carcinoma Prostate Cancer,0.00041517740246722353,0.0004135162677134018
NCT02964988,uPAR PET/CT in Radium-223-dichloride Treatment of Patients With Metastatic Castration-resistant Prostate Cancer,0.0005625749383797997,0.0006096391456021402
NCT02975934,A Study of Rucaparib Verses Physician's Choice of Therapy in Patients With Metastatic Castration-resistant Prostate Cancer and Homologous Recombination Gene Deficiency,0.0006105474537764585,0.0005727631041251657
NCT02981368,Study of 18F-DCFPyL PET/CT Imaging in Patients With Prostate Cancer (OSPREY),0.000559927046673231,0.000461527726147084
NCT02981797,Assess Gamma H2AX Positivity in Circulating Prostate Cancer Cells Before and After Radium 223,0.000500064482157641,0.0004393940171035924
NCT02906605,"A Study of the Clinical Activity and Safety of JNJ-64041809, a Live Attenuated Listeria Monocytogenes Immunotherapy, in Combination With Apalutamide Versus Apalutamide in Subjects With Metastatic Castration-resistant Prostate Cancer",0.00048415114811701767,0.0005214639562332433
NCT02914873,SPCG17: Prostate Cancer Active Surveillance Trigger Trial,0.0007082125761873666,0.00045508981858551555
NCT02987829,"A Phase 1/2A Study of TRC253, an Androgen Receptor Antagonist, in Metastatic Castration-resistant Prostate Cancer Patients",0.0005914155113322783,0.0005584694931463395
NCT02952534,A Study of Rucaparib in Patients With Metastatic Castration-resistant Prostate Cancer and Homologous Recombination Gene Deficiency,0.0005815888561434177,0.0006466268989697803
NCT02968784,Focal ExAblate MR-Guided Focused Ultrasound Treatment for Management of Organ-Confined Intermediate Risk Prostate Cancer,0.0003963020597356234,0.0004854307208314761
NCT02919904,Feasibility Study for the Assessment of Sleep Quality in Men With Prostate Cancer Starting ADT,0.00041923523197919676,0.0004587535931439965
NCT02923180,Neoadjuvant Enoblituzumab (MGA271) in Men With Localized Intermediate and High-Risk Prostate Cancer,0.0003974995266082453,0.00045788225576349166
NCT02903368,Neoadjuvant And Adjuvant Abiraterone Acetate + Apalutamide Prostate Cancer Undergoing Prostatectomy,0.00039440611768583946,0.0004900307511992491
NCT02903160,"Prostate Cancer Intensive, Non-Cross Reactive Therapy (PRINT) for Castration Resistant Prostate Cancer (CRPC)",0.00045891022500661163,0.0005145568008476323
NCT02905201,A Prospective Compliance Registry for Patients With Metastatic Castration Resistant Prostate Cancer (mCRPC),0.0005287517155740381,0.0005855806726082005
NCT02940977,Establishment and Clinical Assessment of a Prostate Cancer (PCa) Risk Model Based on the Updated Circulating Tumor Cell (CTC) Detection Technique,0.00036897659304540274,0.0003487589883626833
NCT02963051,"A Phase Ib Study of Intravenous Copper Loading With Oral Disulfiram in Metastatic, Castration Resistant Prostate Cancer",0.00047366576402318105,0.000448527875374574
NCT02963675,Incidence of Second Primary Malignancies in Prostate Cancer Patients With Bone Metastases - an Observational Retrospective Cohort Study in Sweden,0.0005530282927426217,0.0005174182876773696
NCT02918968,Study on Enzalutamide and Flutamide in Patients With Castration Resistant Prostate Cancer,0.0005763939009629669,0.0005759865126788935
NCT02989623,Copper Cu 64 TP3805 PET in Detecting Prostate Cancer in Patients With Persistently Elevated PSA,0.0005136897800255864,0.000521808995276327
NCT02961686,Quality of Life and Sexuality in Patients With Prostate Cancer,0.0006869629892605156,0.0006239401582912265
NCT02920229,68Ga-PSMA HBED-PET/CT in the Evaluation of the Biochemical Relapse in Patients With a History of Prostate Cancer Radically Treated,0.0005024470576618528,0.00040786754660181905
NCT02974231,Intensity-modulated Radiation Therapy From 70Gy to 80Gy in Localized Prostate Cancer,0.0007596023067173055,0.00042560716142351734
NCT02974075,Salvage Lymph Node Dissection in Prostate Cancer Patients With Recurrence After Radical Prostatectomy,0.00048747995928068497,0.0005511831483072816
NCT02946008,A Phase I Trial of Neoadjuvant Stereotactic Body Radiotherapy Prior to Radical Prostatectomy for High Risk Prostate Cancer,0.0004032338394025237,0.00041587055543029154
NCT02946996,Study of Pharmacologic Manipulation of AGE (Advanced Glycation Endproducts) Levels in Prostate Cancer Patients Receiving Androgen Deprivation Therapy,0.000556090927354803,0.0005855998166447859
NCT02991911,A Phase 1/1b Study of MEDI3726 in Adults Subjects With Metastatic Castration Resistant Prostate Cancer,0.0005194320228144528,0.0005102951049593673
NCT02933255,PROSTVAC in Combination With Nivolumab and/or Ipilimumab in Men With Prostate Cancer,0.0004240483693971094,0.0005899363622541047
NCT02927899,Taste Acceptability of Tomato-Soy-Arugula Seed Beverages in Men With Prostate Cancer,0.00041503810899015724,0.00039357972433380314
NCT02949284,"Androgen Receptor Antagonist ARN-509 With or Without Abiraterone Acetate, Gonadotropin-Releasing Hormone Analog, and Prednisone in Treating Patients With High-Risk Prostate Cancer Undergoing Surgery",0.0004932227662867237,0.000522077631841177
NCT02960022,A Study for Subjects With Prostate Cancer Who Previously Participated in an Enzalutamide Clinical Study,0.0005130358521282833,0.0006058894727505042
NCT02960087,Phase II High Dose Brachytherapy and Low Dose Rate Brachytherapy as Monotherapy in Localized Prostate Cancer,0.0004394856580409033,0.0005187605467487165
NCT02971085,Seoul National University Prospectively Enrolled Registry for Prostate Cancer With Active Surveillance,0.0004248726213356404,0.00047179699297812417
NCT02971358,Safety and Early Efficacy of Radical Prostatectomy for Newly Diagnosed Very High Risk Locally Advanced and Oligometastatic Prostate Cancer,0.00042123251687364963,0.0006066221313354456
NCT02972060,ODM-201 vs Androgen Deprivation Therapy in Hormone naïve Prostate Cancer,0.0007096462156371577,0.0005081911846427509
NCT02998619,Radiotherapy of Pelvic Lymph Nodes in High Risk Prostate Cancer - A Retrospective Analysis,0.000461520558250621,0.0004366619349639796
NCT02967458,"Detection of High Grade Prostate Cancer With Subharmonic Ultrasound Imaging, A Pilot Study",0.0004554629426076469,0.0003952213720357116
NCT02957357,Optimizing the Effectiveness of Routine Post-treatment Surveillance in Prostate Cancer Survivors,0.00041586458839075734,0.0004895661969833486
NCT02935023,Carbon Ion Radiotherapy in Treating Patients Undergoing Systemic Therapy for Oligo-metastatic Prostate Cancer,0.0005267054533120597,0.0005864384695849067
NCT02935816,Localising Occult Prostate Cancer Metastases With Advanced Imaging TEchniques,0.0004452954192179398,0.0002843942919760352
NCT02945813,PROMET - Trial of Salvage Radiotherapy +/- Metformin for Patients With Prostate Cancer After Prostatectomy,0.0005017693617251769,0.0004571894063397022
NCT02500901,Enzalutamide and Niraparib in the Treatment of Metastatic Castrate-Resistant Prostate Cancer (CRPC),0.0004482067285942797,0.0006431074952427991
NCT02507570,Open Label Phase Two Study of Enzalutamide With Concurrent Administration of Radium Ra 223 Dichloride in Castration-Resistant (Hormone-Refractory) Prostate Cancer Subjects With Symptomatic Bone Metastasis,0.0004670497141276239,0.00042404411640115336
NCT02542501,Study to Evaluate the Presence of Lower Urinary Tract Symptoms (LUTS) in Prostate Cancer Patients Scheduled to Receive Luteinizing Hormone Releasing Hormone (LHRH) Analogues,0.0005402546083360285,0.0004884581095930735
NCT02566772,Study of TAS3681 in Metastatic Castration Resistant Prostate Cancer,0.0005194320228144528,0.0007188123567136306
NCT02526368,A Pilot Study of (MR) Imaging With Pyruvate (13C) to Detect High Grade Prostate Cancer,0.00045610950356510233,0.0004251950242921619
NCT02526784,A Trial Evaluating Two Subcutaneous Injection Techniques and Intramuscular Administration of Degarelix in Patients With Prostate Cancer,0.00048513173385759966,0.00042736196879094256
NCT02526797,Multiparametric MRI in Men With Prostate Cancer Undergoing Active Surveillance,0.0005079781793531061,0.0004436625913466541
NCT02570919,Phase II Study of Ultra-high-dose Hypofractionated vs. Single-dose Image-Guided Radiotherapy for Prostate Cancer,0.00045082963661858877,0.0006268284710088378
NCT02573636,The Predictive Value of Coexisting TMPRSS2-ERG Gene Fusion and PTEN Deletion in Prostate Cancer Patients With Biochemical Failure Status Post Salvage or Radical Radiation Therapy,0.0005079643984545122,0.0005320060022468818
NCT02512185,Towards Optimal Prescription of Chemotherapy in Prostate Cancer,0.0005076121448482952,0.00046933563299878114
NCT02512458,Study of the Effect of Chemotherapy With Cabazitaxel on Prostate Cancer,0.0005088977443835916,0.000500260939088282
NCT02598895,"Docetaxel and Carboplatin in Treating Patients With Metastatic, Hormone Resistant Prostate Cancer Containing Inactivated Genes in the BRCA 1/2 Pathway",0.0005426166884370464,0.0006318929017258018
NCT02594202,Care of the Prostate Cancer Patient and Prospective Procurement of Prostate Cancer Tissue,0.000683789784914519,0.0006003183464762565
NCT02563691,Stereotactic Radiotherapy for Oligometastatic Prostate Cancer,0.0006964903314841802,0.0004980624707795971
NCT02560051,Hormone Therapy Plus Chemotherapy as Initial Treatment for Local Failures or Advanced Prostate Cancer,0.0004525621226791091,0.0005340748885982795
NCT02588001,Japanese Research for Patients With Non-metastatic Castration Resistant Prostate Cancer - Enzalutamide,0.000546554864685569,0.0005571209735562854
NCT02588404,The Predictive Value of TMPRSS2-ERG Fusion in High Risk Prostate Cancer Patient,0.0005720643950177095,0.0006252788960725533
NCT02555189,"Enzalutamide With and Without Ribociclib for Metastatic, Castrate-Resistant, Chemotherapy-Naive Prostate Cancer That Retains RB Expression",0.00041381548004833105,0.0005685649959532783
NCT02584179,Can Significant Prostate Cancer Be Detected With a Biparametric MRI?,0.0004978277376243826,0.0005278083573966585
NCT02518698,Treatment Patterns in Castrate Resistant Prostate Cancer Patients With Bone Metastases in a Medicare Population,0.0005413807582726583,0.0006517639608781904
NCT02572284,Dose Escalation Study of Preoperative SBRT for High Risk Prostate Cancer,0.0006166691667275352,0.000517006623283488
NCT02516995,Functional Magnetic Resonance Imaging for High Throughput Curietherapy Planning in Prostate Cancer,0.0003944796993058624,0.0004179390969194325
NCT02516709,Linear Source Registry for Prostate Cancer,0.0004988060976704427,0.000456622571956889
NCT02552394,J591 in Patients With Advanced Prostate Cancer and Unfavorable Circulating Tumor Cell Counts,0.0005273329980913548,0.0005758689630155344
NCT02546908,A Registry of Participants With Prostate Cancer in Asia,0.0006978312474375237,0.0005909685277507648
NCT02531516,An Efficacy and Safety Study of JNJ-56021927 (Apalutamide) in High-risk Prostate Cancer Subjects Receiving Primary Radiation Therapy: ATLAS,0.00046719633424831475,0.00048111775700282575
NCT02564120,North Carolina Prostate Cancer Comparative Effectiveness & Survivorship Study (NC ProCESS),0.0006044246437906931,0.0005426038364178716
NCT02514213,Trial to Evaluate Safety and Immunogenicity of INO-5150 Alone or With INO-9012 in Men With Prostate Cancer,0.0004339481799755882,0.0004070166031285323
NCT02506114,Neoadjuvant PROSTVAC-VF With or Without Ipilimumab for Prostate Cancer,0.0005058968118750902,0.000501716303641132
NCT02559115,68Ga-RM2 for PET/CT of Gastrin Releasing Peptide Receptor (GRPr) Expression in Prostate Cancer,0.00039008080231780687,0.0004003195744072394
