nct_id,brief_title,description,brief_title_concepts_list,brief_summary_concepts_list,tot_subj_affected,tot_subj_risk,relevance,citationSum,citationAvg,briefTitlePageRankScore,briefTitleAndSummaryCombinedPageRankScore,brief_title_matched_count,brief_summary_matched_count
NCT02701621,Aquatic Therapy Versus Land-Based Therapy for the Treatment of Balance Dysfunction in Parkinson's Disease,The aim of this study is to compare the effectiveness of a specific aquatic therapy program      on balance with a land-based physical-treatment in patients with Parkinson's disease and to      evaluate the long-term effects in a 6-month follow-up period.,C0030567;C0277785;C0087111;C0087111;C0087111;C0014653,C0030567;C4553491;C0087111;C1552740;C0884441;C0087111;C0014653;C0025344;C0947630;C1518681;C0031809;C0220825,0.0,0.0,0,1.0,1.0,0.02122133518956588,0.018938110154779798,0,0
NCT00627588,"Phase I/II Study of the Safety, Efficacy and Dose Evaluation of ProSavin for the Treatment of Bilateral Idiopathic Parkinson's Disease","The primary objectives of the trial are to assess the safety and efficacy of ProSavin.      Patients in the trial will have been diagnosed with Parkinson's disease and will be failing      on current treatment with L-DOPA but they will not have progressed to drug-induced      dyskinesias. The first stage is an open-label dose escalation to evaluate up to three dose      levels of ProSavin in cohorts of three patients each. Following a recommendation by the DMC      the study may proceed to the second stage of the trial, a further 12 patients will be      recruited to confirm efficacy of the optimal dose in the randomized phase of the study.      The efficacy of ProSavin will be assessed using the Unified Parkinson's Disease Rating Score      (UPDRS). Patients will be monitored at regular intervals, with the primary endpoint being an      efficacy assessment at six months after treatment. The secondary objective of the trial is to      asses the extent to which patients' current therapy (L-DOPA) can be reduced following      administration of ProSavin.",C0030567;C0220825;C0087111;C0947630,C0030567;C0030567;C0220825;C2986535;C1533734;C0441767;C0018017;C0011900;C0087111;C0087111;C0027627;C0018017;C0750484;C0087111;C0023570;C0023570;C1300072;C1705425;C0947630;C0947630;C4050231;C0013227;C0013384;C1550655;C1550655;C1561542;C0018792;C0018792;C0018792;C0018792;C0030695;C0220825;C0429028,0.0,0.0,0,90.0,90.0,0.022198846944301385,0.017977739091098618,0,0
NCT00406588,SLV308 for Treatment of Patients With Parkinson's Disease Experiencing Motor Fluctuations,"This study is a multicenter, randomized, double blind, parallel group study of 3 months'      treatment with SLV308 administered as a monotherapy in patients with advance stage PD. An      open label safety extension to this study is planned as a separate protocol for patients who      are willing and eligible to participate.",C0030567;C0087111;C0231239;C1550655,C0087111;C0442711;C0600109;C0947630;C0456909;C0947630;C1300072;C1705425;C0947630;C0086972;C1525442;C1561542;C1552839;C4554418;C4698437,0.0,0.0,0,5.0,5.0,0.02331141453187156,0.01775611700923574,0,0
NCT00914095,Study of Methylphenidate to Treat Gait Disorders And Attention Deficit In Parkinson's Disease (PARKGAIT-II),"~     Therapeutic management of gait disorders in very advanced Parkinson's disease (PD) patients~     can sometimes be disappointing, since dopaminergic drug treatments and subthalamic nucleus~     (STN) stimulation are more effective for limb-related Parkinsonian signs than for gait~     disorders. Gait disorders could be also partly related to noradrenergic system impairment,~     pharmacological modulation of both dopamine and noradrenaline pathways could potentially~     improve the symptomatology. The investigators have demonstrated using an open label study on~     17 advanced PD patients that chronic, high doses of methylphenidate (MPD) improved gait,~     freezing of gait, motor symptoms and attention in the absence of L-Dopa and increased the~     intensity of response of these symptoms to L-Dopa (Devos et al., 2007). The investigators~     aimed to confirm their results using a randomized, double-blind, placebo-controlled,~     parallel-group, multicentric trial. The investigators will assess the clinical value of~     chronic, high doses (1 mg/kg/day) of MPD vs placebo in 88 non demented PD patients suffering~     from severe gait disorders with freezing despite their use of optimal dopaminergic doses and~     eventually STN stimulation parameters. Efficacy will be assessed directly and on video in the~     absence of L-Dopa and again after acute administration of the drug, both before and after a~     3-month course of MPD, using Stand Walk Sit test (primary criteria), the Freezing Of Gait~     trajectory, RGSE scale, the UPDRS scores, the dyskinesia rating scale, Achiron scales and~     using auto-questionnaires of Giladi, ABC scale and PDQ 39. Attention will be assessed using~     reactions times. Drowsiness will be assessed using Epworth and Parkinson's disease Sleep~     Scales. Apathy and depression will be monitored with Lille Apathy Rating Scale, MADRS, BPRS,~     MINI and psychiatric interview. Cardiologic and general tolerance will be also monitored.~     This study could lead to propose methylphenidate with a good efficacy/ risk balance in~     advanced PD patients suffering from severe gait disorders with freezing of gait, drowsiness~     and attention deficit.~   ",C0025810;C0004268;C0012634,C0025810;C0025810;C0034394;C0013144;C0011570;C0004268;C0004268;C0004268;C0013030;C0184511;C1457887;C1457887;C0012634;C0012634;C0014653;C0222045;C0222045;C0085632;C0085632;C0013023;C0013023;C0013023;C0013144;C0184511;C0032042;C0032042;C0376495;C0555216;C0555216;C0037313;C0222045;C0222045;C0222045;C0222045;C3845829,0.0,0.0,-1,65.0,21.6666666666667,0.01478904387282753,0.017194507377245274,0,0
NCT00324896,"Treatment of Insomnia in Patients With Parkinson's Disease: A Multi-site, Placebo-controlled Study of Eszopiclone","Parkinson's disease (PD) is the second most common neurodegenerative disease in the US,      affecting nearly 1 million Americans. Up to 82% of community dwelling individuals with PD      complain of sleep disturbances, typically sleep fragmentation. Despite the high prevalence of      sleep problems and their impact on the life of these individuals, there has been, until      recently, little research focus on the problem. This will be a multi-site, double blind,      placebo-controlled, two arm, parallel group, fixed-dose trial which will last 6 weeks.      Seventy patients at four sites (30 at the PI's site and a total of 40 patients at three      external sites) will be equally randomized to eszopiclone or placebo. The primary hypothesis      is that eszopiclone will be superior to placebo for the treatment of insomnia in patients      with Parkinson's disease",C0030567;C1436328;C0087111;C0917801;C0032042;C3266262;C0947630;C1550655;C2911690,C0524851;C0030567;C0030567;C0037317;C1436328;C1436328;C0087111;C0917801;C0033213;C0032042;C0032042;C0032042;C3245511;C0037313;C0037313;C0456909;C0446516;C0277786;C1881708;C0033213;C2911690;C3694424;C0404831;C1552839;C0018792;C4554418;C1548801,14.0,180.0,0,17.0,17.0,0.021569098855983238,0.016967555687123045,0,0
NCT01772693,ExAblate Transcranial MR Guided Focused Ultrasound for the Treatment of Parkinson's Disease,"This is a feasibility study to evaluate the safety and initial effectiveness of unilateral      ExAblate thermal ablation of the Vim thalamic nucleus of subjects suffering from      medication-refractory, idiopathic, tremor-dominant PD, using the ExAblate Transcranial system      compared to a Sham Vim thalamotomy procedure.      Data will be collected to establish the basic safety of this type of treatment as the basis      for later studies that will evaluate its full clinical efficacy. The Sham treatment data will      be used to evaluate placebo effect from treatment.",C0030567;C1517281;C0087111;C0302614,C0015730;C0677798;C4553491;C0013227;C0683278;C0184661;C0087111;C0087111;C0087111;C0039729;C0947630;C0032042;C0040822;C1518681;C3245479;C1273517;C0195894;C1137023;C0220825;C0220825;C3272565;C0220825;C3496275,0.0,0.0,0,8.0,8.0,0.021132052205337808,0.01692016946819525,0,0
NCT02879136,"TAME-PD - Physical Therapy, Atomoxetine and, Methylphenidate, to Enhance Gait and Balance in Parkinson's Disease","~     Gait and balance problems are a significant source of disability in patients with Parkinson~     disease. Physical therapy remains one of the main treatments. On the other hand some~     medications, such as methyphenidate and atomoxetine, have been tried with promising results.~     The outcomes in gait and balance in Parkinson disease after a combination of physical therapy~     and the medications mentioned above have not been explored yet. The investigators want to~     evaluate whether the addition of medication, either low dose of methylphenidate or~     atomoxetine, to physical therapy will achieve improvement in gait and balance in Parkinson~     disease more than physical therapy alone. The investigators propose a pilot, single center,~     rater blind, prospective randomized trial. 2-arm-parallel group, intention-to-treat analysis.~   ",C0949766;C0025810;C0076823;C0014653;C0012634,C0030567;C0949766;C0949766;C0949766;C0025810;C4284232;C0076823;C4284232;C0076823;C0014653;C0012634;C0014653;C0014653;C0012634;C0449416;C0018563;C0949766;C4284232;C0033213;C0376495;C0723338;C1449882,0.0,0.0,-1,0.0,0.0,0.014552130716564788,0.016798184707558356,0,0
NCT00643890,Study of AAV-GAD Gene Transfer Into the Subthalamic Nucleus for Parkinson's Disease,"~     The purpose of this study is to determine the safety and efficacy of AAV-GAD gene transfer~     into the subthalamic nucleus (STN) region of the brain. This study involves the treatment of~     subjects with medically refractory Parkinson's disease (PD). The gene transfer product, a~     disabled virus with a gene called GAD, will be infused into the STN bilaterally using~     stereotactic surgical techniques. The overall goal of this approach is to normalize the~     activity of the STN and reduce the motor symptoms of PD.~      Because the change in UPDRS demonstrated a positive outcome, the sham surgery subjects from~     the blinded portion of the study will be invited to crossover into the Open-label Arm portion~     of the study. The Open-label Arm will further evaluate the safety and efficacy of AAV-GAD~     gene transfer into the subthalamic nucleus (STN) region of the brain.~   ",C0012634;C3496275,C1457887;C1446409;C0012634;C0006104;C0446516;C0446516;C3496275;C3496275;C0376495,0.0,0.0,-1,196.0,98.0,0.014810150048885596,0.01647843419497573,0,0
NCT01971242,Trial of Exenatide for Parkinson's Disease,"~     This study is a clinical trial in patients with Parkinson's disease, of a drug called~     Exenatide which is already licensed for the treatment of patients with Type 2 Diabetes. There~     have been several groups that have confirmed that Exenatide has beneficial effects on nerve~     cells when tested in the laboratory, that raises the possibility that Exenatide may slow down~     or stop the degenerative process of Parkinson's disease. In an open label trial in patients~     with Parkinson's disease who self administered the drug for 1 year, we have previously shown~     that the drug is well tolerated and shows encouraging effects on the movement and~     non-movement aspects of the disease, even 2 months after patients stopped administering the~     drug. The next step is therefore to formally evaluate whether Exenatide really is a potential~     neuroprotective drug, i.e. stops the nerve cells dying in Parkinson's disease, by~     conducting a double blind, placebo controlled trial.~   ",C0012634,C0011847;C0026649;C0026649;C0012634;C1522240;C0012634;C0012634;C0012634;C0012634;C0032042;C0180112;C0376495,0.0,0.0,-1,94.0,94.0,0.02083202838588437,0.016319753907876874,0,0
NCT02680977,Mucuna Pruriens Therapy in Parkinson's Disease,"In low-income areas worldwide, most patients with Parkinson's disease (PD) cannot afford      long-term Levodopa therapy. A potential therapeutic option for them is the use of a legume      called Mucuna Pruriens var. Utilis (MP), which has seeds with a high levodopa content (5-6%)      and grows in all tropical areas of the world. MP powder is very cheap (total annual cost for      a PD patient: 10-15 US $). The aim of this study is to assess efficacy and tolerability of      acute and chronic use of MP compared to standard Levodopa therapy.      The primary objective of this study is to investigate efficacy of acute levodopa challenge      using MP in comparison to levodopa with a Dopa Decarboxylase Inhibitor (LD+DDCI) and without      (LD-DDCI) and placebo.      The secondary objectives are to investigate safety of acute intake of MP as well as efficacy      and safety of chronic intake of MP over a 8-week period in comparison to usual LD+DDCI home      therapy.",C0030567;C0087111,C3536799;C0030567;C0018017;C0018017;C0805586;C0027627;C0023570;C0023570;C2828392;C0023570;C0023570;C0023570;C0087111;C0087111;C0032042;C0087111;C1095908;C0025344;C0947630;C0947630;C0013023;C1550472;C0087111;C0445334;C1552853,0.0,0.0,0,3.0,1.5,0.034207506310384474,0.016161545549943368,0,0
NCT02003248,A Feasibility Study to Evaluate Safety and Initial Effectiveness of ExAblate Transcranial MR Guided Focused Ultrasound for Unilateral Pallidotomy in the Treatment of Dyskinesia of Parkinson's Disease,"The proposed study is to evaluate the safety and initial effectiveness of the ExAblate      Transcranial MRI-guided focused ultrasound (MRgFUS) treatment of patients with dyskinesia of      Parkinson's Disease (PD)        -  Safety: To evaluate the incidence and severity of adverse events (AE/AEs) associated           with ExAblate Transcranial MRgFUS treatment of dyskinesia of PD        -  Effectiveness: To determine the level of effectiveness of the ExAblate Transcranial           MRgFUS treatment of dyskinesia of PD.Efficacy will be determined utilizing the UPDRS-IV           for dyskinesia in PD from examinations at baseline and every 3-Months post-ExAblate           treatment.      This study is designed as a prospective, single-site, single arm, nonrandomized study.      Assessments will be made before and three months after MRgFUS for clinical symptom relief,      quality of life (QoL) improvements, and safety of MRgFUS in the treatment of LID. Relative      Safety will be evaluated using a common description of Significant Clinical Complications for      patients treated in this study. This study will be performed on the 3T MR scanners.",C0030567;C1517281;C0015730;C4553491;C0195893;C0013384;C0087111;C0220825;C0302614,C0030567;C0518214;C0877248;C4553491;C4553491;C4553491;C0009566;C0031809;C0678257;C0041618;C0013384;C0013384;C0013384;C0013384;C0087111;C0087111;C0087111;C0087111;C0087111;C3172260;C3272565;C0183115;C1457887;C0087136;C0087136;C0564405;C3245511;C0947630;C0947630;C0947630;C0947630;C0947630;C0446516;C0031809;C4082977;C0220825;C1561542;C0220825;C0220825;C0728774;C3272565;C0332155;C4082977,0.0,0.0,0,0.0,0.0,0.019235673357911445,0.016140826446488746,0,0
NCT01785628,The Impact of Pharmacological and Electric Modulation of NMDA Pathway on the Cognitive Flexibility and Volitional Movement Preparation in Patients With Parkinson's Disease,~     The project will investigate the effect of pharmacological and electric modulation of~     N-methyl-D-aspartate (NMDA) pathway on the cognitive flexibility and volitional movement~     preparation in patients with Parkinson's disease (PD).~   ,C0026649;C0012634;C0071888;C0042950,C0012634;C0026649;C0071888;C0042950,4.0,120.0,-1,9.0,9.0,0.013687777073240443,0.016134233456564867,0,0
NCT00866502,A Safety and Tolerability Study of Intracerebroventricular Administration of sNN0031 to Patients With Parkinson's Disease,"~     This study is conducted to evaluate the safety and tolerability of the drug product sNN0031,~     containing Platelet Derived Growth Factor (PDGF), when administered directly into one of the~     fluid filled cavities in the brain using an implanted catheter and an implanted SynchroMed®~     II pump. Patients with a diagnosis of Parkinson's disease will be enrolled.~   ",C0012634;C3845829,C0011900;C0012634;C0018270;C0006104,0.0,0.0,-1,25.0,25.0,0.014810150048885584,0.016097069480146182,0,0
NCT00099268,Efficacy and Safety of Carbidopa/Levodopa/Entacapone in Patients With Parkinson's Disease Requiring Initiation of Levodopa Therapy,The CELC200A2401 study has been designed in order to evaluate the hypothesis that      administering the combination carbidopa/levodopa/entacapone at the time that levodopa therapy      is initiated results in a decrease in the risk of the development of motor complications for      patients with Parkinson's disease.,C0030567;C0353697;C0165921;C0023570;C0087111;C1550655;C0589507,C0030567;C0009566;C0243107;C0165921;C0006982;C0023570;C0023570;C0087111;C0947630;C3539181;C0442797;C1533734;C1522411;C0220825,2993.0,168888.0,0,35.0,35.0,0.020854270446118317,0.015980917036529863,0,0
NCT01338649,Light Therapy Treatment in Parkinson's Disease Patients With Daytime Somnolence,"Study objectives are to determine the efficacy, safety and tolerability of bright light      treatment in Parkinson's Disease (PD) patients with daytime sleepiness. Thirty PD patients      will be enrolled and equally randomized to bright light or dim-red light treatment. Objective      (actigraphy) and subjective (sleep logs/scales) sleep measures will be collected through the      baseline and intervention phases of the study. The primary outcome measure will be the change      in the Epworth Sleepiness Scale (ESS) comparing the bright light treatment with dim-red light      treatment. Secondary outcome measures will include the Multiple Sleep Latency Test (MSLT),      global Pittsburgh Sleep Quality Index (PSQI) score, Parkinson's Disease Sleep Scale (PDSS)      score, and actigraphy measures. A variety of exploratory analyses will examine the effects of      bright light treatment on fatigue, depression, quality of life, cognition, and motor      disability.      Hypothesis: Bright light exposure will diminish daytime sleepiness and improve night-time      sleep in PD patients with daytime sleepiness.",C0030567;C0031765;C2830004;C0087111;C1550655,C3697468;C3541276;C4684765;C0030567;C0030567;C0541854;C0541854;C0541854;C0518214;C4505222;C0184661;C0018017;C1171301;C1171301;C0011570;C0231170;C0087111;C0087111;C0018017;C0087111;C0087111;C0087111;C0009240;C4684790;C0274281;C0015672;C0423899;C0423899;C0175659;C0423899;C0423899;C0947630;C0037313;C0037313;C0947630;C0037313;C0175659;C0037313;C0022885;C0519186;C0000589;C0184511;C1518681;C2945733;C2979880;C0027627;C0275586;C0275586;C0275586;C0275586;C0275586;C3534109;C3534109;C0275586;C0275586;C3242613;C0728774;C4082977,6.0,135.0,0,17.0,17.0,0.02159654693011182,0.015969204322077744,0,0
NCT00633880,Clinical Study of Droxidopa in Patients With Neurogenic Orthostatic Hypotension (NOH),"~     The purpose of this study is to see whether droxidopa is effective in treating symptoms of~     neurogenic orthostatic hypotension in patients with Primary Autonomic Failure (Pure Autonomic~     Failure, Multiple System Atrophy, Parkinson's Disease), Non-diabetic neuropathy, or Beta~     Hydroxylase deficiency.~   ",C0020649;C0000378,C0393571;C0020649;C0442874;C0000378;C1457887;C0012634;C0852654;C0393911,142.0,3666.0,-1,44.0,14.666666666666698,0.011274376952506791,0.01556953292506866,0,0
NCT00782340,A Clinical Study for Patients With Neurogenic Orthostatic Hypotension (NOH) Using Droxidopa,"~     The purpose of this study is to see whether droxidopa is effective in treating symptoms of~     neurogenic orthostatic hypotension in patients with Primary Autonomic Failure (Pure Autonomic~     Failure, Multiple System Atrophy, Parkinson's Disease), Non-diabetic neuropathy, or Beta~     Hydroxylase deficiency.~   ",C0020649;C0000378,C0393571;C0020649;C0442874;C0000378;C1457887;C0012634;C0852654;C0393911,108.0,3825.0,-1,13.0,6.5,0.011274376952506791,0.01556953292506866,0,0
NCT01723904,"A Phase 3b, Open-Label, Safety and Efficacy Study of Rotigotine as Add-On Therapy With Low Doses of Pramipexole or Ropinirole in Patients With Advanced Parkinson's Disease",This study is to investigate the safety and efficacy of Rotigotine add-on therapy with low      doses of Pramipexole or Ropinirole in patients with advanced-stage Parkinson's Disease (PD)      who have insufficient response to L-dopa and low doses dopamine receptor agonists.,C0030567;C0074710;C1700683;C0244821;C0087111;C1522485;C0947630;C4321351;C1550655;C0725066,C0030567;C0074710;C1700683;C0244821;C1704632;C0013030;C0243192;C0087111;C0023570;C0947630;C1300072;C1550472;C1550472;C0700651,95.0,1260.0,0,3.0,3.0,0.022128892261189196,0.015235705797822553,0,0
NCT02583672,Role of Oxidative Stress and Inflammation in Type 1 Gaucher Disease (GD1),~     The purpose of this study is to measure levels of blood and brain chemicals related to~     oxidative stress and inflammation in healthy volunteers and individuals with Type 1 Gaucher~     disease (GD1) to see if these levels are altered by GD1.~   ,C0017205;C0021368;C0038435,C0021368;C0012634;C0038435;C0005767;C0006104;C2946261;C2946261,0.0,0.0,-1,0.0,0.0,0.0074691376854766345,0.014471094745665719,0,0
NCT02111122,Study of the Symptomatic Effects of Nocturnal Sodium Oxybate in Parkinson's Disease,"~     Sleep wake disturbance is a common problem in Parkinson`s disease patients and so far the~     therapeutic possibilities for symptomatic relief are limited. Small, open-label studies~     indicate that the use of Xyrem (gamma-hydroxybutyrate) might be of benefit in this situation.~      This study is intended to show a beneficial effect of the study medication in a randomized~     cross-over trial, that fulfills strict scientific criteria.~   ",C0012634;C0337443,C0033213;C0012634;C0037313;C4284232;C1550543;C0000503;C3834249,0.0,0.0,-1,9.0,9.0,0.014810150048885584,0.013888668744712994,0,0
NCT02324426,CNS Uptake of Intranasal Glutathione,"~     Excessive free radical formation and depletion of the brain's primary antioxidant,~     glutathione, are established components of Parkinson's disease (PD) pathophysiology. While~     there is rationale for the therapeutic use of reduced glutathione (GSH) in PD, and even some~     preliminary evidence to suggest the use of GSH can lead to symptomatic improvement, obstacles~     surrounding currently employed delivery methods have hindered the clinical utility of this~     therapy. Intranasal GSH, (in)GSH, is a novel method of glutathione augmentation. The aim of~     this study is to evaluate whether 200 mg of (in)GSH results in measurable changes in brain~     glutathione concentrations, as measured by magnetic resonance spectroscopy (MRS) in 15~     individuals with PD.~   ",C0243144,C0024487;C0034917;C0557351;C0012634;C0025663;C0006104;C2948600;C0025663;C0006104;C0003402,0.0,0.0,-1,0.0,0.0,0.020283975659228917,0.013293701401128195,0,0
NCT01992692,Remifentanil Requirement in Patients Receiving Surgical Treatment of Parkinson's Disease,"Parkinson's disease (PD) is one the main neurodegenerative disease with an incidence of about      3% in patients older than 65 years. Anesthesia in PD patients has been focused by several      studies for concerning the interactive reaction between anesthetics and anti-Parkinsonian      medication or Parkinsonian symptoms. However, our previous experience showed that the      patients undergoing pulse generator placement were more prone to be involved in delayed      emergence in the recovery room, which had been not reported yet. We speculated that PD      patients might be a special population with abnormal pharmacodynamic characters of      anesthetics, though no related evidence could be found to support this hypothesis. Therefore,      in this project we investigated whether remifentanl requirement to inhibit patients' response      to trachea intubation and skin insertion in PD patients undergoing DBS and pulse generator      placement was different from non-PD patients undergoing intracranial surgery for reasons      other than PD.",C0030567;C0246631;C4284141;C0087111;C0543467;C1550655,C0524851;C0242422;C0745377;C0030567;C0021932;C1140627;C1140627;C0002932;C0002932;C0002903;C0013227;C0237607;C0007952;C0441587;C0441587;C0441587;C0700287;C0205161;C1704632;C0947630;C4699618;C0222224;C2004454;C4284141;C0233492;C1546399;C0000828;C1555709;C0246631;C0701928,0.0,0.0,0,0.0,0.0,0.02099897535954672,0.01317837790153839,0,0
