nct_id,brief_title,description,brief_title_concepts_list,brief_summary_concepts_list,tot_subj_affected,tot_subj_risk,relevance,citationSum,citationAvg,briefTitlePageRankScore,briefTitleAndSummaryCombinedPageRankScore,brief_title_matched_count,brief_summary_matched_count
NCT00136851,Study Comparing the Efficacy of Amlodipine Besylate/Benazepril Versus Amlodipine in the Treatment of Severe Hypertension,This trial is designed to study the efficacy of an amlodipine besylate/benazepril treatment      regimen versus an amlodipine treatment regimen in the treatment of severe hypertension.,C0354468;C0020538;C0053091;C0051696;C0087111;C0205082;C0947630,C0354468;C0020538;C0053091;C0051696;C0087111;C0087111;C0087111;C0040808;C0040808;C0205082;C0947630;C0018792,0.0,0.0,0,1.0,1.0,0.0025091188637730967,0.0027516504233046626,0,0
NCT00425997,Efficacy of Valsartan/Hydrochlorothiazide Versus Amlodipine and Hydrochlorothiazide in Patients Hypertension,This study will evaluate the efficacy of valsartan/hydrochlorothiazide versus amlodipine and      hydrochlorothiazide in patients with Stage 2 hypertension using 24-hr ambulatory blood      pressure monitoring (ABPM),C0020261;C0020261;C0020538;C0051696;C0216784;C1550655,C0020261;C0020261;C0020538;C0051696;C1561560;C0150369;C0216784;C0460139;C0441767;C0947630;C0005767;C0220825,0.0,0.0,1,3.0,3.0,0.0027660982697025487,0.002751443646919261,0,0
NCT02451150,A Phase 3 Pharmacokinetic Study of TAK-536 (Azilsartan) in Pediatric Patients 6 to Less Than 16 Years With Hypertension,The purpose of this study is to evaluate the pharmacokinetics and safety of a single dose of      TAK-536 (azilsartan) in pediatric patients aged 6 to less than 16 years with hypertension.,C0020538;C1958569;C0947630;C0031327;C0587599;C1550655,C0031327;C0020538;C1958569;C0087136;C0947630;C0220825;C0220644,2.0,18.0,0,0.0,0.0,0.002654544203720698,0.0027490136403210672,0,0
NCT00201045,Team Management of High Blood Pressure,The purpose of this study is to test whether blood pressure control can be improved by      physician education and feedback provided through the development of physician/pharmacist      collaborative teams.,C0020538;C0376636,C0005823;C0243107;C0424927;C0184511;C0947630;C0392366;C0804815;C0804815;C2911691;C1555587,0.0,0.0,1,82.0,41.0,0.0036540422290310274,0.0027454711890202693,0,0
NCT00540436,"Evaluate the Efficacy, Safety and Pharmacokinetics of GSK1325760A in the Treatment of Pulmonary Arterial Hypertension",The primary objective of this study is to evaluate the effect of GSK1325760A on improvement      in exercise capacity in subjects with pulmonary arterial hypertension (PAH).      The secondary objectives of this study are to evaluate administration of GSK1325760A on:        -  The safety and tolerability        -  Improvement of PAH        -  The steady-state plasma pharmacokinetics of GSK1325760A,C0031327;C0020538;C0087111;C2707265;C0220825;C0003842,C4684765;C0020538;C0031327;C1533734;C0018017;C0018017;C0024109;C0027627;C1518681;C0032105;C0947630;C0947630;C0452240;C3844714;C0220825;C0220825,102.0,700.0,0,1.0,1.0,0.0026565373070542323,0.0027405729203209264,0,0
NCT03111836,Effectiveness of User and Expert Driven Internet-based Lifestyle Interventions on Hypertension Control,"Hypertension is a leading risk factor for cardiovascular disease and mortality. Lifestyle      counseling is recommended as a first line therapy for reducing blood pressure (BP) and risk      for cardiovascular events. Recent studies suggest that e-based lifestyle interventions are      effective in evoking therapeutic change in BP1. However, BP response and adherence to      exercise and diet behavior varies significantly after e-based interventions due to variations      in treatment methodologies. Consensus is not yet established for a standardized e-counseling      protocol for hypertension. As noted in our systematic review, the two dominant models of      e-counseling procedures are expert-driven (protocol driven, prescriptive) and user-driven      (self-guided, collaborative). Expert-driven programs prescribe specific changes for lifestyle      behavior which are intended to facilitate compliance to behavioral change. In contrast, the      user-driven method actively involves the subject in goal-setting and/or the selection of the      intervention used to reach the behavioral goal. One conclusion from the systematic review is      that these models are used indiscriminately in e-counseling programs. There is currently      inadequate data to determine the efficacy of programs that are expert-driven vs. user-driven      in reducing BP while modifying lifestyle behaviour. It is possible that a combination of      expert-driven and user-driven features for lifestyle e-counseling is most effective. However,      before these two approaches can be combined, it is essential to establish the strengths and      limitations of each model.",C4553491;C1273869;C0020538;C0013126;C1564718,C0007222;C1320716;C1955832;C1955832;C0005823;C0886296;C0886296;C0020538;C0020538;C0184661;C0035648;C0010210;C0010210;C0010210;C0010210;C0010210;C0087111;C1704632;C0442711;C0442711;C1552740;C1551357;C0332149;C0087111;C0947630;C0542559;C0025663;C3161035;C1551994;C0018017;C1273517;C0018017;C1273517;C3245479;C0087111;C3539181;C0184661;C0278329;C0677505;C0452240;C0677505;C0677505;C0233514;C0029939;C3714738;C2986890;C0301572;C0449900;C3161035;C0013126;C0013126;C0013126;C0013126;C0013126;C3161035;C0013126;C0013126;C0013126;C0013126;C1328018;C0678257;C0042070;C0042070;C0042070;C4698129;C4082977,0.0,0.0,1,1.0,1.0,0.0021176151189181355,0.0027383371477111363,0,0
NCT01850901,Renal Sympathetic Denervation as a New Treatment for Therapy Resistant Hypertension,"The aim of this study is to assess whether renal denervation (RD) added to usual care      compared to usual care alone reduces blood pressure (BP) as determined with ambulatory BP      monitoring (ABPM) after 6 months in subjects with an average day-time systolic BP of at least      135 mmHg as determined with use of ABPM, despite use of three or more BP lowering agents or      with documented intolerance or contraindication for to 2 or more of the 4 major classes of      antihypertensive drugs (ACEi/ARB, calcium channel blockers, betablockers and diuretics)      obstructing use of 3 antihypertensives      Further aims are to assess the effect of renal denervation on the use of BP lowering agents,      to explore the effect of renal denervation in strata of estimated glomerular filtration rate      (eGFR) (eGFR 20-60 mL/min per 1.73m2 and eGFR>60 mL/min per 1.73m2) and according to baseline      office BP.      Randomization will be stratified by hospital and eGFR and will be at a 2:1 ratio.",C0039038;C0020538;C0087111;C1514892;C0087111;C0022646,C0017654;C0006684;C0003364;C0003364;C1301624;C0005823;C0011307;C0231199;C0011307;C0011307;C1561560;C0150369;C1301725;C0012798;C0456387;C1518681;C1518681;C0947630;C0022646;C0439044;C0022646;C0022646;C3811844;C3811844;C3811844;C1561538;C1820370;C1820370;C0180799;C4082977;C4082977;C1561542;C0776963;C1995642;C0728774,0.0,0.0,1,10.0,5.0,0.002492752432765472,0.0027344501857841466,0,0
NCT00614380,Open Label Study Telmisartan and Amlodipine in Hypertension,The primary objective of this trial is to assess the efficacy and safety of the fixed dose      combinations telmisartan 40 mg / amlodipine 5 mg (T40/A5) or telmisartan 80 mg / amlodipine 5      mg (T80/A5) during long-term open-label treatment.,C0020538;C0248719;C0051696;C1522485;C0947630,C3539181;C0248719;C0248719;C0051696;C0051696;C0018017;C0087111;C1705425;C0018792,265.0,48055.0,0,2.0,2.0,0.0024555749598892643,0.0027219340859542768,0,0
NCT01106014,Selexipag (ACT-293987) in Pulmonary Arterial Hypertension,The AC-065A302 (GRIPHON) study is an event-driven Phase 3 study to demonstrate the effect of      selexipag on time to first morbidity or mortality event in patients with pulmonary arterial      hypertension.,C0020538;C2000145;C2707265;C0003842,C0020538;C2000145;C0220880;C0024109;C1518681;C0947630;C0947630;C0013126;C0003842,6503.0,438912.0,0,89.0,17.8,0.0027242037892204448,0.002721107999886238,0,0
NCT01031680,"Efficacy and Safety in Patients With Type 2 Diabetes Mellitus, Cardiovascular Disease and Hypertension","This study is carried out to assess whether dapagliflozin lowers blood glucose, body weight      and blood pressure, when added to patients existing medications and how it compares with      their usual treatment without added dapagliflozin. Safety data will be collected and analysed      to confirm that treatment with dapagliflozin is safe and well tolerated in patients who have      diabetes, cardiovascular disease and hypertension.",C0011860;C0007222;C0020538;C1550655,C0007222;C0005823;C2353951;C0392201;C2353951;C2353951;C0020538;C1305866;C0013227;C0087111;C0087111;C0011849;C0699809;C0750484;C0947630;C3245479;C3540799;C0776963;C0776963,465.0,49788.0,0,19.0,19.0,0.0027504911497482024,0.0027179421301438624,0,0
NCT01686282,Blueberry Consumption Improves Vascular Function and Lowers Blood Pressure in Postmenopausal Women With Pre- and Stage 1-hypertension,"Cardiovascular disease (CVD) continues to be the leading cause of death in the U.S. Americans      have been more concerned about their blood cholesterol levels and dietary cholesterol intakes      rather than their overall cardiovascular health risk factors leading to CVD such as      hypertension, vascular dysfunction, inadequate consumption of fruits and vegetables and      physical activity. Statistics show that approximately 91% of individuals with CVD have      vascular dysfunction which is attributed to endothelial and autonomic dysfunction leading to      increased arterial stiffness.      The investigators long-term goal is to provide feasible and effective dietary ways for pre-      and stage 1- hypertensive individuals to normalize their blood pressure (BP), improve      vascular function and thereby reducing their cardiovascular risk and enhancing the quality of      life. Blueberries are a rich source of phenolic compounds and these compounds may play an      important role in promoting cardiovascular health. Considering the strong possibility that      phytochemicals present in blueberry work additively or synergistically, it would be ideal to      investigate the cardioprotective effects of blueberry as a whole. The investigators overall      objective to bring forth evidence that blueberry consumption will reduce BP and      cardiovascular risk factors including endothelial dysfunction, arterial stiffness, and      autonomic dysfunction in pre- and stage 1-hypertensive postmenopausal women. The      investigators hypothesize that blueberry supplementation will improve vascular function and      will lower blood pressure in postmenopausal women with pre-hypertension. The findings of this      study will provide a foundation for disseminating feasible, safe approaches for preventing      and combating hypertension at its early stage which does not require drug therapy.",C0005823;C0232970;C1947907;C2740600;C0184511;C1705273;C1300072;C0020538;C1548802;C0005847,C0856169;C0007222;C1145628;C1145628;C0020649;C0201950;C0599949;C0599949;C0242297;C0007465;C3887460;C0005823;C3887460;C3887460;C3887460;C0232970;C0232970;C0035648;C0020538;C0857121;C0035648;C0020538;C0020538;C0013216;C0277785;C0277785;C0600673;C0018017;C0005847;C0005847;C0005847;C0031843;C0359916;C0005847;C0031843;C0150312;C0449416;C0005767;C1300072;C1300072;C0947630;C1300072;C0018017;C0600138;C1704326;C4263585;C0857121;C0037088;C1555587;C0184511;C0184511;C1555587;C3245501;C1947907;C1947907;C1518681;C0010124;C0010124;C0178520;C4084912;C2740600;C2740600;C2740600;C2740600;C0007209;C0151576,0.0,0.0,0,23.0,23.0,0.002633152782823004,0.0027079976149955096,0,0
NCT01541540,e-Counseling Promotes Blood Pressure Reduction and Therapeutic Lifestyle Change in Hypertension,"This proposed clinical trial, REACH, will enroll 538 persons with hypertension. All subjects      will continue with their prescribed medications. Our main objective is to assess whether      preventive e-counseling (provided through a website of the Heart and Stroke Foundation)      improves blood pressure and cardiovascular risk status over a 12-month interval. REACH will      also evaluate improvement in lifestyle behaviors that include diet, exercise, smoking, and      adherence to prescribed medications. Finally, we will quantify the amount of e-counseling      support that is required during REACH to evoke a significant reduction in blood pressure. It      is hypothesized that e-Counseling (vs. Control) will significantly improve blood pressure and      lifestyle behaviours at the 12-month assessment. The findings of this trial will provide      information that is critical to our understanding of how internet-based programs can help to      improve blood pressure and to reduce the risk for cardiovascular disease.",C0005823;C0020538;C0087111;C0010210;C1293152;C4319952,C0007222;C1096775;C0005823;C3887460;C0005823;C0005823;C0005823;C0162340;C0020538;C0013227;C0013227;C0278329;C0010210;C0278329;C0010210;C0010210;C0677505;C0031809;C0018017;C0677505;C4551656;C3245501;C2349146;C0038454;C0018787;C1552861;C0452240;C0037088;C0184511;C1555587;C0184511;C3242430;C3844714;C0449878;C0018792;C1555587;C0184511;C1552654;C0220825;C1547298;C0042070;C1564718;C4698129,0.0,0.0,0,8.0,2.6666666666666696,0.002738869040568651,0.0027043766776646172,0,0
NCT01103960,"An Eight-week Randomized,Double-blind Study to Evaluate the Efficacy and Safety of Fixed-dose Combinations of T80+A5 Versus A5 Monotherapy in Patients With Hypertension Who Fail to Respond Adequately to Treatment With A5 Monotherapy",The primary objectives of this trial is to demonstrate that the fixed-dose combination of      telmisartan 80mg plus amlodipine 5mg (T80/A5) is superior to amlodipine 5mg (A5) in reducing      seated trough diastolic blood pressure (DBP) at 8 weeks.,C0020538;C0087111;C0220825;C0456909;C0947630;C2827483;C1561540;C3811910;C1550655;C3897779,C0428883;C0248719;C0018017;C0051696;C0051696;C1305849;C3539181;C0018792,0.0,648.0,0,3.0,3.0,0.0029244021799345963,0.002679546808272768,0,0
NCT01392495,"Extension to CQTI571A2102 to Evaluate Long-term Safety, Tolerability and Efficacy of Imatinib in Severe Pulmonary Arterial Hypertension (PAH)","This study was an extension to study CQTI571A2102 and was to evaluate the long-term safety,      tolerability and efficacy of QTI571 (imatinib) in severe pulmonary arterial hypertension      patients.",C0020538;C2707265;C0220825;C0935989;C0003842;C0205082;C0233494,C0020538;C0024109;C0935989;C0205082;C0947630;C0947630;C1525442;C0220825,157.0,1547.0,0,104.0,52.0,0.0025483002714300398,0.002678614440413574,0,0
NCT00616265,Effect of Continuous Positive Airway Pressure (CPAP) Treatment in the Control of Refractory Hypertension,"The working hypothesis for the present study is that treatment with CPAP in patients with an      sleep apnea (IAH>15) and AHT-r is capable of producing significant reductions in      blood-pressure levels.      This hypothesis is supported by four proven findings:        1. -sleep apnea is an independent risk factor for arterial hypertension (1).        2. -The greater the number of RSD, the greater the loss of control over blood-pressure           levels (1).        3. -The prevalence of sleep apnea in patients with AHT refractory to treatment is very high           (11,12).        4. -Treatment of patients with sleep apnea and AHT-r with CPAP succeeds in significantly           reducing blood-pressure levels in the only (small-scale) studies undertaken to date           (14,15).      4. OBJECTIVES      Main objective:      To evaluate the effect of treatment with CPAP on blood-pressure levels in patients with AHT      refractory to medical treatment.      Secondary objectives:        -  To evaluate the effect of treatment with CPAP on the various elements assessed in BP           (systolic/diastolic; daytime/nighttime, etc) and the circadian profile           (dipper/non-dipper/raiser patterns; variability and homogeneity of blood-pressure           levels, etc) obtained during a 24-hour out-patient study (AMPA).        -  To analyze the related variables or subgroups of patients most affected by treatment           with CPAP.        -  To evaluate the effect of CPAP on the levels of some of the biological variables           involved in the pathogenesis of AHT-r (renin, angiotensin, aldosterone, atrial           natriuretic factor, etc).",C0199451;C0020538;C0087111;C1564718,C0020538;C0699748;C0037315;C1290940;C0035648;C0037315;C0037315;C0003018;C0002006;C0597421;C4551656;C0018017;C0018017;C0087111;C0087111;C0442804;C0018017;C0087111;C0087111;C0087111;C0087111;C0460139;C0460139;C0460139;C0460139;C0460139;C0150312;C0947630;C3540008;C0700164;C1518681;C1518681;C0655359;C1518681;C0018792;C0947630;C0005767;C0003578;C0005767;C0005767;C0175659;C0005767;C0005767;C0947630;C0051318;C0087111;C0037088;C0233492;C0234451;C1548762;C0027627;C0012000;C0220825;C0220825;C1995642;C0220825;C1550518;C0332535,0.0,0.0,0,98.0,49.0,0.002597792242655505,0.002676648543004559,0,0
NCT00327587,"8-week Study to Evaluate Safety and Efficacy of Various Combinations of Valsartan, HCTZ, and Amlodipine in Patients With Moderate to Severe Hypertension","The purpose of this study is to determine the safety and efficacy of the various combinations      of valsartan, HCTZ, and amlodipine in patients with moderate to severe hypertension.",C0020538;C0051696;C0216784;C0220825;C1547226;C0205082;C0947630;C0020261;C3811910;C1550655,C3540029;C0020538;C0051696;C0216784;C0205082;C0947630;C0020261;C1547226;C4082977,0.0,0.0,0,14.0,7.0,0.003037902236758818,0.0026736109238190424,0,0
NCT01299376,MK-0954E Phase III Long-Term Study in Participants With Hypertension (MK-0954E-356),"This study has two parts. In the first part, the efficacy and safety MK-0954E (losartan      potassium 50 mg [L50] (+) hydrochlorothiazide 12.5 mg [H12.5] (+) amlodipine besylate 5mg      [A5]) will be evaluated and compared to the efficacy and safety of MK-0954H (L50/H12.5) in      Japanese participants. In the second part, the safety and tolerability of long-term use of      open-label MK-0954E in participants with hypertension will be evaluated. The primary      hypothesis is that MK-0954E is more effective in lowering mean trough sitting diastolic blood      pressure (SiDBP) after 8 weeks of treatment compared to MK-954H (L50/H12.5 mg) in Japanese      participants with essential hypertension who are not adequately controlled following a 8-week      treatment with filter period study drug of MK-954H.",C0020538;C0947630;C0233324,C4684765;C0085580;C0020261;C0020538;C0032821;C0087111;C0087111;C0126174;C0460139;C0277814;C0025344;C0947630;C1705425;C0005767;C0947630;C0013227;C1820370;C0354468;C2911690;C0220825;C0220825;C0012000,257.0,7742.0,1,0.0,0.0,0.003113343523010436,0.0026705028309393897,0,0
NCT01808313,Efficacy Study of Ambrisentan in Chinese Patients With Pulmonary Arterial Hypertension (PAH),"This open label, single-arm, non-controlled, multicentre study will determine the effect of      ambrisentan on exercise capacity (6MWT) in Chinese subjects with PAH. The study consists of a      screening period of 4 weeks, a 12-week primary evaluation period (PEP) and a 12-week      dose-adjustment period (DAP). Ambrisentan 5 mg will be administered to eligible subjects for      12 weeks (PEP).",C0020538;C1176329;C2707265;C0003842;C0947630;C1550655,C1176329;C1176329;C0220825;C0199230;C0087136;C1518681;C0025344;C0025344;C0025344;C1705425;C0947630;C0947630;C0446516;C2945673;C0452240;C2911690;C4082977,187.0,3752.0,0,0.0,0.0,0.003069910350288333,0.0026655807864896827,0,0
NCT02398032,CPAP in SAHS Patients With Hypertension,"Study objective: To assess the nocturnal changes in mechanosensitivity and chemosensitivity      in hypertensive sleep apnea-hypopnea syndrome (SAHS) patients and in SAHS patients with      isolated nocturnal hypertension. To value the continuous positive airway pressure (CPAP)      effect on these parameters.      Design: Controlled cross-over longitudinal study. Settings: Madrid metropolitan area.      Patients: Day-night sustained hypertensive and isolated nocturnal hypertensive patients with      SAHS without previous treatment. At least 30 patients are needed.      Interventions: Patients will allocate in each treatment arm (CPAP vs. sham CPAP) during three      months. Explorations will perform before and immediately after sleep at 0-, 3-, and 6-months      of trial.      Measurements: 24-h urinary catecholamine, local vascular factors, angiotensin and aldosterone      levels. Diaphragmatic tension-time index, metabolic rate, hypoxic withdrawal test, and      ventilatory and inspiratory neural drive responses to progressive isocapnic hypoxia.",C0020538;C1550655,C0199451;C2347610;C0870882;C1273869;C0007412;C0857121;C0020538;C0857121;C0857121;C0037315;C0003018;C0002006;C0004048;C2911690;C0018017;C0087111;C0087111;C0235546;C0039082;C0005847;C0233494;C0242184;C0242184;C1518681;C0947630;C0947630;C0037313;C0918012;C0013126;C0392366;C0446516;C0087153;C1704632;C4281677;C1550655;C1550655;C1697779;C2825032;C3843236;C3839460;C1561542;C0018792;C0011980;C1280903,0.0,0.0,0,0.0,0.0,0.004514882579435287,0.0026627483596121234,0,0
NCT01459900,"Renal Sympathectomy in Treatment Resistant Essential Hypertension, a Sham Controlled Randomized Trial","~     The purpose of this double blind, randomized and sham controlled study is to determine~     whether renal denervation in terms of catheter based ablation in the renal arteries is~     effective in lowering blood pressure in patients with treatment resistant hypertension. The~     blood pressure lowering effect will be evaluated by 24 hours ambulatory blood pressure~     measurement at baseline and after 1, 3 and 6 months of follow up. Secondary end point~     evaluation concerns hemodynamic measures using echocardiography, applanation tonometry and~     forearm plethysmography.~   ",C0085580;C0180112;C0376495,C0013516;C0005823;C0005823;C0020538;C0011307;C0220825;C0547070;C0003842;C0016536;C0005767;C0180112;C0376495,0.0,0.0,-1,3.0,3.0,0.0018616442942768906,0.0026576360815273896,0,0
NCT01850160,Efficacy/Safety Study of Valsartan and Chlorthalidone Conjugate Treatment Compared to Simple Treatment for Hypertension,"This trial is aimed to assess the efficacy and safety of a fixed-dose combination therapy      with Valsartan and Chlorthalidone, Vs Valsartan or Chlorthalidone alone for treatment of      adult patients with diagnosis of arterial hypertension.",C0008294;C0020538;C0216784;C0087111;C0087111;C0947630;C2338991,C0020538;C0009429;C0008294;C0008294;C0216784;C0216784;C0087111;C0011900;C0439044;C0018792,0.0,0.0,0,0.0,0.0,0.002614730888524729,0.002657584455402622,0,0
NCT00323297,Assess the Efficacy and Safety of Sildenafil When Added to Bosentan in the Treatment of Pulmonary Arterial Hypertension,To assess the efficacy and safety of sildenafil when added to patients with PAH who are      taking bosentan as all or part of their background therapy.,C0020538;C0529793;C0087111;C2707265;C0252643;C0003842,C0529793;C0252643;C0087111;C0776963,382.0,8858.0,0,3.0,3.0,0.0025736472167186644,0.002656336165824026,0,0
NCT01180673,Counseling Older Adults to Control Hypertension,This study will evaluate the effect of a senior center-based comprehensive therapeutic      lifestyle intervention delivered through group-based counseling and motivational interviewing      (MINT-TLC) among 250 hypertensive African American or Latino seniors age 60 and older in a      randomized control trial.,C0020538;C0010210;C1564718,C0683474;C0184661;C0857121;C0010210;C1518681;C0947630;C0008569;C0087111;C0282440;C1552839;C1555709;C0308779;C0220825,0.0,0.0,1,4.0,4.0,0.002686279494966002,0.002655129321391548,0,0
NCT00265538,Implementing Evidence Based Treatment of Hypertension,"This study examines the use of patient initiated discussions of blood pressure medication in      the primary care setting. Additionally, this study examines different levels of patient      incentive(s) to initiate discussions with providers including information only, information      plus 20$ incentive and reimbursement for 6 months of copay, and information/monetary      incentive plus a reminder call prior to the index visit. Patient opinions about      doctor/patient relationships will be assessed. Provider attitudes and prescribing behaviors      will be analyzed as well.",C0020538;C0087111,C0005823;C0033137;C0557061;C0557061;C0278329;C0013227;C0004271;C0677505;C0542559;C1550655;C0947630;C0947630;C0918012;C1512346;C1555587;C3242430;C3242430;C3242430;C1561542;C4331837;C0000589;C0000589;C0557033;C1555587,0.0,0.0,0,20.0,4.0,0.003993989124064772,0.0026544957757981395,0,0
NCT00523549,The Effects of Systolic Blood Pressure Lowering on Diastolic Function Using Valsartan + Amlodipine in Patients With Hypertension and Diastolic Dysfunction,The purpose of this study is to determine the effects of treatment with valsartan +      amlodipine to a target systolic blood pressure (SBP)<130 mmHg compared to the Joint National      Commission on the Treatment of Hypertension 7 recommended target SBP of <140 mmHg on the      intrinsic diastolic properties of the myocardium in patients with hypertension and      echocardiographic evidence of diastolic dysfunction.,C0871470;C0520863;C0020538;C0051696;C0012000;C0216784;C1705273;C1550655,C0871470;C0520863;C0020538;C0020538;C0051696;C0087111;C0216784;C0087111;C0947630;C1306620;C0183129;C1518681;C0012000;C4082977,233.0,4332.0,1,19.0,19.0,0.0024947194080775824,0.002650486010236863,0,0
