nct_id,brief_title,description,brief_title_concepts_list,brief_summary_concepts_list,tot_subj_affected,tot_subj_risk,relevance,citationSum,citationAvg,briefTitlePageRankScore,briefTitleAndSummaryCombinedPageRankScore,brief_title_matched_count,brief_summary_matched_count
NCT01692301,Study of the Safety and Efficacy of LCZ696 on Arterial Stiffness in Elderly Patients With Hypertension,The study examined the efficacy of LCZ696 in comparison to the ARB olmesartan on Central      Aortic Systolic Blood Pressure (CASP) and other measures of central hemodynamics and arterial      stiffness in elderly patients with an elevated systolic blood pressure (SBP) and widened      pulse pressure (PP).,C0599949;C0020538;C0947630;C1550655,C0871470;C0871470;C0949236;C4281788;C1098320;C0427008;C0332128;C0003483;C0947630;C1306620;C0856882;C0003842;C1879652,375.0,24516.0,1,9.0,9.0,0.003087389253540419,0.0021016692306246136,0,0
NCT01550640,Pharmacogenetics of Remifentanil in Patients With Hypertension Undergoing Cesarean Delivery Under General Anesthesia,Caesarean delivery under general anaesthesia (GA) carries nowadays still 25% risk of      insufficient depth of anaesthesia in a time before the fetus delivery. The reason is the lack      of opioid administration. Opioids easily cross placental barrier and negatively influence      newborn postpartum adaptation by respiratory depression. Introduction to GA is thus      accompanied by exaggerated autonomic stress reaction with hypertension and tachycardia. The      use of ultra-short acting opioid remifentanil should suppress stress response in mother      without increasing the risk for newborn. There are only a few clinical data available. This      study will be the first one systematically studying the influence of remifentanil in pregnant      women with hypertension on hemodynamic stability and newborns safety. This study will also      identify potential pharmacogenetic factors of individual variability in remifentanil response      with respect of drug efficacy and safety in mother and newborn.,C0002915;C0007876;C0246631;C0020538;C1550655,C0235063;C0002915;C0149784;C0149784;C1533734;C1516606;C0020538;C0246631;C0246631;C0020538;C0246631;C0002903;C0039231;C4281788;C0000934;C0011209;C0011209;C0549206;C1704632;C0699809;C0242402;C1706912;C1551035;C1551035;C1551035;C0242402;C0332219;C0242402;C0728475;C0947630;C0947630;C0013227;C1551035;C1444783;C0205160;C0084688;C3858576;C1328018;C0221106;C2347500;C0332535,0.0,0.0,0,0.0,0.0,0.002657077896267197,0.0020898350753396485,0,0
NCT01371669,Screening for Sleep Hypoxemia in Pulmonary Arterial Hypertension,"In the investigators study, and regarding results of small cohorts in the literature, the      investigators hypothesize that hypoxemia is frequent in IPAH and CPEPH. The investigators      will explore these patients with a one night polysomnography and transcutaneous capnography,      searching for hypoxemia and hypercapnia and by determining its physiopathologic mechanisms.",C0020538;C0220908;C0700292;C2707265;C0003842;C0037313,C0162701;C0376529;C0020440;C0023866;C0700292;C0700292;C0947630;C0180799,0.0,0.0,0,10.0,10.0,0.002335089438621354,0.002072084397727446,0,0
NCT01784458,Clinical Significance of Intra-abdominal Hypertension in Surgical Patients With Severe Sepsis,"-  Intra-abdominal pressure(IAP) is defined as a steady state pressure of the abdominal           cavity        -  many studies have proved IAP as a prognostic factor that elevated IAP influences           hemodynamics and multiple organs dysfunction        -  In previous studies, most of them was based on the septic patients of medical diseases.           And it is rare about sepsis of surgical diseases such as traumatized or postoperative           patients        -  We hypothesized that intra-abdominal hypertension may affect clinical course such as           length of stay of intensive care unit, weaning of mechanical ventilation, proceeding of           enteral feeding and mortality        -  Our study was aimed to investigate prevalence of IAH and risk factors and to analyze           clinical course and prognosis influenced by IAH in surgical patients with severe sepsis",C2826293;C1719672;C0020538;C0000726;C0543467;C1550655,C0199470;C1514474;C0086225;C0085559;C4281788;C0020538;C0035648;C0277785;C0000726;C0000726;C0000726;C0033325;C0460139;C0012634;C0012634;C0947630;C0947630;C0043084;C0011334;C0178784;C0036690;C0001721;C0205082;C0036690;C0947630;C4554468;C4554468;C4684637;C0856882;C0543467;C0543467,0.0,0.0,0,1.0,1.0,0.002339354917734984,0.0020623058185980296,0,0
NCT00288158,Primary Prevention of Hypertension in Obese Adolescents,"The purpose of this study is to examine the consequences of lowering serum uric acid in      pre-hypertensive, obese adolescents pathways involved with how uric acid mediated      hypertension and renal disease. The specific aims are:        1. Test the hypothesis that lowering uric acid will improve endothelial function.        2. Test the hypothesis that lowering uric acid will reduce plasma renin activity and serum           angiotensin II levels.        3. Test the hypothesis that lowering uric acid will reduce markers of inflammation",C0033144;C0020538;C0028754,C0455272;C0003009;C0022658;C0857121;C0020538;C0021368;C1552740;C0031843;C0032105;C0947630;C0028754;C0229671;C0022885;C0022885;C0022885;C1820370;C1820370;C1820370;C1820370;C0000589;C0184511;C0005516;C0127400;C4049938,0.0,0.0,0,62.0,31.0,0.002633595489269152,0.00205938782055815,0,0
NCT01244152,Self-Management in African Americans With Diabetes and Hypertension,"The primary aim of the study is to design a group-based, culturally appropriate      self-management skills training intervention for disadvantaged African-Americans with both      diabetes and hypertension and to compile an intervention Manual of Operations (MOO). The      investigators are developing an intervention to assist individuals in reducing weight and      hemoglobin A1c.",C0086969;C0020538;C0011847,C0086969;C0184661;C0020538;C0184661;C0184661;C0011849;C0024763;C0557034;C1305866;C0947630;C0543467;C0442694;C0202054;C1552839,0.0,0.0,0,9.0,9.0,0.0029015593153391053,0.002050194995717135,0,0
NCT02351973,Comparison of Single and Combination Diuretics in Low-Renin Hypertension,The purpose of this study is to determine whether the routine combination of optimal thiazide      and K+-sparing diuretic will both increase efficacy of BP reduction and reduce risk of      glucose intolerance; and whether K+-sparing diuretics alone may have a neutral or even      beneficial effect upon glucose tolerance.,C0020538;C3811910;C0012798;C1549113;C0373719;C4321351;C0882214,C0271650;C0178665;C4551656;C0012798;C0541746;C0012798;C1518681;C0947630;C0439044;C3539181;C4082977,0.0,0.0,0,1.0,1.0,0.0019946897714518577,0.0020458177239630173,0,0
NCT02392767,Effect of L-Arginine and Pycnogenol on Light to Moderate Hypertension and Endothelial Function,"The effect of a combination product (Verum ) with L-arginine, Pycnogenol, vitamin K2,      R-(+)-alpha-lipoic acid and vitamins B6, B12 and folic acid is investigated in a double blind      placebo-controlled cross-over study. Volunteers with hypertension and hyperhomocysteinemia      are randomly assigned to the dietary supplement or placebo.",C0020538;C0003765;C0072642;C1547226;C1705273;C3842678,C0598608;C0020538;C0023791;C0003765;C0072642;C0016410;C0042890;C1552601;C0042890;C0032042;C0032042;C1518681;C0456909;C0947630;C3539181;C2911690;C1947943,42.0,800.0,0,4.0,4.0,0.0019696950077820923,0.0020458136477945997,0,0
NCT03764020,Trial of Oral Melatonin in Elevated Blood Pressure,"~     Since, lowering blood pressure (BP) in elevated blood pressure individuals represents an~     excellent opportunity to for primary prevention of hypertension (HTN). Therefore, it is~     planned to use a safe treatment option - oral melatonin supplementation - associated with~     lifestyle interventions according to the American college of cardiology/American heart~     association (ACC/AHA) 2013 guideline in elevated blood pressure individuals to mitigate~     systolic and diastolic BP and ultimately, to prevent the development of HTN.~      Hypothesis:~      Melatonin therapy can lower the systolic and diastolic BP of elevated blood pressure~     individuals Melatonin can attenuate levels of circulatory biomarkers of Hs- CRP, Cholesterol,~     LDL-c and triglyceride~   ",C0005823;C0025219,C0005823;C0005823;C0005823;C0020538;C0025219;C0025219;C0025219;C0005767;C0683525;C0004083;C0162791;C0018787;C2946261;C0242296;C0723644;C0205714,0.0,0.0,-1,0.0,0.0,0.0010173445506000056,0.0020433513270300394,0,0
NCT00923091,"Parallel-Group Comparison of Olmesartan (OLM), Amlodipine (AML) and Hydrochlorothiazid (HCTZ) in Hypertension",This study is to determine the change in blood pressure from the administration of      Olmesartan/Amlodipine/Hydrochlorothiazide triple combinations compared to dual combinations      with Olmesartan/Amlodipine.,C0020538;C1098320;C0051696;C4554418;C1561557;C0020261;C0023467;C0020261;C0882214,C1268766;C0020261;C1533734;C3539181;C3539181;C1098320;C0051696;C1098320;C0051696;C0947630;C4082977,712.0,216558.0,0,13.0,4.33333333333333,0.0021422426332319464,0.0020391924856156783,0,0
NCT02145611,Vildagliptin vs. Glibenclamide in Endothelial Function in Type 2 Diabetes and Hypertension,"Cardiovascular disease is a major public health problem in our country. Among the causes of      cardiovascular diseases are High Blood Pressure (HBP) and Diabetes Mellitus (DM). Type 2      diabetes (DM2) is associated with a twofold risk of cardiovascular disease, and endothelial      dysfunction is an early marker of vascular complications. There is evidence of action of      glucagon-like peptide 1 (GLP-1) on endothelial cells and vascular smooth muscle. Vildagliptin      is a drug used in the treatment of DM2 able to prolong the activity of GLP-1, improving      glycemic control and endothelial function.      Objectives: To evaluate the effect of vildagliptin on endothelial function in patients with      DM2 and hypertension using the Endo-PAT 2000 device.",C0011860;C0017628;C1570906;C0020538;C1705273,C0007222;C0007222;C0007222;C0020538;C0011849;C0699943;C0009566;C1570906;C1570906;C0020538;C0277785;C0087111;C0011849;C0005847;C0017687;C0005847;C0031843;C0031843;C0033213;C1550710;C0030956;C4085652;C0005516;C1518681;C0870814;C0013227;C1273517;C1299581;C0014175;C0018017;C1328018;C4049938;C0220825,0.0,0.0,0,1.0,0.5,0.002062515639643824,0.0020305227345568198,0,0
NCT00006294,Genetics of Hypertension Associated Treatments (GenHAT),"To examine whether the association between selected hypertensive genes and combined fatal      coronary heart disease and nonfatal myocardial infarction in high-risk hypertensives is      modified by the type of antihypertensive treatment, leading to differential risks of coronary      heart disease.",C0020538;C0087111,C0010054;C0027051;C0003364;C0018799;C0857121;C0004083;C0087111;C0018787;C0857121;C0000589;C0011906,0.0,0.0,0,5.0,5.0,0.003993989124064772,0.0020292307053026864,0,0
NCT02874547,Community Health Workers Using Patient Stories to Support Hypertension Management,Community Health Workers (CHWs) using patient stories to support hypertension management is a      randomized controlled trial to evaluate the implementation of a CHW-delivered culturally      appropriate storytelling intervention for english and spanish-speaking patients diagnosed      with hypertension who receive care at community health center settings.,C0020538;C1550655;C1171411;C1328956;C0376636,C0282440;C0020538;C0184661;C0020538;C0376636;C0011900;C0542559;C1328956;C0086034;C0308779;C0220825,0.0,0.0,0,0.0,0.0,0.002551101549658289,0.0020276703784308,0,0
NCT00402103,An Assessment of Long Term Safety of the Combination of Aliskiren / Amlodipine in Patients With High Blood Pressure,To assess the long-term (6 month and 12 month) safety of the combination of aliskiren 300 mg      / amlodipine 10 mg in patients with essential hypertension (Mean Sitting Diastolic Blood      Pressure [msDBP] ≥ 90 mmHg and < 110 mmHg).,C0020538;C3811910;C0031809;C0051696;C1120110;C0233324;C1550655,C0085580;C0051696;C1120110;C0012000;C0460139;C0277814;C1561542;C1561542;C0005767;C3539181,394.0,35640.0,0,9.0,9.0,0.00250267039173822,0.0020221832080587927,0,0
NCT01566864,Multi-Method Health System Quality Improvement Intervention to Reduce Hypertension Disparities,"The investigators have designed a three-part quality improvement intervention to 1) improve      the clinic-based measurement of blood pressure, 2) introduce a care management system to      promote self-management behaviors and rapidly titrate medications by algorithms developed in      accord with guidelines and 3) introduce an interactive, needs-based, longitudinal-provider      education system that promotes patient-centered care and provides practical examples of      patient-provider communication strategies. The intervention will occur at six clinics within      the metropolitan area of Baltimore, Maryland. The investigators will also describe clinic and      health system characteristics and measure their association with implementation (uptake),      success (improvements in blood pressure control and reductions in racial disparities), and      sustainability of the three-part intervention over 12 -24 months.",C0184661;C0020538;C0025663;C3266262;C1328956,C0243024;C0086969;C0005823;C0005823;C0184661;C0184661;C0184661;C0013227;C0004083;C0376636;C0002045;C0162791;C0679199;C4551656;C0677505;C0424927;C1555587;C1555587;C0243144;C0456642;C0456642;C0184511;C4693928;C0022396;C3844714;C0202165;C2363670;C1561542;C1555587,0.0,0.0,0,16.0,8.0,0.002029700652484355,0.0020056569564856253,0,0
NCT01977794,Fixed Dose Combination of Bisoprolol and Amlodipine in the Treatment of Hypertension,"This is a randomized, comparative Phase 3 trial to investigate the efficacy of fixed dose      combination (FDC) of bisoprolol and amlodipine in hypertensive subjects (superiority of FDC      over monotherapies).",C0020538;C3811910;C0053799;C0051696;C0087111;C2827483,C3653007;C0857121;C3539181;C0018792;C0376626,270.0,2400.0,0,0.0,0.0,0.0022999770959302264,0.001993221722349895,0,0
NCT01701726,Effect of Acupuncture on Patients With Mild Hypertension,"This is a large scale, open-label, multicenter, randomized controlled clinical trial with      four parallel arms. This trial aims to evaluate the effectiveness of affected meridian      acupuncture for patients with mild hypertension,with respect to decreasing their blood      pressure, safety of acupuncture ,and improving their quality of life as well.",C0020538;C0394664;C1547225;C1550655,C0936233;C0518214;C4553491;C0020538;C0394664;C0394664;C0442797;C0085282;C0460139;C0175659;C1705425;C0005767;C0446516;C0018792;C4554418;C0220825,0.0,0.0,0,6.0,6.0,0.0027204646909838627,0.0019818936957190134,0,0
NCT00248872,A Randomized Trial of Changing Medication Adherence In Hypertensive African-American Patients,"~     The long-term objective is to determine whether better adherence to prescribed medications~     can be achieved through positive affect induction and self-affirmation leading to reduction~     in hypertension-related outcomes such as end-stage renal disease, stroke, and cardiovascular~     mortality among African American patients with poorly controlled hypertension.~   ",C4284232;C0544691,C0020538;C1446409;C0012634;C0038454;C3166216;C3887460;C0020538;C0180112,0.0,0.0,-1,0.0,0.0,0.0007820107463745611,0.001979616079781221,0,0
NCT00091715,Efficacy and Safety of Oral Bosentan in Pulmonary Arterial Hypertension Class II,"The present trial investigates a possible use of oral bosentan, which is currently approved      for the treatment of symptoms of pulmonary arterial hypertension (PAH) Class III and IV, to      patients suffering from PAH Class II.",C0020538;C2707265;C0252643;C0003842;C2698968,C0020538;C0087111;C0024109;C2698969;C0683278;C0332149;C0252643;C2698968;C0150312;C1457887;C0018792,0.0,0.0,0,125.0,125.0,0.0024664370367519428,0.001977983004556645,0,0
NCT00734630,Efficacy and Safety of Nebivolol (Added to Lisinopril or Losartan) in Hypertensive Patients,~     This study will assess blood pressure reduction with nebivolol or placebo in patients taking~     lisinopril or losartan.~   ,C0068475,C0005823;C0068475;C0032042,9.0,3437.0,-1,3.0,3.0,0.0005244729583821343,0.0019722921046022787,0,0
NCT00720525,Pulsatile and Steady State Hemodynamics in Diastolic Heart Failure,"~     Over the past few years, there has been a growing appreciation that a large number of~     patients with heart failure have a relatively normal (or preserved) ejection fraction~     (NFNEF). Epidemiologically, HFNEF is most prevalent among elderly women, most of whom have~     hypertension, diabetes, or both and often coronary artery disease (CAD). Increased arterial~     stiffness and/or wave reflections have been described in the same patient groups. Therefore,~     the investigators speculate that pulsatile hemodynamics, representing arterial stiffness~     and/or arterial wave reflections, 1) may be altered in HFNEF patients, 2) this may contribute~     to pathophysiology of HFNEF, and 3) this may be used for the diagnosis of the syndrome.~   ",C0018801,C1956346;C0018801;C0020538;C0427008;C0011900;C0011847;C0427008;C0039082,0.0,0.0,-1,29.0,29.0,0.000994203894142286,0.0019654394137410946,0,0
NCT02915315,Salt-sensitive Hypertension Study in Lantian County,"Essential hypertension is a complex trait which results from interaction between      environmental factors and genetic factors. Our study aimed to detect the differential      expression of LncRNAs and epigenetic changes such as DNA methylation associated with salt      sensitive hypertension in human based on a chronic salt loading study conducted in Lantian      county, China. Firstly, a chronic salt loading study will be conducted in a Chinese      population to differentiate salt-sensitive and salt-resistant individuals. Second, LncRNAs      and DNA methylation Chip analysis will be performed using samples collected from      salt-sensitive and salt resistant individual, and the results will be analyzed by modern      bioinformatics methods to seek for differential genetic markers. In addition, the      investigators also try to examine the effects of chronic salt loading on BP, ambulatory BP,      microalbuminuria and baPWV and other biochemical indexes. This project had great significance      to reveal molecular genetics mechanism in the development of salt, salt-sensitive and      hypertension.",C0020538;C0947630;C0037494;C0020517,C0085580;C1516998;C0730345;C0600223;C0020538;C0020538;C0243107;C0185117;C1561560;C0025663;C0918012;C0442726;C0947630;C0947630;C0947630;C0037494;C0037494;C0037494;C0037494;C0037494;C0037494;C0037494;C0037494;C0037494;C0037494;C0000589;C1518681;C1561593;C0011906;C0011906;C0020517;C0020517;C1514892;C0020517;C1514892;C0020517;C0939261,0.0,0.0,0,1.0,1.0,0.0026041182216067224,0.0019592457706120326,0,0
NCT00926289,Telmisartan 80mg Plus Hydrochlorothiazide 25mg First Line in Moderate or Severe Hypertension,The primary objective of this trial is to demonstrate that the fixed-dose combination of      T80/HCTZ25 is superior as first line therapy in reducing seated trough cuff Systolic Blood      Pressure(SBP) compared to the monotherapy of T80 in patients with grade 2 or grade 3      hypertension (SBP>=160 mmHg and Diastolic Blood Pressure(DBP)>=100 mmHg).,C0020261;C0020538;C0248719;C1547226;C0205082;C0700221,C0020538;C0018017;C0012000;C0087111;C0687696;C0687697;C0005767;C0005767;C3539181;C0018792;C1995642,2.0,2664.0,0,4.0,4.0,0.002054149425109971,0.0019464392005081636,0,0
NCT00218972,"Physical Exercise in Hypertension, Randomised Clinical Trial","Endurance training has a documented effect on hypertension. However, only low to moderate      training intensity has so far been studied. High aerobic intensity should, from physiological      considerations, prove more effective in also reducing high blood pressure. The present study      is a randomised comparison of high versus moderate intensity versus training in groups, and      general advice on 24 hour blood pressure in hypertensives. The training period is 12 weeks,      with follow-up after 1 year. Maximum oxygen uptake, quality of life, left ventricular      function and blood vessel reactivity are also measured.",C1096775;C0020538;C0031809;C1522704,C1282173;C0020538;C0518214;C0518609;C0429627;C0020538;C0005847;C0018827;C1301725;C0518031;C0031843;C0150312;C1518681;C1552839;C0150600;C0025344;C0947630;C4321237;C1561543;C1550472;C0857121;C0442694;C0442694;C0442694;C0442694;C0001701;C0700164;C1547226;C1547226;C2946875,0.0,0.0,0,39.0,39.0,0.0022414094213208664,0.0019449316532185984,0,0
NCT00219102,"A Clinical Study to Evaluate Safety & Efficacy of the Combination of Aliskiren, Valsartan & Hydrochlorothiazide in Diabetic Hypertensive Nonresponder Patients","~     To evaluate the blood pressure lowering effect and safety of aliskiren used in combination~     with valsartan/hydrochlorothiazide in diabetic patients with essential hypertension, not~     adequately responsive to the combination of valsartan and hydrochlorothiazide~   ",C0216784,C0085580;C0005823;C0216784;C0216784,0.0,0.0,-1,4.0,4.0,0.0008120699014085576,0.001944344848074402,0,0
NCT02848690,Educational Intervention for Sodium Restriction in Patients With Hypertension,"This parallel, randomized clinical trial will include 120 participants. They will be      allocated to a sodium restriction educational intervention or usual care groups. The      educational intervention will be planned based on the DSRQ application and sessions will be      conducted once a month for the period of six months. Both spot urine collection to estimate      sodium intake and the DSRQ will be applied at the baseline, in the eighth week and at the end      of the follow-up. Blood sample and 24-hour ambulatory blood pressure monitoring (ABPM) will      be conducted at the beginning and at the end of the follow-up. Anthropometric measurements,      blood pressure measurement and 24-hour food recall will be collected during follow-up.",C0281163;C0020538;C0337443;C1550655,C0206034;C0855316;C0281163;C0281163;C0005823;C0489645;C0185125;C0150369;C1552839;C0025344;C0034770;C1561542;C0042036;C0005767;C1561540;C3540798;C0034770;C0441621;C0202165;C0233697;C1561542;C4554418;C0728774;C4698437,0.0,0.0,0,0.0,0.0,0.0029043376076505326,0.0019326819319311704,0,0
NCT00621153,Candesartan Effect in Second Stage Arterial Hypertension,To compare the changes in mean sitting DBP from baseline after 4 weeks of therapy with either      candesartan cilexetil/HCT combination therapy or candesartan cilexetil monotherapy regimen,C0020538;C0717550;C0003842;C1300072,C0527379;C0527379;C0009429;C0277814;C0087111;C0040808;C1305849;C0728774,24.0,896.0,1,1.0,1.0,0.002475547194288524,0.0019233595499447388,0,0
NCT00781365,Home Blood Pressure Telemonitoring and Case Management to Control Hypertension,In this project we develop and implement an intervention to improve hypertension control in a      primary care setting that takes advantage of new technology (home blood pressure      telemonitoring) and team models of care (pharmacist case management). The results of the      project will have important implications for future efforts to improve care provided to many      of the estimated 20 million Americans with uncontrolled hypertension.,C0085971;C0005823;C0020538;C1548341;C1564718,C0085971;C0683887;C0005823;C0184661;C0020538;C0033137;C0020538;C0542559;C2735418;C0184511;C0184511;C0015264;C0009566;C0308269;C4084912;C3161035;C2363670,196.0,22494.0,0,89.0,22.25,0.0026988331301969256,0.001891114374612295,0,0
NCT01586156,PAHTCH Pulmonary Arterial Hypertension Treatment With Carvedilol for Heart Failure (Carvedilol),"Pulmonary arterial hypertension (PAH) is a progressive disease of the pulmonary vasculature      leading to elevated pulmonary pressure and right ventricular (RV) dysfunction with heart      failure. Measures of RV function are better predictors of mortality and long term outcomes      than pulmonary vascular resistance. The interaction between RV function and the pulmonary      circulation is not fully understood, but increased after load appears insufficient to explain      right heart failure. Yet, all approved PAH therapies target vasodilation of the pulmonary      vasculature to lower pressures",C0018801;C0020538;C0054836;C0054836;C2707265;C0087111;C0003842,C2973725;C0456261;C0677932;C0235527;C0595862;C0018827;C0277785;C0005775;C0024109;C0024109;C0024109;C0087111;C0024109;C0460139;C0460139;C0031843;C0031843;C0018787;C0230370;C0162340;C0856882;C0151576,30.0,540.0,0,10.0,5.0,0.00313533936768376,0.0018757673658456515,0,0
