nct_id,relevance,brief_title,official_title,conditions_list,eligibility_criteria,description,keywords_list,Diseases,brief_title_concepts_list,official_title_concepts_list,brief_summary_concepts_list,conditions_list_concepts_list,eligibilities_concepts_list,keywords_list_concepts_list,CompletionDate,tot_subj_affected,tot_subj_risk,Status,pubmed_ids,citationSum,citationAvg,briefTitlePageRankScore,briefTitleAndSummaryCombinedPageRankScore,inclusion,exclusion
NCT01508026,1,"Study of the Efficacy and Safety of the Combination of Two FDA Approved Oral Medications, Nebivolol and Valsartan for Treatment of Stage 1 or 2 Hypertension","A Multicenter, Randomized, Double-blind, Placebo-Controlled, 8-Week Study to Evaluate the Safety and Efficacy of Nebivolol and Valsartan Given as a Fixed Dose Combination in Patients With Stage 1 or 2 Essential Hypertension",Hypertension;,"Inclusion Criteria:          -  Male or female outpatients of age 18 years or above          -  Patients diagnosed with stage 1 or stage 2 essential hypertension          -  Normal physical examination findings, electrocardiogram (ECG) results and chest x-ray;             or abnormal findings judged by the Investigator to be not clinically significant        Exclusion Criteria:          -  Secondary hypertension or severe hypertension          -  Clinically significant cardiovascular disease or heart failure          -  Clinical significant respiratory disease that would prohibit the use of a beta blocker          -  A medical contraindication to discontinuing a current antihypertensive therapy          -  History of Type 1 diabetes mellitus          -  History of Severe Mental Illness except mild depression",To evaluate the efficacy and safety of fixed-dose combination of nebivolol and valsartan      compared to monotherapy and placebo in patients with stage 1 and stage 2 hypertension.,Stage 1;Stage 2;Hypertension;,Cardiovascular Diseases;,C0020538;C3811910;C0013227;C0068475;C0216784;C0087111;C3840271;C0947630,C0085580;C3811910;C2911690;C0068475;C0216784;C0220825;C0032042;C3840271;C0456909;C0947630;C2827483;C1550655;C3897779,C0020538;C0068475;C0216784;C0032042;C0441767;C1300072;C3539181;C0220825,C0020538,C0585941;C0011854;C0085580;C0155616;C0007222;C0031809;C0035242;C0013798;C1301624;C0588006;C0004936;C0018801;C0020538;C0001645;C0039985;C0011900;C0205161;C3272565;C0138547;C0441767;C0262926;C0262926;C0231683;C0205082;C0205082;C1300072;C1550655;C0037088;C0037088;C3272565;C3899561,C1300072;C0020538,20130501,,,Completed,24881993,11,11,0.020132552919068,0.024241521050983,"Male or female outpatients of age 18 years or above;;;;;;;;;;Patients diagnosed with stage 1 or stage 2 essential hypertension;;;;;;;;;;Normal physical examination findings, electrocardiogram (ECG) results and chest x-ray;             or abnormal findings judged by the Investigator to be not clinically significant",Clinically significant cardiovascular disease or heart failure;;;;;;;;;;Clinical significant respiratory disease that would prohibit the use of a beta blocker;;;;;;;;;;A medical contraindication to discontinuing a current antihypertensive therapy;;;;;;;;;;History of Type 1 diabetes mellitus;;;;;;;;;;History of Severe Mental Illness except mild depression
NCT00644605,1,"A Study to Assess the Efficacy and Safety of 20, 40, and 80mg of Sildenafil Three Times a Day in the Treatment of Pulmonary Arterial Hypertension","A Multinational, Multi-centre, Randomised, Double-blind, Double-dummy, Placebo-controlled Study to Assess the Efficacy and Safety of 20, 40, and 80mg TID Sildenafil in the Treatment of Pulmonary Arterial Hypertension in Subjects Aged 18 Years and Over","Hypertension;Familial Primary Pulmonary Hypertension;Hypertension, Pulmonary;","Inclusion Criteria:        Included patients had primary pulmonary arterial hypertension, pulmonary hypertension        secondary to connective tissue disease, or pulmonary hypertension with surgical repair at        least 5 years previously; a mean pulmonary artery pressure greater than or equal to 25 mmHg        and a pulmonary artery wedge pressure of less than or equal to 15 mmHg at rest, via right        heart catheterisation within 21 days prior to randomisation; and a baseline 6-Minute Walk        test distance of 100 m to 450 m.        Exclusion Criteria:        Subjects with congenital heart disease, pulmonary hypertension due to thromboembolism, HIV,        chronic obstructive airway disease, congestive heart failure or schistosomiasis; subjects        with significant (ie > 2+) valvular disease other than tricuspid regurgitation or pulmonary        regurgitation; and acutely decompensated heart failure within the previous 30 days;        subjects with pulmonary hypertension secondary to any other etiology other than those        specified in the inclusion criteria.","To evaluate the effect of three doses of oral sildenafil (20, 40 and 80 mg three times a day      [TID]) on exercise capacity, as measured by the 6-Minute Walk test, as well as the safety and      tolerability, after 12 weeks of treatment in subjects with pulmonary arterial hypertension      who are aged 18 years and over. To investigate the plasma concentration-effect relationship      and to determine the population pharmacokinetic (PK) parameters.",,Cardiovascular Diseases;Respiratory Tract Diseases;,C0020538;C0529793;C0087111;C2707265;C0003842;C0947630,C0020538;C0529793;C0087111;C2707265;C0003842;C0032042;C3266262;C0456909;C0947630;C2911690,C0020538;C0086045;C0529793;C0087111;C0024109;C1518681;C0032105;C1518681;C0392366;C1561538;C0031327;C0452240;C4684765;C0220825;C4082977,C2707265;C2707265;C0020541,C0264936;C0034094;C0600260;C0009782;C0428642;C0018802;C0040961;C0020542;C0020542;C0020542;C0020538;C0374711;C0007430;C0040038;C0036323;C0018799;C0232605;C0018801;C0024109;C0027627;C0024109;C0012634;C0018787;C0392366;C3842337;C4048188;C0015726;C4331837;C0728774;C3842265,C1140111,20031101,,,Completed,22354598,3,3,0.021475344156265,0.023750573585233,"Included patients had primary pulmonary arterial hypertension, pulmonary hypertension        secondary to connective tissue disease, or pulmonary hypertension with surgical repair at        least 5 years previously; a mean pulmonary artery pressure greater than or equal to 25 mmHg        and a pulmonary artery wedge pressure of less than or equal to 15 mmHg at rest, via right        heart catheterisation within 21 days prior to randomisation; and a baseline 6-Minute Walk        test distance of 100 m to 450 m. ",
NCT00994617,1,Monotherapy Versus Dual Therapy for Initial Treatment for Hypertension,Monotherapy Versus Dual Therapy for Initial Treatment for Hypertension,Hypertension;Coronary Vasospasm;,"Patients must meet ALL inclusion criteria          1. Aged 18-79          2. Male subjects or female subjects taking adequate contraception such as the oral             contraceptive pill, an intra uterine device or who are surgically sterilised or             postmenopausal Females          3. BP ≥150 mmHg (systolic) OR ≥ 95 mmHg (diastolic). Patients may be included if the PI             anticipates BP criteria for inclusion will be met at randomisation          4. Either never-treated or received a maximum of one antihypertensive drug class in the             previous year        Patients will be excluded for ANY ONE of the following reasons          1. Clinic SBP > 200 mmHg or DBP > 120 mmHg, with PI discretion to override if home BP             measurements are lower          2. Secondary or accelerated phase hypertension          3. eGFR < 45 mls/min          4. Contra-indication or previous intolerance to any trial therapy          5. Failure to record required home BP readings during placebo run-in.          6. Significant co-morbidity (investigator opinion but to include alcoholism, terminal             illness, documented non-attendance at clinics etc)          7. Diabetes type 1          8. Plasma K+ outside normal range on two successive measurements during screening          9. Requirement for treatment with ≥2 drugs (which can be a CCB and/or {ACEi OR ARB OR             direct renin inhibitor OR β-blocker}) in order to reduce blood pressure to ≤180/120             mmHg         10. Requirement for diuretic therapy (other than for hypertension)         11. Requirement for ACE inhibitor (or ARB) therapy (other than for hypertension)         12. Absolute contra-indications to any of the study drugs (listed on their data-sheet)         13. Current therapy for cancer         14. Anticipation of change in medical status during course of trial (e.g. planned surgical             intervention requiring >2 weeks convalescence , actual or planned pregnancy)         15. Inability to give informed consent         16. Participation in a clinical study involving an investigational drug or device within 4             weeks of screening.         17. Any concomitant condition that, in the opinion of the investigator, may adversely             affect the safety and/or efficacy of the study drug or severely limit the subject's             lifespan or ability to complete the study (eg, alcohol or drug abuse, disabling or             terminal illness, mental disorders).         18. Treatment with any of the following prohibited medications:               1. Oral corticosteroids within 3 months of screening. Treatment with systemic                  corticosteroids is also prohibited during study participation.                  Chronic stable or unstable use of non-steroidal anti-inflammatory drugs (NSAIDs)                  other than acetylsalicylic acid is prohibited. Chronic use is defined as >3                  consecutive or nonconsecutive days of treatment per week. In addition, the                  intermittent use of NSAIDs is strongly discouraged throughout the duration of                  this study. If intermittent treatment is required, NSAIDs must not be used for                  more than a total of 2 days. For all subjects requiring analgesic or anti-pyretic                  agents, the use of paracetamol is recommended during study participation.               2. The use of short-acting oral nitrates (eg, sublingual nitroglycerin) is                  permitted; however, subjects should not take short-acting oral nitrates within 4                  hours of screening or any subsequent study visit.               3. The use of long-acting oral nitrates (eg, Isordil) is permitted; however, the                  dose must be stable for at least 2 weeks prior to screening and randomisation.               4. The use of sympathomimetic decongestants is permitted; however, not within 1 day                  prior to any clinic visit/BP assessment.               5. The use of theophylline is permitted; however, the dose must be stable for at                  least 4 weeks prior to screening and throughout study participation.               6. The use of phosphodiesterase (PDE) type V inhibitors is permitted; however,                  subjects must refrain from taking these medications within 1 day of screening or                  any subsequent study visit.               7. The use of alpha-blockers is not permitted - with the exception of afluzosin and                  tamsulosin for prostatic symptoms","To test whether the current custom of initiating treatment for hypertension with a single      drug is less effective in the short-term than initial combination therapy, and results in the      eventual need for comparatively more antihypertensive drug therapy.",,Cardiovascular Diseases;,C0020538;C0087111;C0087111;C1554184,C0020538;C0087111;C0087111;C1554184,C0003364;C0009429;C0020538;C0087111;C0087111;C0087136;C0392366;C0013227,C0085616,C0003212;C0003364;C0740858;C0021900;C0013230;C0004057;C0032992;C0948575;C0679247;C0004936;C0001617;C0001617;C0039052;C0232970;C0005823;C0700589;C0009871;C0003015;C0009940;C0017887;C0282374;C0020538;C0009488;C0020538;C0020538;C0184661;C0039771;C0231199;C4284141;C4284141;C4284141;C0013227;C0000970;C0013227;C0001973;C1301725;C0138547;C0138547;C0138547;C0031809;C0257343;C0199230;C0087111;C0199230;C0012634;C0087111;C0199230;C0087111;C0087111;C0087111;C0002771;C0199230;C0199230;C0199230;C0199230;C0033572;C3245501;C0011847;C0205082;C0443343;C3245501;C0087111;C0032042;C0221423;C0087111;C0087111;C1547296;C1547296;C0590720;C3844638;C0034869;C0032105;C1553386;C3244286;C0006826;C0001721;C0003211;C0003211;C0003211;C0456387;C0013227;C0947630;C0013227;C0947630;C0947630;C0947630;C0947630;C0947630;C0947630;C0947630;C1512346;C1512346;C0947630;C0947630;C1512346;C0439095;C1561543;C3811844;C3245479;C0013227;C1561540;C1273517;C1306620;C1305849;C0175201;C0600140;C0175556;C1561538;C1561538;C1960108;C1550655;C1550655;C1550655;C1552867;C1457887;C0009797;C0679106;C4684637;C3883383;C0023472;C0543467;C1321866;C0745348;C0745348;C0012000;C0027627;C0332534;C1561542;C1706074;C1706074;C1706074;C0018792;C2702329;C1522411;C0018792;C4331837;C4331837;C4331837;C0031638;C1553756;C0260026;C1995642;C4086490;C0543467;C3272565;C4283785;C0332155;C4698437;C4699193,C1140111,20141201,,,Unknown status,29151036,3,3,0.026526094030504,0.023672200565396,"Aged 18-79;;;;;;;;;;Male subjects or female subjects taking adequate contraception such as the oral             contraceptive pill, an intra uterine device or who are surgically sterilised or             postmenopausal Females;;;;;;;;;;BP ΓëÑ150 mmHg (systolic) OR ΓëÑ 95 mmHg (diastolic). Patients may be included if the PI             anticipates BP criteria for inclusion will be met at randomisation;;;;;;;;;;Either never-treated or received a maximum of one antihypertensive drug class in the             previous year","Clinic SBP > 200 mmHg or DBP > 120 mmHg, with PI discretion to override if home BP             measurements are lower;;;;;;;;;;Secondary or accelerated phase hypertension;;;;;;;;;;eGFR < 45 mls/min;;;;;;;;;;Contra-indication or previous intolerance to any trial therapy;;;;;;;;;;Failure to record required home BP readings during placebo run-in.;;;;;;;;;;Significant co-morbidity (investigator opinion but to include alcoholism, terminal             illness, documented non-attendance at clinics etc);;;;;;;;;;Diabetes type 1;;;;;;;;;;Plasma K+ outside normal range on two successive measurements during screening;;;;;;;;;;Requirement for treatment with ΓëÑ2 drugs (which can be a CCB and/or {ACEi OR ARB OR             direct renin inhibitor OR ╬▓-blocker}) in order to reduce blood pressure to Γëñ180/120             mmHg;;;;;;;;;;Requirement for diuretic therapy (other than for hypertension);;;;;;;;;;Requirement for ACE inhibitor (or ARB) therapy (other than for hypertension);;;;;;;;;;Absolute contra-indications to any of the study drugs (listed on their data-sheet);;;;;;;;;;Current therapy for cancer;;;;;;;;;;Anticipation of change in medical status during course of trial (e.g. planned surgical             intervention requiring >2 weeks convalescence , actual or planned pregnancy);;;;;;;;;;Inability to give informed consent;;;;;;;;;;Participation in a clinical study involving an investigational drug or device within 4             weeks of screening.;;;;;;;;;;Any concomitant condition that, in the opinion of the investigator, may adversely             affect the safety and/or efficacy of the study drug or severely limit the subject's             lifespan or ability to complete the study (eg, alcohol or drug abuse, disabling or             terminal illness, mental disorders).;;;;;;;;;;Treatment with any of the following prohibited medications:;;;;;;;;;;Oral corticosteroids within 3 months of screening. Treatment with systemic                  corticosteroids is also prohibited during study participation.                  Chronic stable or unstable use of non-steroidal anti-inflammatory drugs (NSAIDs)                  other than acetylsalicylic acid is prohibited. Chronic use is defined as >3                  consecutive or nonconsecutive days of treatment per week. In addition, the                  intermittent use of NSAIDs is strongly discouraged throughout the duration of                  this study. If intermittent treatment is required, NSAIDs must not be used for                  more than a total of 2 days. For all subjects requiring analgesic or anti-pyretic                  agents, the use of paracetamol is recommended during study participation.;;;;;;;;;;The use of short-acting oral nitrates (eg, sublingual nitroglycerin) is                  permitted; however, subjects should not take short-acting oral nitrates within 4                  hours of screening or any subsequent study visit.;;;;;;;;;;The use of long-acting oral nitrates (eg, Isordil) is permitted; however, the                  dose must be stable for at least 2 weeks prior to screening and randomisation.;;;;;;;;;;The use of sympathomimetic decongestants is permitted; however, not within 1 day                  prior to any clinic visit/BP assessment.;;;;;;;;;;The use of theophylline is permitted; however, the dose must be stable for at                  least 4 weeks prior to screening and throughout study participation.;;;;;;;;;;The use of phosphodiesterase (PDE) type V inhibitors is permitted; however,                  subjects must refrain from taking these medications within 1 day of screening or                  any subsequent study visit.;;;;;;;;;;The use of alpha-blockers is not permitted - with the exception of afluzosin and                  tamsulosin for prostatic symptoms"
NCT00540436,0,"Evaluate the Efficacy, Safety and Pharmacokinetics of GSK1325760A in the Treatment of Pulmonary Arterial Hypertension","Study AMB107816, Clinical Evaluation of GSK1325760A in the Treatment of Pulmonary Arterial Hypertension (PAH)- An Open-Label Phase II/III Study to Evaluate the Efficacy, Safety and Pharmacokinetics of GSK1325760A -<Classification: Exploratory and Confirmatory Clinical Trial>","Hypertension;Familial Primary Pulmonary Hypertension;Hypertension, Pulmonary;",Inclusion criteria:          -  Subjects must have a diagnosis of Pulmonary Arterial Hypertension (PAH) in clinical             classification of Pulmonary Hypertension Group1          -  The mean right heart catheterization parameters measured from 6 months prior to the             administration of the investigational drug must meet the criteria below:          -  Mean pulmonary arterial pressure (mPAP) of >25 mmHg          -  Pulmonary vascular resistance (PVR) of >3 mmHg/L/min          -  Mean pulmonary capillary wedge pressure or left ventricular end diastolic pressure of             <15 mmHg (if measurable)          -  The measured six minutes walk distance (6MWD) at screening visit is in the range of             =>150m and <=450m,The primary objective of this study is to evaluate the effect of GSK1325760A on improvement      in exercise capacity in subjects with pulmonary arterial hypertension (PAH).      The secondary objectives of this study are to evaluate administration of GSK1325760A on:        -  The safety and tolerability        -  Improvement of PAH        -  The steady-state plasma pharmacokinetics of GSK1325760A,Ambrisentan;Pulmonary Arterial Hypertension;6MWD;,Cardiovascular Diseases;Respiratory Tract Diseases;,C0031327;C0020538;C0087111;C2707265;C0220825;C0003842,C4084924;C0031327;C1096775;C0020538;C0750484;C0087111;C2707265;C0003842;C0220825;C0947630;C1522485;C0947630;C0475455,C4684765;C0020538;C0031327;C1533734;C0018017;C0018017;C0024109;C0027627;C1518681;C0032105;C0947630;C0947630;C0452240;C3844714;C0220825;C0220825,C2707265;C2707265;C0020541,C0189896;C1168098;C0020542;C0013230;C0042380;C0507816;C0428883;C1533734;C0043091;C0020538;C0018827;C0011900;C2707265;C2707265;C0199230;C0003842;C1512346;C0429886;C0681111;C1561557;C1561542;C4331837;C2702329;C3272565;C0886384,C0003842,20090101,102,700,Completed,21812736,1,1,0.020240084910949,0.023654036520251,Subjects must have a diagnosis of Pulmonary Arterial Hypertension (PAH) in clinical             classification of Pulmonary Hypertension Group1;;;;;;;;;;The mean right heart catheterization parameters measured from 6 months prior to the             administration of the investigational drug must meet the criteria below:;;;;;;;;;;Mean pulmonary arterial pressure (mPAP) of >25 mmHg;;;;;;;;;;Pulmonary vascular resistance (PVR) of >3 mmHg/L/min;;;;;;;;;;Mean pulmonary capillary wedge pressure or left ventricular end diastolic pressure of             <15 mmHg (if measurable);;;;;;;;;;The measured six minutes walk distance (6MWD) at screening visit is in the range of             =>150m and <=450m,
