nct_id,relevance,brief_title,official_title,conditions_list,eligibility_criteria,description,keywords_list,Diseases,brief_title_concepts_list,official_title_concepts_list,brief_summary_concepts_list,conditions_list_concepts_list,eligibilities_concepts_list,keywords_list_concepts_list,CompletionDate,tot_subj_affected,tot_subj_risk,Status,pubmed_ids,citationSum,citationAvg,briefTitlePageRankScore,briefTitleAndSummaryCombinedPageRankScore,inclusion,exclusion
NCT01065831,1,Faith-based Approaches in the Treatment of Hypertension (FAITH),Faith-based Approaches in the Treatment of Hypertension (FAITH),Hypertension;,Inclusion Criteria:          -  Age 18 years or older          -  Diagnosis of hypertension          -  Self-identified Black or African American          -  SBP > 140 mmHg or DBP > 90 mmHg (based on the average of 3 blood pressure readings);             or average SBP > 130 mm Hg or DBP > 80 mm hg (for those with diabetes or kidney             disease) at the screening/baseline visits          -  Able to speak English        Exclusion Criteria:          -  Unable to comply with the study protocol (either self-selected or by indicating during             screening that s/he could not complete all requested tasks).          -  Pregnancy,The purpose of this study is to test the effect of a church-based lifestyle intervention on      blood pressure reduction in 400 hypertensive blacks (BP> 140/90 mm hg).,"motivational interviewing, lay health advisers;",Cardiovascular Diseases;,C0020538;C0087111,C0020538;C0087111,C0005823;C0184661;C0857121;C4551656;C1518681;C0947630;C0392366,C0020538,C0005823;C2599718;C0020538;C0011900;C0199230;C0199230;C0032961;C0011849;C0012634;C0022646;C1299582;C0725694;C0600116;C1551994;C1114365;C1306620;C1305849;C1306620;C1305849;C1550043;C1512346;C1555709;C1553888;C0728774;C4283785,C0683474,20140601,,,Completed,30354579;24576512,6,3,0.036827961709009,0.029269217328088,Age 18 years or older;;;;;;;;;;Diagnosis of hypertension;;;;;;;;;;Self-identified Black or African American;;;;;;;;;;SBP > 140 mmHg or DBP > 90 mmHg (based on the average of 3 blood pressure readings);             or average SBP > 130 mm Hg or DBP > 80 mm hg (for those with diabetes or kidney             disease) at the screening/baseline visits;;;;;;;;;;Able to speak English,Pregnancy
NCT00430716,0,To Assess The Efficacy and Safety Of Oral Sildenafil in the Treatment of Pulmonary Arterial Hypertension.,"A Multinational, Multicentre, Randomized, Parallel Group, Double-Blind Study To Assess The Efficacy and Safety Of 1 mg, 5 mg and 20 mg TID of Oral Sildenafil in the Treatment of Subjects Aged 18 Years and Over With Pulmonary Arterial Hypertension (PAH)",Hypertension;Familial Primary Pulmonary Hypertension;,"Inclusion Criteria:          -  Subjects with PAH (i.e. IPAH or secondary to connective tissue disease or with             surgical repair of ASD, VSD, PDA, aorto-pulmonary window) whose baseline six minute             walk test distance is >/= 100 m and </= 450 m.          -  Subjects with a mean pulmonary artery pressure of >/= 25 mmHg and a pulmonary artery             wedge pressure of </= 15 mmHg at rest via right heart catheterization performed within             12 weeks prior to randomization.        Exclusion Criteria:          -  Subjects whose 6 Minute Walk Distance may be limited by conditions other than PAH             related dyspnoea or fatigue, e.g. claudication from vascular insufficiency or             significant arthritis.          -  Subjects who are currently receiving any forms of chronic treatment for PAH such as             prostacyclin, PDE-5 inhibitors, endothelin-receptor antagonists, nitrates or nitric             oxide donors (e.g. arginine supplement, nicorandil) in any form, protease inhibitors             such as ritonavir and saquinavir, ketoconazole, itraconazole, and alpha blockers.             Subjects previously receiving any of these drugs must have stopped use for a period of             at least 1 month prior to screening, except in the case of bosentan or prostacyclin (3             months).","To demonstrate a dose response for 1 mg, 5 mg and 20 mg TID oral sildenafil for the treatment      of subjects with PAH.",,Cardiovascular Diseases;Respiratory Tract Diseases;,C0020538;C0529793;C0087111;C2707265;C0003842,C0020538;C0529793;C0087111;C2707265;C4554418;C0003842;C1561557;C0456909;C0947630;C3897779,C0529793;C0087111;C1704632,C0152171,C0189896;C0009782;C0428642;C0232352;C0033607;C0034052;C0374711;C0043091;C0001641;C0311395;C0033567;C0022625;C0064113;C0033567;C0068700;C0286738;C0027627;C0024109;C0003864;C0087111;C0292818;C0199230;C0013404;C0003765;C0252643;C0015672;C0025344;C0013227;C1561542;C0392366;C0012634;C3653430;C0233492;C1947943;C1561542;C4331837;C4331837;C0728774;C3834249,C1140111,20100501,452,30315,Terminated,28228114,2,2,0.021867197543076,0.02887601292652,"Subjects with PAH (i.e. IPAH or secondary to connective tissue disease or with             surgical repair of ASD, VSD, PDA, aorto-pulmonary window) whose baseline six minute             walk test distance is >/= 100 m and </= 450 m.;;;;;;;;;;Subjects with a mean pulmonary artery pressure of >/= 25 mmHg and a pulmonary artery             wedge pressure of </= 15 mmHg at rest via right heart catheterization performed within             12 weeks prior to randomization.","Subjects who are currently receiving any forms of chronic treatment for PAH such as             prostacyclin, PDE-5 inhibitors, endothelin-receptor antagonists, nitrates or nitric             oxide donors (e.g. arginine supplement, nicorandil) in any form, protease inhibitors             such as ritonavir and saquinavir, ketoconazole, itraconazole, and alpha blockers.             Subjects previously receiving any of these drugs must have stopped use for a period of             at least 1 month prior to screening, except in the case of bosentan or prostacyclin (3             months)."
NCT00125918,1,PHIRST-1: Tadalafil in the Treatment of Pulmonary Arterial Hypertension,"PHIRST-1: Randomized, Double-Blind, Placebo-Controlled Phase 3 Study of the Phosphodiesterase Type 5 (PDE5) Inhibitor Tadalafil in the Treatment in Patients With Pulmonary Arterial Hypertension","Hypertension;Hypertension, Pulmonary;Familial Primary Pulmonary Hypertension;","Inclusion Criteria:          -  At least 12 years of age.          -  Body weight at least 40 kg (approximately 88 pounds).          -  Pulmonary hypertension (PAH) that is either idiopathic; related to collagen vascular             disease; related to anorexigen use; associated with an atrial septal defect (resting             SaO2 greater than or equal to 88%); with surgical repair, of at least 1 year duration,             of a congenital systemic-to-pulmonary shunt.          -  If on bosentan, must be at the maximal dose of 125 mg twice daily for a minimum of 12             weeks prior to screening and have an AST/ALT less than 3 times normal.          -  History of PAH established by a resting mean pulmonary artery pressure greater than or             equal to 25 mm Hg, pulmonary artery wedge pressure less than or equal to 15 mm Hg, and             pulmonary vascular resistance greater than or equal to 3 Wood units via right heart             catheterization          -  Have World Health Organization functional class I, II, III or IV status.          -  Have a qualifying 6-minute walk test distance at screening          -  Have no evidence of significant parenchymal lung disease        Exclusion Criteria:          -  Are nursing or pregnant.          -  PAH due to conditions other than noted in the above inclusion criteria.          -  History of left-sided heart disease.          -  History of atrial septostomy within 3 months before study entry          -  History of angina pectoris or other condition that was treated with long-or             short-acting nitrates within 12 weeks before administration of study drug.          -  History of symptomatic coronary disease.          -  Have any therapy with a prostacyclin or analogue, L-arginine, phosphodiesterase (PDE)             inhibitor, or investigational drug within 4 weeks before administration of study drug.",The purpose of this study is to evaluate the safety and effectiveness of tadalafil for the      treatment of pulmonary arterial hypertension.,"Hypertension, Pulmonary; Pulmonary Heart Disease;",Cardiovascular Diseases;Respiratory Tract Diseases;,C0020538;C1176316;C0087111;C2707265;C0003842,C0020538;C2911690;C1176316;C0087111;C2707265;C0003842;C0032042;C0457499;C0456909;C0947630;C1550655;C3897779;C4553183,C0020538;C4553491;C1176316;C0087111;C0024109;C0947630;C0220825,C0152171;C0340543,C0034094;C0456261;C0428642;C0020542;C0013230;C0430515;C0700586;C0010068;C0374711;C0007430;C0002962;C1533734;C1533734;C0018799;C1552679;C0024115;C0033567;C0944911;C0225808;C0003765;C0024109;C0199230;C0199230;C0012634;C0009325;C0005847;C0252643;C0549206;C0012634;C4035626;C0262926;C0028678;C0262926;C0262926;C0262926;C0262926;C0087111;C0018792;C1553386;C0542331;C0456387;C0947630;C0947630;C0947630;C1561543;C0013227;C0013227;C0231221;C0933845;C0012634;C0458074;C0233492;C0233492;C1328956;C0031843;C0332534;C0723285;C1561542;C4331837;C0031638;C4699613;C0332155;C0069695,C0020542;C0034072,20070801,,,Completed,19470885,164,164,0.021559391082958,0.028667255672601,"At least 12 years of age.;;;;;;;;;;Body weight at least 40 kg (approximately 88 pounds).;;;;;;;;;;Pulmonary hypertension (PAH) that is either idiopathic; related to collagen vascular             disease; related to anorexigen use; associated with an atrial septal defect (resting             SaO2 greater than or equal to 88%); with surgical repair, of at least 1 year duration,             of a congenital systemic-to-pulmonary shunt.;;;;;;;;;;If on bosentan, must be at the maximal dose of 125 mg twice daily for a minimum of 12             weeks prior to screening and have an AST/ALT less than 3 times normal.;;;;;;;;;;History of PAH established by a resting mean pulmonary artery pressure greater than or             equal to 25 mm Hg, pulmonary artery wedge pressure less than or equal to 15 mm Hg, and             pulmonary vascular resistance greater than or equal to 3 Wood units via right heart             catheterization;;;;;;;;;;Have World Health Organization functional class I, II, III or IV status.;;;;;;;;;;Have a qualifying 6-minute walk test distance at screening;;;;;;;;;;Have no evidence of significant parenchymal lung disease","PAH due to conditions other than noted in the above inclusion criteria.;;;;;;;;;;History of left-sided heart disease.;;;;;;;;;;History of atrial septostomy within 3 months before study entry;;;;;;;;;;History of angina pectoris or other condition that was treated with long-or             short-acting nitrates within 12 weeks before administration of study drug.;;;;;;;;;;History of symptomatic coronary disease.;;;;;;;;;;Have any therapy with a prostacyclin or analogue, L-arginine, phosphodiesterase (PDE)             inhibitor, or investigational drug within 4 weeks before administration of study drug."
NCT01643434,1,Resistant Hypertension Optimal Treatment,Multicenter Study of Patients With Hypertension Resistant to Patient Identification and Standardization of Therapeutic,Hypertension;,"Inclusion Criteria          1. Patients aged between 18 and 75          2. With systolic blood pressure> 160 mmHg and <220mmHg and / or diastolic> 100 mmHg in             the sitting position and according to Brazilian Guidelines on Hypertension (perform             steps by obtaining two consecutive measurements differing by less than 4 mmHg between             them, calibrated using a sphygmomanometer)          3. Patient regularly enrolled in participating center        Exclusion criteria          1. Systolic blood pressure> 220 mmHg          2. Patients with cardiovascular events (stroke, AMI, etc.). or cardiovascular procedures             with less than 6 months of evolution          3. Renal stages IV and V (glomerular20 filtration estimated by MDRD formula <30 ml / min;             where MDRD = 186 x (S_Cr) -1.154 x (age) -0.203 x (0.742 if fem.) x (1.210 if             Afro-amer. ))          4. Heart failure class III and IV          5. History of malignant disease with life expectancy < 2 years          6. Alcoholism          7. Psychiatric illnesses that prevent compliance with the Protocol          8. Women of childbearing age who are not in use of effective contraception          9. Pregnancy         10. Arrhythmias, valvular heart disease, AV block 2 and 3 degrees without MP         11. Hepatic impairment         12. Patients with a history of hypersensitivity to any of the drugs under study         13. Examination of the fundus: Grade III and Grade IV","Resistant hypertension (ReHy) is an emerging clinical and public health problem which tends      to increase because populations are living longer and there is a growing global epidemic of      obesity, diabetes and sleep apnea. It is also tempting to speculate that the excessive      dietary salt ingestion reported in many countries can contribute substantially to the risk of      ReHy development. ReHy is defined as persistent high blood pressure (above the target goal)      in spite of the use of at least 3 antihypertensive agents of different classes, one of them      must being diuretics.      Data regarding the exact prevalence of ReHy are very limited. In addition, little data is      available about 3-drug combinations but a simplified treatment algorithm has demonstrated      that a combination of a diuretic plus an angiotensin-converting enzyme inhibitors (ACEi) or      an angiotensin-receptor blocker (ARB) plus diuretic, adding a calcium channel blocker when      necessary, controlled 64% of hypertensive patients and, in addition, was even more efficient      than the current guideline-based management. By contrast, the fourth drug to be added-on the      triple regimen is still controversial and guided by empirical choices or personal      preferences. Recent studies suggest the emerging role of spironolactone as the ""first-line""      fourth drug for treating resistant hypertension. Conversely, because of the      pathophysiological rationale, others have proposed the use of β-blockers or even centrally      acting agents for managing the sympathetic hyperactivity. The present concerns about the      limited blood pressure reducing effect of β-blockers, especially in elderly people, the      potent effect of centrally acting agents and our personal experience are pointing to      clonidine as the fourth drug to be added-on to a multidrug combination for reaching optimal      blood pressure in patients with ReHy. Nevertheless, no studies have been performed comparing,      head-to-head, which one is the best fourth drug (spironolactone or clonidine) to be added-on      to a common used multidrug combination in order to treat this condition.      Therefore, the principal objectives of the ReHOT Trial are to assess prospectively: (1) the      prevalence of ReHy in a cohort of outpatients with stage II hypertension; (2) the effect of      spironolactone on blood pressure, in comparison to clonidine, when added to a multidrug      combination consisting of chlorthalidone plus ACEi (or ARB) plus amlodipine, all of 3      up-titrated to the highest dose; (3) the role of measuring sympathetic nervous system      activity and renin-angiotensin-aldosterone activity on predicting the response of blood      pressure to spironolactone and clonidine.",Resistant Hypertension;,Cardiovascular Diseases;,C0020538;C1514892;C0087111,C0020792;C0020538;C0087111;C1514892;C1550655;C0947630;C1550655,C0003364;C0006684;C0020538;C0014432;C0037982;C0005823;C0005823;C0037982;C0037982;C0005823;C0008294;C0037982;C0699943;C0424295;C0020538;C3539181;C0857121;C0020538;C0020538;C0037315;C0243107;C0003018;C0003018;C0003018;C0002006;C0376636;C0237607;C0018017;C0051696;C1514892;C0012798;C0087111;C0002045;C0282423;C0009014;C0009014;C0012634;C0009014;C0009014;C0011849;C0700287;C0012798;C0012798;C1704632;C0460139;C0033213;C0028754;C0456387;C0040808;C0947630;C0150312;C0947630;C0027769;C3539125;C1518681;C1518681;C3245511;C1518681;C1300072;C0005767;C0037494;C0018017;C3245479;C0013227;C1704326;C0013227;C0013227;C0018670;C0018670;C0013227;C1273517;C1704326;C3539181;C3539181;C3539181;C3539181;C3845947;C4684637;C0776963;C1979715;C1514811;C2911690;C3653883;C1514892;C0449900;C0776963;C0776963;C0776963;C1522411;C0776963;C4697740;C0037816;C1707944;C3272565;C1707944;C1548344;C0201956;C4049938;C4049938;C3834249;C0277785;C0546816,C0020538,C0189573;C0871470;C0488055;C0018824;C1320716;C0948807;C0442867;C0277814;C0183427;C0020517;C0018801;C0700589;C0020538;C1548428;C0003811;C0031809;C0162791;C0001973;C0221423;C0032961;C0450094;C4684790;C0442711;C0004245;C4050001;C1550655;C0262926;C0542560;C0262512;C0038454;C0740422;C0022646;C0456387;C0013227;C0947630;C2948499;C0593946;C1550655;C1550655;C1550655;C4699613;C0332448;C3714738;C0012000;C0238815;C1561542;C1300072;C0016590,C0020538;C1514892,20140701,,,Unknown status,29463627;24338935,7,3.5,0.028322062248558,0.026573656894232,"Patients aged between 18 and 75;;;;;;;;;;With systolic blood pressure> 160 mmHg and <220mmHg and / or diastolic> 100 mmHg in             the sitting position and according to Brazilian Guidelines on Hypertension (perform             steps by obtaining two consecutive measurements differing by less than 4 mmHg between             them, calibrated using a sphygmomanometer);;;;;;;;;;Patient regularly enrolled in participating center","Systolic blood pressure> 220 mmHg;;;;;;;;;;Patients with cardiovascular events (stroke, AMI, etc.). or cardiovascular procedures             with less than 6 months of evolution;;;;;;;;;;Renal stages IV and V (glomerular20 filtration estimated by MDRD formula <30 ml / min;             where MDRD = 186 x (S_Cr) -1.154 x (age) -0.203 x (0.742 if fem.) x (1.210 if             Afro-amer. ));;;;;;;;;;Heart failure class III and IV;;;;;;;;;;History of malignant disease with life expectancy < 2 years;;;;;;;;;;Alcoholism;;;;;;;;;;Psychiatric illnesses that prevent compliance with the Protocol;;;;;;;;;;Women of childbearing age who are not in use of effective contraception;;;;;;;;;;Pregnancy;;;;;;;;;;Arrhythmias, valvular heart disease, AV block 2 and 3 degrees without MP;;;;;;;;;;Hepatic impairment;;;;;;;;;;Patients with a history of hypersensitivity to any of the drugs under study;;;;;;;;;;Examination of the fundus: Grade III and Grade IV"
NCT00797862,0,Aliskiren and the Calcium Channel Blocker Amlodipine Combination as an Initial Treatment Strategy for Hypertension,"A Randomized, 32 Week Double-blind, Parallel-group, Multicenter Study to Compare the Efficacy and Safety of Initiating Treatment With Combination (Aliskiren/Amlodipine) Therapy in Comparison With the Sequential add-on Treatment Strategies in Patients With Essential Hypertension",Hypertension;,"Inclusion Criteria:          -  Male or female outpatients ≥ 18 years of age          -  Participants with essential hypertension:               -  Naive participants must have a mean sitting Systolic Blood Pressure (msSBP) ≥ 150                  mmHg and < 180 mmHg at Visit 1 and Visit 2. (Participants are considered 'naïve'                  if they have never been treated with any antihypertensive medication.)               -  All participants must have a msSBP ≥ 150 mmHg and < 180 mmHg at Visit 2          -  Written informed consent to participate in this study prior to any study procedures        Exclusion Criteria:          -  Severe hypertension          -  Pregnant or nursing (lactating) women          -  Pre-menopausal women not taking accepted form of birth control          -  Serum potassium ≥ 5.5 mEq/L (mmol/L) at Visit 1          -  History of cardiovascular conditions          -  Uncontrolled Type 1 or Type 2 diabetes mellitus          -  Hypersensitivity to renin inhibitors, calcium channel blockers, or to drugs with             similar chemical structures        Other protocol-defined inclusion/exclusion criteria may apply.",This study will compare the safety and efficacy of initial combination treatment with      aliskiren + amlodipine to sequential add-on treatment strategies with aliskiren or amlodipine      in patients with hypertension.,Aliskiren;Amlodipine;Hypertension;SPA1000;Norvasc;,Cardiovascular Diseases;,C0006684;C0020538;C3811910;C0051696;C1120110;C0087111;C0679199,C0085580;C3811910;C0051696;C0087111;C1120110;C0087111;C4554418;C0087111;C0456909;C0947630;C1550655;C0679199;C3897779;C1552839;C0882214,C0020538;C0051696;C0679199;C0087111;C0087111;C1120110;C0947630;C3539181,C0020538,C0011860;C0006684;C0871470;C0085580;C0003364;C0020517;C3887460;C0700589;C0020538;C0013227;C0025320;C0032821;C0549206;C0442711;C0277814;C0028678;C0262926;C0205082;C4085651;C0947630;C0947630;C0229671;C0013227;C1546725;C0220807;C0184661;C0012634;C0009797;C1960108;C4684637;C2828358;C1512346;C1512346;C1512346;C4331837;C1512346;C0332155;C0452376,,20101101,867,53621,Completed,26489809;21236483,43,21.5,0.019052624906767,0.026337286558582,Male or female outpatients ΓëÑ 18 years of age;;;;;;;;;;Participants with essential hypertension:;;;;;;;;;;Naive participants must have a mean sitting Systolic Blood Pressure (msSBP) ΓëÑ 150                  mmHg and < 180 mmHg at Visit 1 and Visit 2. (Participants are considered 'na├»ve'                  if they have never been treated with any antihypertensive medication.);;;;;;;;;;All participants must have a msSBP ΓëÑ 150 mmHg and < 180 mmHg at Visit 2;;;;;;;;;;Written informed consent to participate in this study prior to any study procedures,"Pregnant or nursing (lactating) women;;;;;;;;;;Pre-menopausal women not taking accepted form of birth control;;;;;;;;;;Serum potassium ΓëÑ 5.5 mEq/L (mmol/L) at Visit 1;;;;;;;;;;History of cardiovascular conditions;;;;;;;;;;Uncontrolled Type 1 or Type 2 diabetes mellitus;;;;;;;;;;Hypersensitivity to renin inhibitors, calcium channel blockers, or to drugs with             similar chemical structures        Other protocol-defined inclusion/exclusion criteria may apply."
