nct_id,relevance,brief_title,official_title,conditions_list,eligibility_criteria,description,keywords_list,Diseases,brief_title_concepts_list,official_title_concepts_list,brief_summary_concepts_list,conditions_list_concepts_list,eligibilities_concepts_list,keywords_list_concepts_list,CompletionDate,tot_subj_affected,tot_subj_risk,Status,pubmed_ids,citationSum,citationAvg,briefTitlePageRankScore,briefTitleAndSummaryCombinedPageRankScore,inclusion,exclusion
NCT01118286,1,Treatment of Hypertension With Adalat® in Combination With Other Drugs,AdADOSE - Antihypertensive Treatment With Adalat® in Different Doses and Combination Therapy,Hypertension;,Inclusion Criteria:          -  Previously untreated hypertensive patients starting with combination therapy             containing nifedipine or          -  Insufficiently controlled hypertensive pts. receiving nifedipine as an add-on to             existing non-CCB (calcium-channel-blocker) containing antihypertensive therapy        Exclusion Criteria:          -  None. Exclusion criteria are defined by contraindications and precautions as stated in             the local product information.,To investigate the therapeutic effectiveness of long acting nifedipine containing combination      therapy in the treatment of hypertensive patients.,"Hypertension;Drug therapy, combination;",Cardiovascular Diseases;,C0020538;C3811910;C0087111;C0590658;C1546725;C0013227,C0009429;C0087111;C0590658;C0003364,C4553491;C0857121;C0028066;C0087111;C0087111;C0087111;C3539181,C0020538,C0585941;C0009429;C0687678;C0857121;C0857121;C0028066;C0028066;C0332155;C0006675;C1550083;C0175556;C1301624;C4684637;C2911690,C0087111;C3539181,20110901,,,Completed,25956918,3,3,0.019518887742446,0.022319512249693,Previously untreated hypertensive patients starting with combination therapy             containing nifedipine or;;;;;;;;;;Insufficiently controlled hypertensive pts. receiving nifedipine as an add-on to             existing non-CCB (calcium-channel-blocker) containing antihypertensive therapy,None. Exclusion criteria are defined by contraindications and precautions as stated in             the local product information.
NCT01850901,1,Renal Sympathetic Denervation as a New Treatment for Therapy Resistant Hypertension,Renal Sympathetic Denervation as a New Treatment for Therapy Resistant Hypertension - A Multicenter Randomized Controlled Trial,"Hypertension;Kidney Diseases;Renal Insufficiency, Chronic;","Inclusion Criteria:          1. Individual has a mean day-time SBP ≥ 135 mmHg, as determined with the use of ABPM,             while using 3 or more antihypertensive agents for at least 3 months prior to inclusion             or with documented intolerance to 2 or more of the 4 major classes antihypertensive             drugs ( ACE/ARB, Calcium channel blocker, Beta Blocker, Diuretic) and no possibility             to take 3 anti-hypertensive drugs.          2. Individual is ≥18 years of age.        Exclusion Criteria:          1. Individual is unable or unwilling to sign informed consent.          2. Individual has a treatable secondary cause of hypertension.          3. Individual has an eGFR below 20 mL/min/1.73m2 using the Modification of Diet in Renal             Disease (MDRD) calculation.          4. Individual has renal artery anatomy that is ineligible for treatment          5. Individual has any serious medical condition, which in the opinion of the             investigator, may adversely affect the safety and/or effectiveness of the participant             or the study.          6. Individual is pregnant, nursing or planning to be pregnant.          7. Individual has a known, unresolved history of drug use or alcohol dependency, lacks             the ability to comprehend or follow instructions, or would be unlikely or unable to             comply with study follow-up requirements.          8. Individual is currently enrolled in another investigational drug or device trial.","The aim of this study is to assess whether renal denervation (RD) added to usual care      compared to usual care alone reduces blood pressure (BP) as determined with ambulatory BP      monitoring (ABPM) after 6 months in subjects with an average day-time systolic BP of at least      135 mmHg as determined with use of ABPM, despite use of three or more BP lowering agents or      with documented intolerance or contraindication for to 2 or more of the 4 major classes of      antihypertensive drugs (ACEi/ARB, calcium channel blockers, betablockers and diuretics)      obstructing use of 3 antihypertensives      Further aims are to assess the effect of renal denervation on the use of BP lowering agents,      to explore the effect of renal denervation in strata of estimated glomerular filtration rate      (eGFR) (eGFR 20-60 mL/min per 1.73m2 and eGFR>60 mL/min per 1.73m2) and according to baseline      office BP.      Randomization will be stratified by hospital and eGFR and will be at a 2:1 ratio.",Hypertension;Renal denervation;Sympathetic denervation;,Male Urogenital Diseases;Cardiovascular Diseases;Female Urogenital Diseases and Pregnancy Complications;,C0039038;C0020538;C0087111;C1514892;C0087111;C0022646,C1096777;C0039038;C0020538;C0087111;C1514892;C0087111;C0022646,C0017654;C0006684;C0003364;C0003364;C1301624;C0005823;C0011307;C0231199;C0011307;C0011307;C1561560;C0150369;C1301725;C0012798;C0456387;C1518681;C1518681;C0947630;C0022646;C0439044;C0022646;C0022646;C3811844;C3811844;C3811844;C1561538;C1820370;C1820370;C0180799;C4082977;C4082977;C1561542;C0776963;C1995642;C0728774,C1547296,C0003364;C0003364;C0013230;C0001973;C0003364;C0870261;C4553491;C0001645;C0020538;C3840684;C0035065;C0302828;C0231199;C1301725;C0027627;C0087111;C0012634;C0012798;C0549206;C0032074;C0549206;C0242510;C4684790;C0456387;C0006675;C0012634;C0028678;C0262512;C0566415;C0001721;C0566415;C0725694;C0013227;C0022646;C0947630;C0947630;C3811844;C0012159;C1561538;C1306620;C1273101;C0009797;C4082977;C3845732;C1561542;C4331837;C0018792;C4284141;C0600109;C0750558,C0011307,20161201,,,Completed,28264922;24576513,10,5,0.020925884445987,0.022051531834474,"Individual has a mean day-time SBP ΓëÑ 135 mmHg, as determined with the use of ABPM,             while using 3 or more antihypertensive agents for at least 3 months prior to inclusion             or with documented intolerance to 2 or more of the 4 major classes antihypertensive             drugs ( ACE/ARB, Calcium channel blocker, Beta Blocker, Diuretic) and no possibility             to take 3 anti-hypertensive drugs.;;;;;;;;;;Individual is ΓëÑ18 years of age.","Individual is unable or unwilling to sign informed consent.;;;;;;;;;;Individual has a treatable secondary cause of hypertension.;;;;;;;;;;Individual has an eGFR below 20 mL/min/1.73m2 using the Modification of Diet in Renal             Disease (MDRD) calculation.;;;;;;;;;;Individual has renal artery anatomy that is ineligible for treatment;;;;;;;;;;Individual has any serious medical condition, which in the opinion of the             investigator, may adversely affect the safety and/or effectiveness of the participant             or the study.;;;;;;;;;;Individual is pregnant, nursing or planning to be pregnant.;;;;;;;;;;Individual has a known, unresolved history of drug use or alcohol dependency, lacks             the ability to comprehend or follow instructions, or would be unlikely or unable to             comply with study follow-up requirements.;;;;;;;;;;Individual is currently enrolled in another investigational drug or device trial."
NCT00325403,0,FREEDOM - M: Oral Treprostinil as Monotherapy for the Treatment of Pulmonary Arterial Hypertension (PAH),"A 12-Week, International, Multicenter, Double-Blind, Randomized, Placebo-Controlled Comparison of the Efficacy and Safety of Oral UT-15C Sustained Release Tablets in Subjects With Pulmonary Arterial Hypertension","Hypertension;Hypertension, Pulmonary;Familial Primary Pulmonary Hypertension;","Inclusion Criteria:          -  Between 12 and 75 years of age, inclusive.          -  Body weight at least 40 kg with a Body Mass Index < 45          -  PAH that is either idiopathic/heritable; associated with repaired congenital             systemic-to-pulmonary shunts (repaired ≥ 5 years); associated with collagen vascular             disease; associated with HIV.          -  Previous testing (e.g., right heart catheterization, echocardiography) consistent with             the diagnosis of PAH.          -  Baseline 6-minute walk distance between 200 and 425 meters, inclusive.          -  Reliable and cooperative with protocol requirements.        Exclusion Criteria:          -  Nursing or pregnant.          -  Currently receiving an endothelin receptor antagonist, a phosphodiesterase-5             inhibitor, or prostacyclin within 30 days of Baseline.          -  PAH due to conditions other than noted in the above inclusion criteria.          -  History of uncontrolled sleep apnea, renal insufficiency, anemia, left sided heart             disease, uncontrolled systemic hypertension, or parenchymal lung disease.          -  Use of an investigational drug within 30 days of Baseline.","This study was an international, multicenter, randomized (2:1 active:placebo), double-blind,      placebo-controlled study in subjects with PAH who were NOT currently receiving approved      therapy for their PAH. Study visits occurred at 4 week intervals for 12 weeks (with an      additional visit at Week 11) with the key measure of efficacy being the 6-minute walk test.      Study procedures included routine blood tests, medical history, physical exams, disease      evaluation, and exercise tests. Two optional substudies were also a part of FREEDOM-M at      select centers - a hemodynamic substudy with a right heart catheterization at Baseline and      Week 12 and a genetics and biomarkers substudy with blood samples collected at Baseline and      Week 12.      Patients who completed all assessments for 12 weeks were also eligible to enter an      open-label, extension phase study (FREEDOM - EXT).",Pulmonary Arterial Hypertension;,Cardiovascular Diseases;Respiratory Tract Diseases;,C1145760;C0020538;C0087111;C2707265;C0003842,C0020538;C2911690;C2707265;C0003842;C0032042;C0030685;C0456909;C3897779;C0882214;C2732140,C0189896;C0599724;C0430515;C0262926;C0015260;C0178913;C0018941;C4281788;C1261322;C0220825;C0005516;C0032042;C0087111;C0012634;C0947630;C0456909;C0947630;C1512346;C0947630;C1705425;C0947630;C1561540;C0031809;C0184661;C1550655;C1320102;C1525442;C1512346;C3810851;C0728774;C0728774;C0429028,C0152171;C0340543,C1134681;C0189896;C0020538;C0013230;C1565489;C0013516;C0578022;C0033567;C0024115;C0944911;C0037315;C0024109;C0011900;C0009325;C0005847;C0442711;C0549206;C0012634;C0392366;C0006147;C0262926;C0012634;C0441074;C0002871;C0018787;C0933845;C0012634;C0429886;C3842337;C3842337;C4086543;C0542331;C4284141;C0728774;C3858758;C0728774;C0728774;C0069695,C0020538;C2707265;C0003842,20110401,961,15732,Completed,23307827,57,57,0.02171364432511,0.021889893123335,"Between 12 and 75 years of age, inclusive.;;;;;;;;;;Body weight at least 40 kg with a Body Mass Index < 45;;;;;;;;;;PAH that is either idiopathic/heritable; associated with repaired congenital             systemic-to-pulmonary shunts (repaired ΓëÑ 5 years); associated with collagen vascular             disease; associated with HIV.;;;;;;;;;;Previous testing (e.g., right heart catheterization, echocardiography) consistent with             the diagnosis of PAH.;;;;;;;;;;Baseline 6-minute walk distance between 200 and 425 meters, inclusive.;;;;;;;;;;Reliable and cooperative with protocol requirements.","Currently receiving an endothelin receptor antagonist, a phosphodiesterase-5             inhibitor, or prostacyclin within 30 days of Baseline.;;;;;;;;;;PAH due to conditions other than noted in the above inclusion criteria.;;;;;;;;;;History of uncontrolled sleep apnea, renal insufficiency, anemia, left sided heart             disease, uncontrolled systemic hypertension, or parenchymal lung disease.;;;;;;;;;;Use of an investigational drug within 30 days of Baseline."
NCT02167464,1,Controlling Blood Pressure in Treatment Resistant Hypertension: A Pilot Study,Controlling Blood Pressure in Treatment Resistant Hypertension: A Pilot Study,Hypertension;,Inclusion Criteria:          -  Clinical diagnosis of Treatment Resistant Hypertension (TRH)          -  On three or more hypertensive medications at therapeutic dose          -  BpTRU measurement on two occasions of >135/85 without diabetes or chronic kidney             disease or BP >125/75 if diabetes and/or chronic kidney disease.          -  Mean of >10 BP readings of >135/85 mm mercury for those with no diabetes or chronic             kidney disease          -  Mean of >10 home BP readings of >125/75 mm mercury for those with diabetes and/or             chronic kidney disease.        Exclusion Criteria:          -  Less than 18 years of age          -  Refuses or incompetent to provide consent          -  BP controlled to goal in or outside the clinic          -  Symptomatic or significant orthostatic hypotension (<20/10 on standing)          -  Life-threatening or severe illness          -  Currently on protocol          -  Myocardial Infarction or stroke in the past 6 months          -  Estimated Glomerular Filtration Rate <50 ml/1.7/min.,"Comparative Effectiveness Research using an intent-to-treat approach in 8 clinics in South      Carolina. The investigators will assess 4 efficacious approaches to controlling      treatment-resistant hypertension (TRH): Aldosterone Antagonist, Referral to Hypertension      Specialist, Renin Treatment-Guided Therapeutics, and combination of Hypertension Specialist      and Renin Treatment-Guided Therapeutics. Patients with TRH are evaluated with the BpTRU      device for an accurate and representative blood pressure measure on two occasions before      entry into the study. Qualitative data from focus group discussions with practice staff, and      patient surveys and interviews will provide contextual data to help explain why some      interventions are more acceptable and successful than others.",Hypertension;,Cardiovascular Diseases;,C0005823;C0020538;C0087111;C1514892;C0947630,C0005823;C0020538;C0087111;C1514892;C0947630,C3536833;C0005823;C4553491;C0886296;C0020538;C0020538;C0087111;C0020538;C0087111;C0557061;C0087111;C0087111;C0087111;C0034927;C0237607;C0162425;C3539125;C0373719;C0373719;C0947630;C1551040;C3245479;C3245479;C1552861;C0040162;C0040162;C3539181;C0935630;C1550655;C1555587;C0038951;C1514892;C0220825;C0302614;C0302614;C1552839,C0020538,C3811844;C0684167;C0020651;C0027051;C0022658;C0022658;C0022658;C0020538;C0011900;C0087111;C1514892;C3272565;C0011849;C0011849;C0011849;C0011849;C0442711;C0012634;C0221423;C0022646;C0205082;C0038454;C0018017;C0040162;C3843766;C0087111;C1555587;C2911690;C0202165;C4300452;C1630409;C1561542;C0231189;C0231221,C0020538,20150101,,,Completed,27076600,0,0,0.022164772459133,0.02168479487774,Clinical diagnosis of Treatment Resistant Hypertension (TRH);;;;;;;;;;On three or more hypertensive medications at therapeutic dose;;;;;;;;;;BpTRU measurement on two occasions of >135/85 without diabetes or chronic kidney             disease or BP >125/75 if diabetes and/or chronic kidney disease.;;;;;;;;;;Mean of >10 BP readings of >135/85 mm mercury for those with no diabetes or chronic             kidney disease;;;;;;;;;;Mean of >10 home BP readings of >125/75 mm mercury for those with diabetes and/or             chronic kidney disease.,Refuses or incompetent to provide consent;;;;;;;;;;BP controlled to goal in or outside the clinic;;;;;;;;;;Symptomatic or significant orthostatic hypotension (<20/10 on standing);;;;;;;;;;Life-threatening or severe illness;;;;;;;;;;Currently on protocol;;;;;;;;;;Myocardial Infarction or stroke in the past 6 months;;;;;;;;;;Estimated Glomerular Filtration Rate <50 ml/1.7/min.
NCT01240512,1,DAYLIGHT: Vitamin D Therapy in Individuals at High Risk of Hypertension,Daylight: The Effect of Vitamin D Supplementation on Blood Pressure in Vitamin D Deficient Individuals With Pre-Hypertension,Hypertension;Vitamin D Deficiency;Prehypertension;,"Inclusion Criteria:          -  Males or females 18 to 50 years of age          -  Systolic blood pressure of 120 to 159 mmHg and Diastolic blood pressure ≤99 mmHg          -  Vitamin D deficiency, defined as 25-hydroxyvitamin D <25 ng/ml          -  No use of any anti-hypertensive medication in last 3 months or anticipated or planned             use in next 6 months          -  No use of vitamin D supplementation in last 3 months, defined as vitamin D found in a             multivitamin or supplement totaling >400 IU per day or anticipated or planned use in             next 6 months        Exclusion Criteria:          -  Use of any anti-hypertensive medication in last 3 months or anticipated or planned use             in next 6 months          -  Use of vitamin D supplementation in last 3 months, defined as vitamin D found in a             multivitamin or supplement totaling >400 IU per day or anticipated or planned use in             next 6 months          -  Use of St. John's wart, rifampin, any treatment for HIV, orlistat, oral             glucocorticoids, phenobarbital, phenytoin, mineral oil, or bile acid sequestrants in             the last 3 months or anticipated or planned use in next 6 months          -  Female who is pregnant, nursing, or of childbearing potential and planning or             anticipating pregnancy in next 6 months          -  History of diabetes mellitus (including Type 1, Type 2 and diet controlled)          -  Serum creatinine >2.0 mg/dl or estimated Glomerular Filtration Rate (GFR) <30 ml/min          -  Calcium >10.0 mg/dl or phosphorus >5 mg/dl          -  History of kidney stones          -  Body mass index >38 kg/m2          -  Known cardiovascular disease: defined as prior myocardial infarction, percutaneous             transluminal coronary angioplasty, coronary artery bypass or stroke          -  History of cirrhosis or severe liver disease (defined as history of GI bleeding from             liver disease, jaundice or ascites)          -  Current heavy alcohol use: defined as drinking 5 or more drinks per occasion on 5 or             more days in the past 30 days          -  History of ulcerative colitis, Crohn's disease, celiac disease, colostomy, pancreatic             enzyme deficiency, short bowel syndrome, gastric bypass, cystic fibrosis, or dumping             syndrome.          -  Allergy to coconut          -  Regular use or planned use of artificial tanning lights in next 6 months          -  Use of any investigational product or device in last 3 months or planned use in next 6             months          -  Any condition which could limit the ability to complete and comply with 6-month follow             up          -  Unwillingness or inability to comply with study requirements          -  Inability to provide informed consent","This is a randomized, double-blind, multicenter, 6-month follow-up trial of low (400 IU/day)      versus high (4000 IU/day) dose vitamin D supplementation in individuals with pre- and early      stage 1 hypertension and vitamin D deficiency. A total of 530 participants (265 participants      per treatment arm) will be randomized between 3 sites. Approximately 2,250 participants will      be screened between the 3 sites. Vital signs, 24-hour ambulatory blood pressure monitoring,      clinical laboratory safety tests and adverse event assessments will be performed to evaluate      the effectiveness of the two doses of vitamin D on blood pressure. Blood samples will be      stored for future biomarker assessments. The total duration of the study is anticipated to be      18 months, assuming a 12 month enrollment period.",,Cardiovascular Diseases;Nutritional and Metabolic Diseases;,C0020538;C0014695;C0332167;C0087111,C1696708;C0242297;C0005823;C0014695;C0014695,C0855316;C0042870;C0242297;C0005823;C0877248;C4553491;C0020538;C0488614;C1261322;C1261322;C0150369;C1516879;C0042866;C0087111;C0042866;C0005516;C0025344;C0456909;C1300072;C0392366;C0005767;C0947630;C1561542;C1550472;C1561538;C1561538;C0446516;C3840775;C0022885;C0332534;C1561542;C0018792;C3272565;C0220825,,C0017654;C0428883;C0488055;C0684167;C0684167;C0007222;C0010055;C0027051;C0042870;C0002997;C0036992;C0009324;C0011849;C0687132;C0149676;C0242297;C0242297;C0743195;C0005893;C0010346;C0010674;C3245491;C0007570;C0017125;C0031412;C0022650;C0023895;C0023895;C0301532;C0301532;C0026156;C0017181;C0030274;C0042866;C0042866;C0042866;C0042866;C0087111;C0031507;C0032961;C0023890;C0009410;C0012634;C0035608;C0076275;C0549206;C0032074;C0022346;C0684271;C0039082;C0028678;C0262926;C0006675;C0262926;C0262926;C0262512;C0003962;C0262926;C0221542;C0020517;C2722035;C4085651;C4085652;C0038454;C0205082;C0725694;C0725694;C0229671;C0947630;C3665596;C0005388;C1561538;C1561538;C0017654;C0523826;C3540777;C0006657;C1555587;C0009797;C3840775;C3840775;C3840775;C3840775;C3840775;C4684637;C4684637;C4684637;C4684637;C4684637;C4684637;C3842337;C0039294;C0275586;C1947943;C1947943;C0201975;C2917337;C1561542;C1561542;C1561542;C1561542;C1561542;C1561542;C1561542;C1561542;C1561542;C1561542;C1561542;C1561542;C1561542;C1561542;C4331837;C4284141;C4283785;C4698437;C4698437;C4698437;C4698437;C4698437;C4698437;C4698437,C1140111,20131001,,,Completed,26451070;25359163,29,14.5,0.021883787255421,0.021340827329675,"Males or females 18 to 50 years of age;;;;;;;;;;Systolic blood pressure of 120 to 159 mmHg and Diastolic blood pressure Γëñ99 mmHg;;;;;;;;;;Vitamin D deficiency, defined as 25-hydroxyvitamin D <25 ng/ml;;;;;;;;;;No use of any anti-hypertensive medication in last 3 months or anticipated or planned             use in next 6 months;;;;;;;;;;No use of vitamin D supplementation in last 3 months, defined as vitamin D found in a             multivitamin or supplement totaling >400 IU per day or anticipated or planned use in             next 6 months","Use of vitamin D supplementation in last 3 months, defined as vitamin D found in a             multivitamin or supplement totaling >400 IU per day or anticipated or planned use in             next 6 months;;;;;;;;;;Use of St. John's wart, rifampin, any treatment for HIV, orlistat, oral             glucocorticoids, phenobarbital, phenytoin, mineral oil, or bile acid sequestrants in             the last 3 months or anticipated or planned use in next 6 months;;;;;;;;;;Female who is pregnant, nursing, or of childbearing potential and planning or             anticipating pregnancy in next 6 months;;;;;;;;;;History of diabetes mellitus (including Type 1, Type 2 and diet controlled);;;;;;;;;;Serum creatinine >2.0 mg/dl or estimated Glomerular Filtration Rate (GFR) <30 ml/min;;;;;;;;;;Calcium >10.0 mg/dl or phosphorus >5 mg/dl;;;;;;;;;;History of kidney stones;;;;;;;;;;Body mass index >38 kg/m2;;;;;;;;;;Known cardiovascular disease: defined as prior myocardial infarction, percutaneous             transluminal coronary angioplasty, coronary artery bypass or stroke;;;;;;;;;;History of cirrhosis or severe liver disease (defined as history of GI bleeding from             liver disease, jaundice or ascites);;;;;;;;;;Current heavy alcohol use: defined as drinking 5 or more drinks per occasion on 5 or             more days in the past 30 days;;;;;;;;;;History of ulcerative colitis, Crohn's disease, celiac disease, colostomy, pancreatic             enzyme deficiency, short bowel syndrome, gastric bypass, cystic fibrosis, or dumping             syndrome.;;;;;;;;;;Allergy to coconut;;;;;;;;;;Regular use or planned use of artificial tanning lights in next 6 months;;;;;;;;;;Use of any investigational product or device in last 3 months or planned use in next 6             months;;;;;;;;;;Any condition which could limit the ability to complete and comply with 6-month follow             up;;;;;;;;;;Unwillingness or inability to comply with study requirements;;;;;;;;;;Inability to provide informed consent"
