nct_id,brief_title,description,brief_title_concepts_list,brief_summary_concepts_list,tot_subj_affected,tot_subj_risk,relevance,citationSum,citationAvg,briefTitlePageRankScore,briefTitleAndSummaryCombinedPageRankScore,brief_title_matched_count,brief_summary_matched_count,RRFscore_not_recency
NCT00663702,Phase IIIB Switching From Intravenous to Subcutaneous Study,~     The purpose of this study is to determine whether switching to subcutaneous administration of~     abatacept will be safe in participants with rheumatoid arthritis who previously received~     long-term therapy with intravenous abatacept~   ,0,C0003873;C1619966;C1619966;C3845829,475,9225,-1,9,9,0.000232342,0.002725774,0,0,0.009811892
NCT02874287,Efficacy Study of Hydroxychloroquine to Treat High-risk Coronary Artery Disease.,~     The purpose of this study is to evaluate whether treated with hydroxychloroquine could~     improve therapeutic effect for patients with high-risk coronary artery disease.~   ,C1956346,C1527144;C0205042;C0184511;C0012634,0,0,-1,0,0,0.000912548,0.000835551,0,0,0.009800413
NCT00451971,Objective Study in Rheumatoid Arthritis,"Primary Objectives        1. To test the feasibility, in patients with active rheumatoid arthritis, of using an           'aggressive' treatment algorithm to bring a short term treatment objective (STO) within           the normal or an arbitrarily defined 'desirable' range.        2. To determine whether patients with active rheumatoid arthritis randomly allocated to a           particular STO show a reduced rate of Magnetic resonance imaging damage progression at           two years compared to those randomly allocated to usual care.      Secondary Objectives        1. To establish the relationship between achieving a given STO or combination of STOs and           damage progression.        2. To identify the characteristics of responders and non-responders with respect to STO           achievement and predictors of greater and lesser degrees of damage progression.",C0003873;C0018017;C0947630,C0024485;C0003873;C0003873;C0242656;C0242656;C0242656;C0087111;C0002045;C0087111;C0018017;C0542560;C1553386;C0010957;C0010957;C0010957;C3244317;C0392366;C3539181;C0018017;C0018017;C4684637;C1320102;C1320102;C1547300;C0022396;C0027627;C3858576;C2702329;C4082977,0,0,0,0,0,0.002837956,0.002068929,0,0,0.009772772
NCT00988780,Maraviroc (CCR5) Antagonism to Decrease the Incidence of the Immune Reconstitution Inflammatory Syndrome in HIV-Infected Patients,~     The purpose of this study is to determine if Maraviroc administration can decrease IRIS~     incidence in HIV infected patients initiating ARV therapy.~   ,C1619738;C0439663,C0439663;C3845829,0,0,-1,22,11,0.00232342,0.000461195,0,0,0.009757009
NCT01543503,An Global Comparative Observational Study of RoActemra/Actemra (Tocilizumab) in Patients With Rheumatoid Arthritis,"This prospective, multi-center, observational study will assess the efficacy and safety of      treatment in patients who are treated with a TNF Inhibitor or RoActemra/Actemra (tocilizumab)      as the first biologic therapy. Data will be collected for 52 weeks.",C0003873;C1964257;C1609165;C3272237;C2740854;C0947630;C1550655,C0005527;C1609165;C0087111;C3272237;C2740854;C0947630;C1964257;C0404831;C0332155;C4553183,1056,131328,0,6,6,0.002481144,0.002270331,0,0,0.009710865
NCT00475111,Cognitive Behavioral Therapy Treatments for Adults With Rheumatoid Arthritis (The SARA Study),"Rheumatoid arthritis (RA) is an autoimmune disease that causes long-term inflammation of the      joints and occasionally, other body tissues. The purpose of this study is to evaluate two      different types of cognitive behavioral therapy (CBT) in reducing RA disease activity and      improving mental health of adults with RA.",C0009244;C0003873;C0087111;C0947630,C0009244;C0003873;C0004364;C0025353;C0021368;C0012634;C0947630;C0220825;C4049938,0,0,0,97,48.5,0.002590569,0.002663794,0,0,0.009686879
NCT00642629,"A Randomized, Double-blind, Placebo-controlled Clinical Study of the Oral IL-12/23 Inhibitor, STA-5326 Mesylate, Administered to Patients With Rheumatoid Arthritis to Determine Safety, Tolerability, Pharmacokinetic and Synovial Tissue Outcomes","It is not fully clear how rheumatoid arthritis originates and develops, but it is understood      that multiple genetic and environmental factors interact to trigger its onset. The immune      system attacks the joint synovium, which damages the cartilage and bone in the joint by      increasing the number of inflammatory cells and forming new blood vessels in the joint space.      STA-5326 mesylate inhibits the production of IL-12 and IL-23 and therefore may inhibit Th-1      cytokine production. A reduction in the Th-1 response has the potential to minimize or      eliminate joint damage caused by the immune response in rheumatoid arthritis. This study is      designed to assess whether the proposed mechanism of action is associated with a reduction in      inflammation in the synovium of patients who have rheumatoid arthritis.",C0003873;C3272565;C1550315;C0032042;C1547928;C0456909;C0947630;C0031327;C1550655;C2911690;C3897779;C4553183,C1516998;C0003873;C0003873;C0003873;C1327413;C0031327;C0005847;C0021368;C4551656;C4551656;C0039099;C1704632;C1704632;C0039099;C0032930;C1304680;C0010957;C0439662;C0010957;C0439662;C0123759;C0947630;C0262950;C1578513;C4693090;C0035150;C0162340;C0221874;C0221106;C0700287;C4305637,0,0,0,11,11,0.002370914,0.002105005,0,0,0.009675425
NCT00779220,"A Study to Evaluate the Efficacy, Safety and Pharmacokinetics/Pharmacodynamics (PK/PD) of Ocrelizumab in Patients With Rheumatoid Arthritis","This study will evaluate the efficacy, safety and PK/PD of ocrelizumab at each dose in      combination with methotrexate???MTX???in patients with active rheumatoid arthritis (RA). The data      from this study will also be compared with those from a clinical study of ocrelizumab in      patients with active RA that was conducted in the U.S.",C0003873;C0031327;C1882138;C0220825;C0947630;C1550655,C0003873;C1882138;C1882138;C0947630;C0947630;C0947630;C3245479;C3539181;C1320102;C1320102;C0220825;C3272565,0,0,0,8,8,0.002567615,0.00282471,0,0,0.009663213
NCT00674362,Rheumatoid Arthritis (RA) Moderate to Low Disease Activity Study,To assess the clinical efficacy and safety of certolizumab pegol as add-on therapy with      stable-dose disease-modifying antirheumatic drugs (DMARDs) for achieving clinical remission      in patients with moderate to low disease activity rheumatoid arthritis,C0003873;C1547226;C4049938;C0012634;C0947630;C4321351,C0003873;C0003191;C1872109;C0544452;C0087111;C0012634;C0012634;C1550472;C1706074;C0242708;C3272565;C3272565;C1547226;C4049938,186,5304,0,13,13,0.002188534,0.002344156,0,0,0.009603758
NCT00595413,Atacicept in Anti-Tumor Necrosis Factor Alpha-na??ve Subjects With Rheumatoid Arthritis (AUGUST II),"The primary objective of this study is to evaluate the efficacy of atacicept compared to      placebo in the treatment of signs and symptoms in a subject population with active rheumatoid      arthritis (RA), inadequate response to methotrexate (MTX) and no previous exposure to      anti-tumor necrosis factor alpha (anti-TNFalpha) therapy.",C1168005;C0003873;C0439095,C1623145;C0333516;C0018017;C0087111;C0003864;C0274281;C0032042;C0087111;C0947630;C0439095;C0025677;C0424818;C1320102;C0220825,265,10263,1,32,32,0.001969105,0.002708293,0,0,0.009591257
NCT00578305,A Study of Rituximab (MabThera??/Rituxan??) in Patients With Rheumatoid Arthritis and Inadequate Response to Methotrexate,"This 3 arm study assessed the efficacy of rituximab (MabThera??/Rituxan??) in the prevention of      progression of structural joint damage in participants with active rheumatoid arthritis who      had an inadequate clinical response to methotrexate. Participants were randomized to receive      rituximab 500 mg intravenously (iv), rituximab 1000 mg iv, or placebo iv on days 1 and 15      every 24 weeks in the main study; all participants received concomitant methotrexate at a      stable dose of 12.5-25 mg/week throughout the study. Further courses of rituximab were      provided to eligible participants. Structural joint damage was assessed by magnetic resonance      imaging (MRI) at baseline and at intervals during the study.",C0003873;C0025677;C0393022;C1314901;C1704632;C0947630;C0732355;C1550655,C1623145;C0003873;C0025677;C0242656;C0199176;C0393022;C0393022;C0393022;C0393022;C0231881;C1314901;C0032042;C0079595;C0010957;C0010957;C0947630;C0947630;C0947630;C0947630;C1561540;C0446516;C0732355;C1320102;C1706074;C3272565;C4086490;C1555587;C0728774;C4699193;C0429028,186,18544,0,6,6,0.002632011,0.002490691,0,0,0.009567986
NCT01709578,To Evaluate The Effect Of SAR153191 (REGN88) Added To Other RA Drugs In Patients With RA Who Are Not Responding To Or Intolerant Of Anti-TNF Therapy (SARIL-RA-TARGET),"~     Primary Objective:~      To demonstrate that sarilumab added to disease modifying anti-rheumatic drugs (DMARDs) were~     effective for:~        -  reduction of signs and symptoms at Week 24 and~        -  improvement of physical function at Week 12~      in participants with active rheumatoid arthritis (RA) who were inadequate responders or~     intolerant to tumor necrosis factor alpha (TNF-??) antagonists.~      Secondary Objectives:~      The secondary objectives were to investigate the effects of SAR153191 (REGN88) when added to~     DMARD therapy, in participants with active RA who were inadequate responders or intolerant to~     TNF-?? antagonists, for:~        -  Reduction of signs and symptoms at Week 12;~        -  Improvement in physical function at Week 24;~        -  Improvement in disease activity score as measured by other American College of~          Rheumatology (ACR) derived components at Weeks 12 and 24;~        -  Improvement in quality of life as measured by participant reported outcomes (PROs) at~          intermediate visits and Week 24.~      To assess the exposure of sarilumab added to DMARD therapy in this population.~      To assess the safety of sarilumab in this population.~   ",C3687832,C0003873;C0037088;C0037088;C0516981;C0516981;C0012634;C0012634;C3687832;C2003941;C1320102;C1320102;C3165543;C3537192,353,18564,-1,45,22.5,0.000484966,0.001718771,0,0,0.009548322
NCT03396315,Bisphosphonates for Prevention of Post-Denosumab Bone Loss,"~     The primary goal of the study is to assess the extent to which bisphosphonate therapy will~     prevent decreases in bone mass that may occur after cessation of denosumab in premenopausal~     women with idiopathic osteoporosis (IOP) enrolled in AAAN0161 (FD05114) Denosumab for the~     prevention of post-teriparatide bone loss in premenopausal women with idiopathic~     osteoporosis.~      In addition, the investigator will observe participants for a second year off bisphosphonate~     therapy to assess duration of response.~      The hypothesis is that bisphosphonate therapy with alendronate or zoledronic acid, initiated~     after recovery of bone remodeling activity, will prevent significant bone loss after~     discontinuing denosumab.~   ",C1690432;C0012544,C0257685;C0029456;C0070093;C0102118;C1690432;C1690432;C2926735;C2004454;C0029456;C1690432;C0206158;C0012544;C0012544,0,0,-1,0,0,0.000713123,0.00051269,0,0,0.009537822
NCT03345212,A Randomized Controlled Multicenter Trial of Exercise Training in Pulmonary Hypertension in European Countries,"~     Chronic pulmonary hypertension (PH) is associated with impaired exercise capacity, quality of~     life and right ventricular function. The disease is characterized by an increase of pulmonary~     vascular resistance and pulmonary arterial pressure, leading to right heart insufficiency.~      Despite optimized combination-medical therapy most patients remain symptomatic, have reduced~     exercise capacity, quality of life and reduced survival rates, with an annual mortality rate~     of approximately 5 -15 % or even higher.~      Previous training studies have suggested that exercise training as add-on to medical~     treatment is highly effective improving exercise capacity, quality of life and symptoms.~      The current guidelines recommend exercise training only in specialized centres including both~     PH and rehabilitation specialists who are experienced in exercise training of severely~     compromised patients.~      A specialized PH-training program has been performed in Heidelberg since 2003 including >1200~     patients with various forms of chronic PH. The exercise training program is performed in a~     special setting with an in-hospital start of the rehabilitation program. It is characterized~     by a low-dose closely supervised exercise training in small groups with additional~     psychological support and mental training.~      This training program for patients with PH will be implemented in European centers to add~     exercise training to the existing PH therapies. The effect of the training on physical~     exercise capacity will be assessed by 6-minute walking distance (6-MWD). Further clinical~     parameters will be assessed to evaluate the effect on exercise capacity, quality of life and~     symptoms.~      The aim of this study is to guide European PH-centers to become specialized centers for~     training in PH.~      126 patients will be included, who either receive exercise training or continue their daily~     sedentary life style (1:1 randomization) for 15 weeks.~      As inpatient settings are not available in all healthcare systems the training program will~     be adapted from the specific training program for PH patients developed in Heidelberg to a~     procedure, which is feasible in the local participating centres. Another objective of this~     study is to assess if the particular adopted training program specified for each~     participating centre and country is still safe and effective.~   ",C0020542;C0180112,C0020542;C0042380;C0418981;C0162791;C0012634;C2728259;C2728259;C2728259;C2728259;C2728259;C2728259;C2728259;C0018787;C2948600;C0596545;C2328206;C0836306;C1532253;C1457887;C1457887;C2947996;C2947996;C0204601;C0204601;C0376495,0,0,-1,0,0,0.000599095,0.000756209,0,0,0.009537291
NCT00282308,A Study to Evaluate the Effects of Rituximab on Immune Responses in Subjects With Active Rheumatoid Arthritis Receiving Background Methotrexate,"This was a Phase II, randomized, open-label, multicenter study designed to evaluate the      immune response to vaccines after administration of 1000 mg of rituximab in subjects with      active rheumatoid arthritis (RA) who were receiving background methotrexate (MTX).",C0003873;C0025677;C0393022;C0220825;C0439662;C0718247;C0947630;C1704632,C0003873;C1533734;C0025677;C0393022;C1704632;C0042210;C0439662;C1705425;C0947630;C0025677;C1320102;C0220825,377,12510,0,47,47,0.002489919,0.002672993,0,0,0.009525795
NCT00299104,A Study to Evaluate Rituximab in Combination With Methotrexate in Methotrexate-Naive Patients With Active Rheumatoid Arthritis,"This is a phase III, randomized, controlled, double-blind, parallel group, international      study in approximately 750 patients with active Rheumatoid Arthritis (RA) who are naive to      Methotrexate (MTX) therapy. Rheumatoid Factor (RF)-positive and RF-negative patients will be      enrolled and will be allocated equally between 3 treatment arms.",C0003873;C0025677;C0025677;C3811910;C0393022;C0220825;C0718247;C0947630;C1550655,C0003873;C0201660;C0025677;C0087111;C0205160;C4684790;C0087111;C0456909;C0947630;C0446516;C0025677;C1320102;C2911690;C1552839;C4554418,2670,155660,0,77,25.66666667,0.002862507,0.002791678,0,0,0.009517349
NCT02137226,BI 695501 Compared to Adalimumab in Patients With Active Rheumatoid Arthritis,"Primary Objective:      The primary objective of this trial is to establish an equivalence in efficacy between BI      695501 and US-licensed Humira?? in patients with active Rheumatoid arthritis based on a      statistical comparison of the proportion of patients meeting American College of Rheumatology      20% (ACR20) response rate at Week 12 and ACR20 response rate at Week 24 between BI 695501 and      US-licensed Humira??.      Secondary Objectives:      The secondary objectives of this trial are to compare the efficacy, safety and immunogenicity      of BI 695501 and US-licensed Humira?? in patients with active RA including those undergoing      the transition from US-licensed Humira?? to BI 695501 after 24 weeks.",C0003873;C1122087;C0718247;C1550655,C0003873;C0018017;C0018017;C0018017;C0027627;C1704632;C1704632;C1171255;C1171255;C1171255;C1171255;C0018017;C4554585;C1320102;C1320102;C0027627;C0018792;C0018792;C1548573;C1548573;C1548573;C1548573,200,22410,0,4,4,0.002579053,0.001970981,0,0,0.009471757
NCT02480153,A Study Of PF-06410293 (Adalimumab-Pfizer) And Adalimumab (Humira??) In Combination With Methotrexate In Subjects With Active Rheumatoid Arthritis (REFLECTIONS B538-02).,"The study will assess the efficacy, safety, and immunogenicity of PF-06410293 and adalimumab      in combination with methotrexate in subjects with moderately to severly active rheumatoid      arthritis who have had an inadequate response to methotrexate.      In an additional optional portion of the study, during open label Treatment Period 3 (TP3), a      subset of subjects used a Prefilled Pen (PFP) to administer up to 3 injections of their study      treatment (PF-06410293) at home.",C0003873;C0025677;C3811910;C1122087;C1122087;C1171255;C0718247;C0947630,C1623145;C0025677;C0021485;C0003864;C0087111;C0087111;C0025344;C0947630;C0947630;C1705425;C0947630;C1273517;C3273588;C3539181;C4554585;C1320102;C4085643;C4534574,400,128856,1,0,0,0.002478367,0.002485578,0,0,0.009445329
NCT00837811,An Open Label Extension Study in Participants With Rheumatoid Arthritis,To evaluate the safety and tolerability of LY2127399 administered as subcutaneous injections      for 48 weeks in participants with Rheumatoid Arthritis,C0003873;C1522485;C0947630;C0233494,C4684765;C0003873;C0021485;C0220825;C1736929,829,101300,0,3,3,0.002368669,0.002351179,0,0,0.009408574
NCT01059864,"Study Of The Effects Of Atorvastatin On Cholesterol Levels In Rheumatoid Arthritis Patients Taking CP-690,550","All patients will be in instructed to eat a therapeutic lifestyle diet and will receive      CP-690,550 throughout the 12 weeks of this study. After 6 weeks, half will receive the      cholesterol lowering agent, atorvastatin, and half a matching placebo. This study will first      measure the effects of CP-690,550 on cholesterol levels and then the effects of adding      atorvastatin on those levels.",C0003873;C0286651;C0201950;C0947630;C1550655;C2946261,C0201950;C0286651;C0286651;C0032042;C0947630;C0947630;C0087111;C1820370;C0201950;C1518681;C1518681;C0776963;C0231617,147,12064,0,58,19.33333333,0.00259907,0.002434734,0,0,0.009402213
NCT01988012,A Study of the Efficacy and Safety of Tocilizumab in Adults With Rheumatoid Arthritis.,"A multi-center, open-label single-arm study to evaluate the efficacy and safety of      tocilizumab administered as a single, weekly injection in adults with rheumatoid arthritis.      Combination therapy with methotrexate or other non-biologic disease modifying anti-rheumatic      drugs (DMARDs) was permitted.",C0003873;C1609165;C0947630,C0003873;C0025677;C1609165;C3811910;C0021485;C0087111;C0012634;C0087136;C0087136;C1705425;C0947630;C0013227;C0446516;C0035435;C0242708;C0404831;C0220825,118,1500,0,0,0,0.003011602,0.002646315,0,0,0.009400455
NCT01078090,Effectiveness and Safety of Adalimumab in Rheumatoid Arthritis Patients in Routine Clinical Practice,"Observation of safety, tolerability and effectiveness of adalimumab (Humira) therapy in a      large patient collective under everyday clinical conditions over a 5-year period.",C0003873;C4553491;C1122087;C3272565;C1547582;C1550655;C0237607,C4553491;C0700325;C1122087;C0087111;C1171255;C0025344;C0012634;C3272565,557,1097295,1,3,3,0.001920322,0.002088096,0,0,0.00938434
NCT01534884,Demonstrate the Equivalence of CT-P10 to MabThera With Respect to the Pharmacokinetic Profile in Patients With Rheumatoid Arthritis,"This randomized,controlled, multicenter, 2-arm, parallel-group, double-blind, prospective,      Phase 1 study is designed to demonstrate comparable pharmacokinetics in terms of AUC0-last      and Cmax (after second infusion) between CT-P10 and MabThera in patients with active RA      concomitantly treated with MTX during the Core Study Period.",C0003873;C1314901;C1979963;C0031327;C1550655,C0031327;C0574032;C1314901;C0025344;C0456909;C0947630;C0947630;C1706352;C0025677;C1320102;C2911690;C1552839;C4554418;C0332155,0,0,0,17,8.5,0.002030186,0.002319424,0,0,0.00937855
NCT00669942,"Double Blind, Placebo-controlled, Study of the Safety, Tolerability and Pharmacokinetics of AIN457 in Rheumatoid Arthritis Patients","Evaluate the safety, tolerability and pharmacokinetics of AIN457 when administered as a      single dose (intravenous infusion) in patients with active rheumatoid arthritis in      combination with a stable dose of methotrexate. And to compare efficacy on the dose groups.",C0003873;C0031327;C0032042;C0456909;C0947630;C1550655;C2911690,C0021440;C0003873;C0031327;C0025677;C0220825;C0087136;C1552839;C3539181;C1320102;C1706074,201,6760,0,225,225,0.00242532,0.002785293,0,0,0.00935701
NCT00855322,Study Examining the Effect of Exercise in People With Rheumatoid Arthritis Taking Anti-TNFalpha Medication,The purpose of this study is to determine whether exercise is beneficial for people with      rheumatoid arthritis(RA) taking antiTNFalpha medication,C0003873;C0013227;C1522704;C0947630;C0332128,C0013227;C0947630;C0003873;C0452240;C4082977,0,0,0,2,2,0.002134735,0.002394338,0,0,0.009351238
NCT00072657,Cognitive-Behavioral Therapy and Tai Chi Chih for Patients With Rheumatoid Arthritis,"Rheumatoid arthritis (RA) is a chronic illness. Patients with RA often experience significant      pain and depression. This study will evaluate two programs designed to improve the symptoms      of RA: cognitive-behavioral therapy (CBT) and Tai Chi Chih (TCC), compared to a health      education seminar.",C0003873;C0004933;C1550655,C0003873;C0004933;C0008679;C0237607;C0011570;C0424927;C0947630;C0030193;C1550655;C1457887;C0184511;C0220825;C0042070,0,0,0,2,2,0.00267465,0.002138442,0,0,0.009346855
NCT00413699,"Long-Term Effectiveness And Safety Of CP-690,550 For The Treatment Of Rheumatoid Arthritis","The purpose of this study is to determine the long-term effectiveness and safety of      CP-690,550 for the treatment of rheumatoid arthritis. Subjects are eligible for this study      only after participating in another ""qualifying"" study of CP-690,550      A sub-study will be conducted within the A3921024 study, this study will evaluate the immune      response to pneumococcal and influenza vaccines in patients receiving CP-690,550",C0003873;C4553491;C0087111;C0233324,C0003873;C0021403;C4553491;C0305065;C0087111;C1704632;C0439662;C0947630;C0947630;C0947630;C0947630;C0947630;C0947630;C0220825;C4082977,29610,7217010,0,69,9.857142857,0.001936897,0.002498785,0,0,0.009303905
NCT02019472,A Study Comparing Sirukumab (CNTO 136) Monotherapy With Adalimumab (HUMIRA??) Monotherapy in the Treatment of Active Rheumatoid Arthritis,"The primary objective is to investigate the efficacy of sirukumab monotherapy compared with      adalimumab monotherapy in biologic na??ve subjects with active rheumatoid arthritis who are      intolerant to methotrexate, who are considered inappropriate for treatment with methotrexate      or who are inadequate responders to methotrexate.",C0003873;C1122087;C0087111;C1171255;C0718247;C0947630,C0003873;C0025677;C0025677;C0025677;C0018017;C0087111;C1320102;C0021141;C0231199,1392,78204,1,0,0,0.002472561,0.002723903,0,0,0.009295632
NCT01228812,Physical Activity Behavior of Rheumatoid Arthritis Patients and Healthy Controls,The purpose of the study is to compare physical activity behaviour of rheumatoid arthritis      patients with healthy matched controls.,C0003873;C0031809;C4049938;C2707008;C1550655,C0003873;C0947630;C0677505;C0178520,0,0,0,8,8,0.002015903,0.002429492,0,0,0.009282684
NCT00650156,Pharmacokinetic and Safety Study With Adalimumab in Chinese Subjects With Mild Rheumatoid Arthritis,Pharmacokinetic and Safety Study with Adalimumab in Chinese Subjects with Mild Rheumatoid      Arthritis,C0003873;C1122087;C0947630;C1547225;C0031327,C1122087;C0003864;C0947630;C1547225;C0031327,0,0,0,7,7,0.002239111,0.002752579,0,0,0.009258674
NCT02109666,Long Term Experience With Abatacept in Routine Clinical Practice,~     The purpose of this study is to estimate the retention rate of Abatacept over 24 months in~     routine clinical practice in every participating country depending on the treatment line.~   ,C0596545;C1619966;C2986419,C1619966;C1330542;C2986419;C0376495,0,0,-1,22,5.5,0.000354136,0.000595785,0,0,0.00925734
NCT01404429,Study of Two Different Starting Doses of Methotrexate When Starting Treatment in Rheumatoid Arthritis,"To use different starting doses of methotrexate (7.5 mg per week) versus 15 mg per week in      patients with rheumatoid arthritis, followed by similar hiking up of dose (2.5 mg per 2      weeks, till max of 25 mg per week). To look at the effect on efficacy ( or speed of efficacy)      versus the adverse effects.      Hypothesis: There will be no difference in the adverse effects, but better and faster control      of disease when starting with a higher methotrexate dose",C0003873;C0025677;C0087111;C0947630,C0003873;C0879626;C0879626;C0025677;C0025677;C0012634;C1518681;C0002658;C1561540;C1561540;C1561540;C0085632;C1328018,62,300,0,2,2,0.002919149,0.00251595,0,0,0.009248991
