nct_id,brief_title,description,brief_title_concepts_list,brief_summary_concepts_list,tot_subj_affected,tot_subj_risk,relevance,citationSum,citationAvg,briefTitlePageRankScore,briefTitleAndSummaryCombinedPageRankScore,brief_title_matched_count,brief_summary_matched_count,RRFscore_not_recency
NCT00167843,Reducing the Effects of Malaria in Children by Administering Repeated Preventive Doses,"~     The general goal of the project is to assess the infectious status and immunity of mothers~     and children living in a malaria region. A major part of the study involves administering an~     effective antimalarial, sulfadoxine-pyrimethamine (Fansidar??), to children at the same~     timepoints as vaccinations, i.e. at age 3, 9 and 15 months. The main objective is to study~     safety, efficacy, and consequences of such a strategy in particular the ability to reduce the~     risk of anemia.~   ",C0024530,C0034283;C0024530;C0003374;C0042196,0,0,-1,0,0,0.00232342,0.000457919,0,0,0.014641696
NCT00870467,A Study of Adalimumab in Japanese Subjects With Rheumatoid Arthritis,To evaluate the potential of adalimumab to inhibit radiographic progression in joint      destruction compared with placebo in adult Japanese subjects with recent onset of rheumatoid      arthritis.,C0003873;C1122087;C0947630,C0242656;C1261381;C1122087;C0003864;C0032042;C1306645;C0220825,1502,46860,0,13,6.5,0.002974167,0.002498321,0,0,0.014628769
NCT00732875,A Trial of Anti-TNF Chimeric Monoclonal Antibody (cA2) in Korean Patients With Active Rheumatoid Arthritis Despite Methorexate (Extension Part)(Study P05645)(COMPLETED),"This trial is extension part of the P04280 (placebo-controlled, double-blind, randomized      study of chronic treatment with infliximab in approximately 140 patients, NCT00202852). This      study will be conducted at 6 study centers in South Korea. After completion of the last      follow-up visit at Week 30 and code break in main double-blind trial, subjects randomized to      the placebo group and those who were treated with an infliximab-containing regimen who      maintained clinical response at the time of study completion will be provided with open-label      infliximab for treatment of their conditions and additional safety data will be collected.",C0003873;C0003241;C0718247;C0666743;C1550655;C0746619;C0233494,C0589121;C0666743;C0666743;C0666743;C0087111;C0087111;C1704632;C0032042;C0032042;C0040808;C0456909;C0947630;C0947630;C0947630;C0456909;C0947630;C1705425;C0805701;C3245479;C0012634;C2911690;C1525442;C0018792;C0018792;C1552839;C3272565;C1555587;C0332155,184,3220,0,1,1,0.002031492,0.002698134,0,0,0.014578857
NCT00048932,A Phase III Study of BMS-188667 in Subjects With Active Rheumatoid Arthritis,The purpose of this clinical research study is to learn if abatacept is safe when      co-administered with other approved rheumatoid arthritis medications.,C0003873;C0718247;C0947630,C0003873;C0013227;C1619966;C0947630;C0023185;C3272565,10795,1152375,0,0,0,0.003195685,0.002637661,0,0,0.014576086
NCT00160602,A Study of Liquid Certolizumab Pegol as Additional Medication to Methotrexate in the Treatment of Signs and Symptoms of Rheumatoid Arthritis and in Prevention of Joint Damage in Patients With Active Rheumatoid Arthritis,A 24 week study in which patients are given study medication and assessed for signs and      symptoms of rheumatoid arthritis. X-rays are performed to assess the progress of joint damage      during the study.,C0003873;C0003873;C1872109;C0037088;C0025677;C0013227;C0199176;C0087111;C1304698;C0718247;C0947630;C1550655,C0003873;C0013227;C0010957;C0947630;C3244317;C0947630;C0947630;C1561540;C1457887;C1306645,0,0,0,55,11,0.002937568,0.002452591,0,0,0.014530714
NCT01894516,Dose-finding Study of GLPG0634 as Monotherapy in Active Rheumatoid Arthritis (RA) Patients (DARWIN2),"-  280 patients suffering from active rheumatoid arthritis who have an inadequate response           to methotrexate will be evaluated for improvement of disease activity (efficacy) when           taking GLPG0634 as monotherapy (3 different doses - 50mg, 100mg and 200mg once daily) or           matching placebo for 24 weeks.        -  During the course of the study, patients will also be examined for any side effects that           may occur (safety and tolerability), and the amount of GLPG0634 present in the blood           (Pharmacokinetics) as well as the effects of GLPG0634 on disease- and mechanism of           action-related parameters in the blood (Pharmacodynamics) will be determined. Also, the           effects of different doses of GLPG0634 administration on subjects' disability, fatigue           and quality of life will be evaluated.",C0003873;C0037088;C0718247;C0947630;C1550655,C4684765;C0003873;C0031327;C0518214;C1533734;C0025677;C0877248;C0231170;C0683278;C1704632;C0332128;C0012634;C0032042;C0150312;C0015672;C0947630;C0005767;C0005767;C0012634;C4082977;C1518681;C0233492;C1518681;C1320102;C3844714;C0220825;C0220825;C0449878;C4049938;C0231617,0,0,1,12,12,0.002829752,0.003123026,0,0,0.014496288
NCT00432484,Lingzhi and Sen Miao San for the Treatment of Rheumatoid Arthritis,To study the efficacy of TCM as an effective supplement in addition to the traditional      treatment in RA.,C0003873;C0087111,C0087111;C0947630;C1947943,0,0,0,7,7,0.003170737,0.00423118,0,0,0.014480809
NCT00269867,Infliximab Plus Methotrexate for the Treatment of Rheumatoid Arthritis,"The purpose of this study is to evaluate the safety and effectiveness of infliximab (an      anti-TNF chimeric monoclonal antibody [cA2]) in patients with active Rheumatoid Arthritis,      despite methotrexate treatment.",C0003873;C0025677;C0666743;C0087111,C0746573;C0003873;C4553491;C0666743;C0746619;C0003241;C0947630;C0666743;C1320102;C0220825,0,0,0,2,2,0.002243006,0.002772942,0,0,0.014457616
NCT01000441,Rotation or Change of Biotherapy After First Anti-TNF Treatment Failure for Rheumatoid Arthritis,"Approximately 30% of patients with rheumatoid arthritis have an inadequate response to      anti-TNF (primarily or loss of response), leaving two alternatives: rotation to a second      anti-TNF or change of biologic, with a different mechanism of action, such as abatacept,      rituximab and tocilizumab. No controlled trial compared these two strategies face to face.      The present objective is to investigate the issue whether one of these strategies could have      a better efficacy in a pragmatic trial in the setting of current practice.",C0003873;C0162643;C0005527;C4319952;C0868996,C0003873;C0031327;C1609165;C0679199;C0679199;C1619966;C0393022;C0018017;C1704632;C1704632;C0237607;C0150312;C0542559;C0015450;C0015450;C2911690;C0018792;C1547928;C0018792;C0868996;C3845593,0,0,0,9,4.5,0.001497634,0.001368749,0,0,0.014448426
NCT01400516,Teriparatide for Joint Erosions in Rheumatoid Arthritis: The TERA Trial,"Summary:      The investigators propose a randomized controlled open label study of teriparatide in men or      women with rheumatoid arthritis and joint erosions. Specifically, the investigators will      examine whether teriparatide in combination with a biologic can retard the development of      joint erosions. The study will be conducted at Brigham and Women's Hospital Arthritis Center,      several Brigham and Women's Hospital Arthritis Center satellite practices, the University of      Massachusetts Medical Center, and Massachusetts General Hospital.      Hypothesis:      The investigators hypothesize that the combination of teriparatide with biologic will be much      more effective at retarding erosion progression then a biologic alone.",C0003873;C0070093;C1959609,C0003873;C0070093;C0070093;C0070093;C0243107;C0242656;C0003864;C0003864;C0237607;C1706244;C0199168;C3812897;C1959609;C3810851;C3810851;C3810851;C1705425;C0947630;C0947630;C0439044;C3539181;C3539181;C1959609;C1959609;C0000589;C0282440,22,240,0,1,1,0.001943447,0.001669453,0,1,0.014289767
NCT00975130,"Subcutaneous Golimumab (GLM) Plus DMARDs for Rheumatoid Arthritis, Followed by Intravenous/Subcutaneous GLM Strategy (P06129 AM2)","Part 1 of this trial will assess the safety and effectiveness of subcutaneous (SC) golimumab      administered by autoinjector once monthly, when combined with different disease-modifying      antirheumatic drug (DMARD) regimens used in daily rheumatology practice. Subsequently, Part 2      will study if a strategy of intravenous (IV) golimumab to induce remission followed by SC      golimumab to retain remission is superior to continuing a SC regimen.",C0003873;C2353893;C0679199;C0085297;C0242708;C3842127;C3842127,C0003191;C4553491;C2353893;C2353893;C0544452;C2353893;C0544452;C2945654;C0237607;C0679199;C0012634;C0040808;C0242708;C0947630;C1273517;C0018792,647,794542,0,14,3.5,0.001514167,0.001886751,0,0,0.014260566
NCT01940926,68Ga-BNOTA-PRGD2 PET/CT in Patients With Rheumatoid Arthritis,This is an open-label positron emission tomography/computed tomography ( PET/CT) study to      investigate the diagnostic performance and evaluation efficacy of 68Ga-BNOTA-PRGD2 in      rheumatoid arthritis (RA) patients. A single dose of nearly 111 MBq 68Ga-BNOTA-PRGD2 (??? 40 ??g      BNOTA-PRGD2) will be intravenously injected into patients with RA. Visual and      semiquantitative method will be used to assess the PET/CT images. Whole body 18F-FDG PET/CT      will be performed for comparison.,C0003873;C3275040;C0032743;C1550655,C0032743;C0003873;C0040405;C3275040;C3275040;C0220825;C1546549;C0046056;C0087136;C0025663;C1705425;C0947630;C1273517;C0032743;C0032743;C0032743;C0011900;C1696103,0,0,0,10,10,0.002196304,0.001981754,0,0,0.014227204
NCT01307787,Effects of a Rehabilitation Program on Physical Performance and Disease Self-management in Rheumatoid Arthritis.,The purpose of this study is to evaluate the effects of a group-based exercise and      educational program for people with Rheumatoid Arthritis (RA) on physical performance and      disease-self-management.,C0003873;C0034991;C0376636;C0031809;C0376691;C0012634,C0003873;C0086969;C0012634;C0947630;C0452240;C3151563;C1518681;C0424927;C1552839;C0220825,0,0,0,8,8,0.001568319,0.00202001,0,0,0.014204475
NCT00000435,dnaJ Peptide for Relieving Rheumatoid Arthritis,A small protein called dnaJ peptide may help people with rheumatoid arthritis (RA) by      preventing their immune system cells from attacking their own tissues. The purpose of this      study is to determine if small amounts of dnaJ peptide can "re-educate" immune cells in      people with RA so that the cells stop attacking joint tissues.,C0003873;C0030956,C0003873;C0030956;C0030956;C0439662;C0439662;C0947630;C1552861;C0033621;C4082977,0,0,0,46,46,0.002671106,0.002249327,0,0,0.01409544
NCT00628095,"Study of CE-224,535 A Twice Daily Pill To Control Rheumatoid Arthritis In Patients Who Have Not Totally Improved With Methotrexate","CE-224,535 is known to block a chemical that acts as a gateway to some of your immune cells.      Blocking this gateway prevents the cells from pushing out 2 chemicals called IL-1 and IL-18      that are known to cause some of the inflammation seen in rheumatoid arthritis. It is hoped      that taking this drug will reduce the symptoms of rheumatoid arthritis",C0003873;C0025677;C0184511;C4699603;C0947630;C0009905;C1550655;C1564718,C0003873;C0003873;C0021368;C0233660;C0439662;C0028778;C0013227;C1457887;C3272558,0,0,0,47,47,0.002550961,0.002083024,0,0,0.014016363
NCT00718718,A Study of Effectiveness and Safety of CNTO 136 in Patients With Active Rheumatoid Arthritis Despite Methotrexate Therapy,The purpose of this study is to evaluate the effectiveness and safety of subcutaneous (under      the skin) administration of anti-interleukin-6 monoclonal antibody (CNTO 136) in reducing      signs and symptoms of participants with active rheumatoid arthritis (RA) with methotrexate      (MTX) therapy.,C0003873;C4553491;C0025677;C0087111;C0718247;C0947630;C1550655,C0003873;C1533734;C4553491;C0919829;C0025677;C0746619;C0003241;C0087111;C0947630;C0025677;C0424818;C1320102;C0220825,583,23959,0,29,29,0.002953686,0.002870466,0,0,0.013956493
NCT02795299,Study Evaluating Gerilimzumab??s Safety/Efficacy for Patients MTX or TNF?? Antagonist Failed in Rheumatoid Arthritis,~     Phase 2 Study Evaluating Gerilimzumab's Safety/Efficacy for Patients with an Inadequate~     Response to MTX or a TNF?? Antagonist in Rheumatoid Arthritis.~   ,C0003873,C0003873,0,0,-1,0,0,0.005060089,0.006948191,0,0,0.013949208
NCT00427934,Maraviroc in Rheumatoid Arthritis,"The purpose of this study is to evaluate whether maraviroc, an investigational drug given      with methotrexate (MTX) is safe and effective in the treatment of rheumatoid arthritis in      adult patients.",C0003873;C1667052,C0013230;C0003873;C0025677;C1667052;C0087111;C0947630;C3244317;C0025677;C0220825,202,10584,0,20,20,0.002671106,0.00304984,0,0,0.013945362
NCT01021735,Optimal Management of Rheumatoid Arthritis Patients Requiring Biologic Therapy,"That anti-TNF therapy and rituximab therapy are equally effective in treating patients with      rheumatoid arthritis who meet the eligibility criteria for biologic therapy in the British      Society for Rheumatology guidelines, and have not previously been exposed to biologic      therapy.",C0003873;C0005527;C1550655;C0376636,C0003873;C0281481;C0005527;C0162791;C0393022;C0087111;C0087111;C0013893;C0181622,0,0,0,15,15,0.002216686,0.001785097,0,0,0.013929516
NCT00264550,An Efficacy and Safety Study of Golimumab in Patients With Active Rheumatoid Arthritis Despite Methotrexate Therapy,"The purpose of this study is to evaluate the efficacy and safety of golimumab, alone or in      combination with methotrexate (MTX), as compared to methotrexate alone in rheumatoid      arthritis (RA) patients who have active rheumatoid arthritis despite treatment with MTX.",C0003873;C0025677;C2353893;C0087111;C0718247;C0947630;C1550655,C0003873;C0025677;C0025677;C2353893;C0003864;C0087111;C0947630;C0439044;C0439044;C0025677;C0025677;C3539181;C1320102;C0220825,2422,102424,0,43,5.375,0.002951055,0.003151169,0,0,0.013767602
NCT02198651,"A Phase 4 Trial Assessing the ImPact of Residual Inflammation Detected Via Imaging TEchniques, Drug Levels and Patient Characteristics on the Outcome of Dose TaperIng of Adalimumab in Clinical Remission Rheumatoid ArThritis (RA) Subjects","A Phase 4 Trial Assessing the ImPact of Residual Inflammation Detected via Imaging      TEchniques, Drug Levels and Patient Characteristics on the Outcome of Dose TaperIng of      Adalimumab in Clinical Remission Rheumatoid ArThritis (RA) Subjects (PREDICTRA).",C0021368;C1122087;C0544452;C0442726;C3272565;C0011923;C1550655;C0013227;C2946261;C0003873,C0021368;C1122087;C0544452;C0442726;C3272565;C0011923;C1550655;C0013227;C2946261;C0003873,0,0,0,0,0,0.002054066,0.001747919,0,0,0.013724631
NCT00291928,"HuMax-CD20 in Active Rheumatoid Arthritis, Phase I/II","The purpose of this trial is primarily to investigate the safety profile of HuMax-CD20 in      patients with active RA. Furthermore, the trial is designed to identify the dose levels to be      used in future trials (based on evaluations of safety, pharmacokinetics and ACR and DAS      responses).",C0003873;C1541395;C0718247,C0031327;C0220825;C1541395;C1273517;C0175454;C1704632;C1320102;C3858576;C0018792;C0018792,0,0,0,27,13.5,0.002296329,0.001955375,0,0,0.013711562
NCT00439062,Treatment of Rheumatoid Arthritis With Roxithromycin,"The purpose of this study is to evaluate the clinical efficacy, safety, and tolerability of      roxithromycin in patients with rheumatoid arthritis.",C0003873;C0035891;C0087111,C0003873;C0035891;C0947630;C4684765;C0220825;C3272565,0,0,0,8,8,0.002273858,0.003177827,0,0,0.013686744
NCT00647491,A Study of Adalimumab in Adult Japanese Subjects With Rheumatoid Arthritis,"The primary objective of this study is to evaluate the safety, efficacy and pharmacokinetics      of three doses of adalimumab in adult Japanese subjects with RA",C0003873;C1122087;C0947630,C0031327;C1122087;C0018017;C0947630;C0220825,0,0,0,7,7,0.002974167,0.003171576,0,0,0.013665311
NCT01414101,"Safety, Tolerability, and Pharmacodynamic Study of ISIS CRP Rx in Rheumatoid Arthritis","The purpose of this study is to evaluate the safety, tolerability, and pharmacokinetics of      ISIS CRP Rx and its effects on CRP and other pharmacodynamic measures, versus placebo, in      subjects with active rheumatoid arthritis.",C0003873;C0947630,C0003873;C0031327;C0032042;C0947630;C1518681;C1320102;C0220825,0,0,0,4,4,0.004001622,0.003288758,0,0,0.013655854
NCT00380744,A Safety and Pharmacokinetics Study in Patients With Rheumatoid Arthritis,The purpose of this study is to examine the safety and efficacy of this antibody in      rheumatoid arthritis patients.      Part A of the study is an initial dose escalation phase      Part B of the study is a randomized allocation of the entire dosing group to parallel      treatment assignments,C0003873;C0031327;C0947630;C1550655,C0003873;C0087111;C0003241;C0947630;C0947630;C0947630;C0000589;C1555588;C1552839;C4554418,202,12677,0,4,4,0.002958074,0.002543081,0,0,0.013652078
NCT00650078,Study to Assess the Safety and Efficacy of Modified-Release Prednisone (Lodotra??) Therapy in Patients With Active Rheumatoid Arthritis,"The purpose of the study is to compare the safety and efficacy, with regards to the signs and      symptoms, of MR prednisone (Lodotra??) versus placebo in combination with standard Disease      Modifying Anti-Rheumatic Drug (DMARD) treatment in patients with active rheumatoid arthritis.",C0003873;C0032952;C0030685;C0087111;C0718247;C0947630;C1550655,C0003873;C0032952;C0087111;C2828392;C0032042;C0012634;C0947630;C0242708;C0013227;C3539181;C1457887;C1320102,268,6300,0,34,17,0.002698462,0.002858984,0,0,0.013622684
NCT00092742,Investigational Drug Versus an Approved Drug in Patients With Rheumatoid Arthritis (0663-072),The purpose of this study is to evaluate the long-term safety of an investigational drug      versus an approved drug for the relief of pain in patients with rheumatoid arthritis.,C0013230;C0003873;C0013227;C1550655,C0013230;C0003873;C0564405;C0947630;C0013227;C0030193;C0220825,0,0,0,87,29,0.002350732,0.002781511,0,0,0.013519498
NCT02880306,Hepatocellular Carcinoma and Rheumatoid Arthritis,"Rheumatoid arthritis(RA) is a disorder with altered immunologic function and increased risk      of developing malignancies, while studies examining the association between hepatocellular      carcinoma (HCC) and RA remain lacking. The investigators aimed to investigate the risk of HCC      between participants with and without RA.",C2239176;C0003873,C0006826;C0004083;C0332128;C0007097;C0012634;C0031843;C0947630;C0003873;C4699158;C1521740,0,0,0,0,0,0.002671106,0.001875953,0,0,0.013437279
NCT00410163,Ofatumumab With Fludarabine and Cyclophosphamide in B-CLL Patients,~     To investigate the safety and efficacy of two dose regimes of ofatumumab in combination with~     chemotherapy in previously untreated patients with B-CLL~   ,C0010583;C0059985,C3665472,594,8479,-1,41,20.5,0.001856729,0.000772088,0,0,0.013357455
NCT00888745,A Study of the Safety and Pharmacokinetics of PRO283698 in Patients With Rheumatoid Arthritis,This is a Phase I multicenter study that will be conducted in the United States and Europe.,C0003873;C0031327;C0947630;C1550655,C0947630,0,0,0,10,10,0.002958074,0.004300038,0,0,0.013352393
NCT01613079,Efficacy and Safety of Tripterygium Wilfordii in Patients With Rheumatoid Arthritis,"Evaluation of oral T2 (chloroform/methanol extract of Tripterygium wilfordii Hook F) in the      treatment of RA patients with clinical efficacy and safety.Open-labeled, randomized,      prospective multi-center clinical trial. Observation period of 24 weeks.",C0003873;C1550655;C4520843,C1096775;C0700325;C0220825;C0008238;C0087111;C1555707;C0025344;C0001962;C0404831;C3272565;C4520843,0,0,0,24,12,0.002679257,0.001880939,0,0,0.013323918
NCT01663116,"Cx611-0101, eASCs Intravenous Administration to Refractory Rheumatoid Arthritis Patients","Phase Ib/IIa clinical trial of a new medicinal product of the somatic cell therapy class      (eASCs). This study is designed as a multicenter, single blind, fixed dose escalation, with      three treatment groups, controlled with placebo (randomization 3:1) whose target population      are patients with rheumatoid arthritis refractory to at least two biologic.",C0003873;C1533734;C1550655;C0085297,C0003873;C0013227;C1096775;C0302189;C0087111;C0032042;C0087136;C1552839;C0456387;C0947630;C0456909;C1578513;C2911690,0,0,0,19,19,0.002222592,0.002307159,0,0,0.013292321
NCT02222493,A Study of PF-06438179 (Infliximab-Pfizer) and Infliximab in Combination With Methotrexate in Subjects With Active Rheumatoid Arthritis (REFLECTIONS B537-02).,The study will assess the efficacy and safety of PF-06438179 and infliximab in combination      with methotrexate in subjects with active rheumatoid arthritis who have had an inadequate      response to methotrexate.,C0003873;C0025677;C3811910;C0666743;C0666743;C0718247;C0947630,C1623145;C0003873;C0025677;C0666743;C0947630;C3539181;C1320102,376,142760,1,1,1,0.002510653,0.002695654,0,0,0.013260117
NCT01202773,A Study in Participants With Rheumatoid Arthritis,The primary purpose of this study is to help answer if LY2127399 is safe and effective in the      treatment of rheumatoid arthritis in participants with an inadequate response to one or more      tumor necrosis factor-alpha (TNF-??) inhibitors.      This study is comprised of 2 periods:      Period 1: 24-week blinded treatment      Period 2: 48-week post-treatment follow-up,C0003873;C0947630,C0003873;C0333516;C0087111;C0087111;C0087111;C1704632;C0025344;C0025344;C0025344;C0947630;C0439095;C0947630;C1552861,710,80240,1,3,3,0.004001622,0.00265198,0,0,0.013235236
NCT01198002,A Rheumatoid Arthritis Study in Participants on a Background Treatment of Methotrexate,The primary purpose of this study is to help answer if LY2127399 is safe and effective in the      treatment of rheumatoid arthritis while on a background treatment of methotrexate.      This study is comprised of 3 periods:      Period 1: 52-week blinded treatment      Period 2: additional 48-week unblinded treatment      Period 3: 48-week post-treatment follow-up,C0003873;C0025677;C0087111;C0947630,C0003873;C0025677;C0087111;C0087111;C0087111;C0087111;C0087111;C0025344;C0025344;C0025344;C0025344;C0947630;C0947630;C1552861,1972,466292,1,9,9,0.002919149,0.003440241,0,0,0.013212951
NCT01378689,Improving Bone Health Among Rheumatoid Arthritis (RA) Patients on Chronic Glucocorticoids,"This quality improvement project is aimed at improving health care by identifying low cost      strategies to get Rheumatoid Arthritis (RA) patients to more effectively communicate with      their physicians about osteoporosis prevention and treatment (improving doctor-patient      communication). The investigators will implement a direct to patient intervention to the      population of interest (patients on chronic glucocorticoids) via story-telling, using an      Internet based video. The target audience is people on chronic glucocorticoids not already      receiving bones-specific osteoporosis medications to determine differences in      post-intervention rates of osteoporosis care, and the rates of prescription anti-osteoporosis      therapies.",C0003873;C3540777;C1547296;C0262950;C1550655;C1328956,C0003873;C0029456;C0184661;C0029456;C0184661;C0029456;C0033080;C0029456;C0086388;C0566001;C0013227;C0679199;C0199176;C0087111;C0087111;C0543488;C1552740;C3244286;C0262950;C1550472;C3540777;C3540777;C4693928;C3844714;C0729829;C0729829;C0085632;C4082977,0,0,0,3,3,0.001857547,0.001575892,0,0,0.013210207
NCT00611455,Investigating Clinical Efficacy of Ofatumumab in Adult Rheumatoid Arthritis (RA) Patients Who Had an Inadequate Response to MTX Therapy,"This is a phase III, double-blind, randomized, multicenter, and parallel group trial with a      duration of 24 weeks, followed by a 120 week Open-label Period. the primary purpose of the      study is to demonstrate the efficacy of ofatumumab in reducing clinical signs and symptoms in      adult RA patients after a single course of ofatumumab.",C0003873;C1832027;C3272565;C1704632;C0087111;C0025677;C1550655,C1832027;C1832027;C0025344;C0087136;C0456909;C1705425;C0947630;C1561540;C0424818;C0332534;C1552839;C0018792;C4554418;C3272565,1209,78207,0,29,29,0.002318066,0.002544973,0,0,0.01320439
NCT00195650,Long Term Open Label Continuation Study,~     The purpose of the study was to assess the long-term safety and clinical efficacy following~     repeated administration of adalimumab in patients with rheumatoid arthritis.~   ,0,C1122087;C0003873;C3845829,7395,367164,-1,5,5,0.000232342,0.002828806,0,0,0.013088059
NCT00122382,Remission and Joint Damage Progression in Early Rheumatoid Arthritis,~     This is a world wide study to evaluate the remission and joint damage in subjects treated~     with abatacept in addition to methotrexate versus subjects who receive methotrexate along~     with a placebo.~   ,C0003873;C0544452,C0025677;C0025677;C0544452;C1619966,973,31558,-1,49,16.33333333,0.002712021,0.002754565,0,0,0.01308236
NCT00746512,A Study of the Effects of Oral Prednisone in Patients With Rheumatoid Arthritis (MK0000-088),The study will compare the effects of prednisone vs placebo on synovial blood flow and      overall DAS (disease activity score) in patients with rheumatoid arthritis.,C0003873;C0032952;C0947630;C1550655,C0003873;C0032952;C0232338;C0032042;C0012634;C0947630;C0175454;C0039097;C1518681;C3534109;C4049938,41,990,0,4,4,0.002908591,0.002358073,0,0,0.013045938
