nct_id,brief_title,description,brief_title_concepts_list,brief_summary_concepts_list,tot_subj_affected,tot_subj_risk,relevance,citationSum,citationAvg,briefTitlePageRankScore,briefTitleAndSummaryCombinedPageRankScore,brief_title_matched_count,brief_summary_matched_count,RRFscore_not_recency
NCT01689532,A Study of CNTO 136 (Sirukumab) Administered Subcutaneously in Japanese Patients With Active Rheumatoid Arthritis Unresponsive to Methotrexate or Sulfasalazine,The purpose of this study is to evaluate the safety and efficacy of sirukumab as a single      therapy in Japanese patients with moderately to severely active rheumatoid arthritis (RA) who      have not responded to treatment with methotrexate (MTX) or sulfasalazine (SSZ).,C0003873;C0036078;C0237284;C0025677;C0718247;C0947630;C1550655;C1736929,C0003873;C0036078;C0025677;C0087111;C0205082;C0087111;C0087136;C0947630;C0025677;C1320102;C4085643;C0220825,421,4026,1,0,0,0.002690495,0.002883505,0,1,0.019922492
NCT01597739,A Study of JNJ-40346527 in Patients With Active Rheumatoid Arthritis Despite Disease-modifying Antirheumatic Drug Therapy,"The purpose of this study is to evaluate the safety, tolerability, and efficacy of      JNJ-40346527 200 mg/day (100 mg twice daily) for 12 weeks, compared with placebo, in patients      with active rheumatoid arthritis (RA) despite disease-modifying antirheumatic drug (DMARD)      therapy.",C0003873;C0003191;C0013216;C0012634;C0718247;C0947630;C1550655,C0003873;C0003191;C0032042;C0012634;C0087111;C0947630;C0242708;C1561538;C1320102;C0220825,0,0,0,9,9,0.002623324,0.003094209,0,0,0.01975614
NCT00195494,Study Comparing Etanercept and Methotrexate vs. Methotrexate Alone in Rheumatoid Arthritis,To compare the effects of the combination of ETN and MTX to MTX alone on radiographic change      and clinical disease activity in subjects with early RA over 12 months.,C0003873;C0025677;C0025677;C0717758;C0947630;C0439044,C0012634;C0439044;C0025677;C0025677;C3539181;C4699604;C1306645;C1518681;C3272565;C4049938,2771,136279,0,138,34.5,0.002438287,0.002389767,0,0,0.019645083
NCT01359943,"Efficacy, Safety and Tolerability of Secukinumab in Patients With Rheumatoid Arthritis Taking Methotrexate","The study compared the efficacy and assessed the safety of secukinumab given as 3 intravenous      (i.v.) loading doses or weekly sub-cutaneous (s.c.) loading doses, compared to placebo,      followed by monthly s.c. injections in patients with active Rheumatoid Arthritis (RA) despite      treatment with Methotrexate.",C4684765;C0003873;C0025677;C3179547;C1550655,C0003873;C0025677;C3179547;C0021485;C0087111;C0032042;C0947630;C3244317;C1320102,446,47377,0,8,8,0.002273421,0.002979051,0,0,0.019634199
NCT01451203,Efficacy Confirmation Study of CDP870 in Early Rheumatoid Arthritis,"~     The objective of this study is to assess the efficacy of certolizumab pegol (CZP) with~     methotrexate (MTX) compared with MTX-alone in patients with early-stage rheumatoid arthritis~     (RA) who are naive to MTX and have with poor prognostic factors, using inhibition of~     radiographically confirmed joint damage progression over a one-year period as a primary~     endpoint. Following a year of treatment with CZP plus MTX treatment, CZP will be~     discontinued, and the subjects will be monitored for one more year (the follow-up period) to~     investigate the sustainability of efficacy of CZP during the MTX monotherapy for exploratory~     purposes.~   ",C0003873;C0750484,C1872109;C0025677;C1444662;C0220901;C0021467;C0003873;C1449882;C0376495;C0376495,1128,18644,-1,37,18.5,0.002684344,0.001683839,0,0,0.019619208
NCT01004432,Golimumab in Rheumatoid Arthritis Participants With an Inadequate Response to Etanercept (ENBREL) or Adalimumab (HUMIRA),"The purpose of this study is to evaluate the efficacy and safety of switching rheumatoid      arthritis (RA) participants who have an inadequate response to their current treatment with      either etanercept + methotrexate or adalimumab + methotrexate to treatment with golimumab 50      milligram (mg) subcutaneous (SC) injection (a needle inserted under the skin in the back of      upper arm, upper thigh or stomach area) every 4 weeks + methotrexate. This study is also      designed to evaluate the benefit and safety of switching participants from treatment with      golimumab 50 mg subcutaneous injection every 4 weeks + methotrexate to golimumab 2 milligram      per kilogram (mg/kg) intravenous every 8 weeks + methotrexate, for those who do not achieve a      marked improvement of their RA at Week 16.",C0003873;C0717758;C1122087;C2353893;C1704632;C0720193;C1171255,C0025677;C0025677;C0025677;C0025677;C0025677;C0446559;C0717758;C1122087;C0003864;C0087111;C0087111;C2353893;C0021485;C0446516;C0087111;C2353893;C0021485;C2353893;C1704632;C0038351;C0027551;C0947630;C0947630;C0004600;C3844714;C0231530;C0231530;C0683092;C0220825;C0441587;C0220825,757,61690,0,2,1,0.001631593,0.002387171,0,0,0.019572825
NCT01373151,Phase IIB Rheumatoid Arthritis Dose Ranging Study for BMS-945429 in Subjects Who Are Not Responding to Methotrexate,The purpose of this study is to determine the effective dose of BMS-945429 in subjects with      inadequate response to Methotrexate in the treatment of moderate to severe Rheumatoid      Arthritis.,C0003873;C0025677;C0947630,C0025677;C0087111;C0003864;C1704632;C0205082;C0947630;C1547226;C4082977,0,0,1,12,12,0.0032623,0.003051571,0,1,0.019571063
NCT00717236,Certolizumab Pegol for the Treatment of Patients With Active Rheumatoid Arthritis,This is a Phase IIIb multicenter study to evaluate the safety and efficacy of certolizumab      pegol (CZP) administered to patients with moderate-to-severe rheumatoid arthritis.,C0003873;C1872109;C0087111;C0718247;C1550655,C0003873;C0205082;C0947630;C1872109;C0220825;C1547226,1352,273224,1,30,10,0.002447921,0.003198967,0,1,0.019569199
NCT01873443,Long-Term Efficacy and Safety of CT-P10 in Patients With RA,"~     This is an open-label, single-arm, multicenter, efficacy, and safety maintenance study of the~     Phase 1 Study CT-P10 1.1. This study is designed to assess the long-term efficacy and safety~     of CT-P10 co-administered with MTX and folic acid in patients with RA who have completed the~     scheduled visits in Study CT-P10 1.1~   ",0,C0016410;C0446516;C0723338,0,0,-1,11,11,0.000232342,0.000468775,0,0,0.019516637
NCT01317797,A Trial to Evaluate the Safety and Tolerability of Namilumab (MT203) in Patients With Mild to Moderate Rheumatoid Arthritis,"The purpose of this trial is primarily to investigate the safety and tolerability of repeated      subcutaneous injections of MT203 in patients with mild to moderate rheumatoid arthritis.      Furthermore, the amount of MT203 in the blood will be measured and it will be investigated      how the body responds to MT203 treatment and if MT203 is effective in the treatment of      rheumatoid arthritis.",C4684765;C0003873;C3273714;C0220825;C1547226;C1547225;C1550655,C4684765;C0003873;C0003873;C0021485;C0087111;C0087111;C0005767;C0449878;C0018792;C1547226,58,888,0,3,3,0.001966166,0.002015241,0,0,0.019301003
NCT01941095,A Study of Subcutaneous Tocilizumab as Monotherapy and/or in Combination With Non-Biologic Disease Modifying Anti-Rheumatic Drugs (DMARDs) in Participants With Rheumatoid Arthritis,"This Phase IIIb, multicenter, open label, single arm study will evaluate the safety and      efficacy of subcutaneous (SC) tocilizumab as monotherapy or in combination with methotrexate      or other non-biologic DMARDs in participants with active rheumatoid arthritis who are either      na??ve to or have an inadequate response to prior non-biologic or/and biologic DMARDs. The      anticipated time on study treatment is 52 weeks. Those participants who will complete the      60-week study period and have achieved Disease Activity Score 28 (DAS28) remission or a good      European League Against Rheumatism (EULAR) response at 52 weeks will be eligible to enter the      extension phase until tocilizumab is commercially available and reimbursed in Greece.",C0003191;C0003873;C1609165;C3811910;C0012634;C0947630;C0005522;C0242708;C3842127,C0003873;C1521826;C0025677;C1609165;C1609165;C0009326;C0544452;C1704632;C4049938;C1704632;C0012634;C0087136;C0025344;C1705425;C0947630;C0947630;C4050231;C0446516;C3539181;C0680536;C3840775;C1320102;C4055380;C4055380;C1525442;C4331837;C3810851;C0220825;C4283785,283,4074,0,0,0,0.00219734,0.002673259,0,1,0.019209096
NCT01484561,"A Study To Evaluate The Effect Of CP-690,550 On Measures Of Kidney Function In Patients With Active Rheumatoid Arthritis","The purpose of study is to explore the effect of CP-690,550 (Tofacitinib) on measures of      kidney function in patients with active rheumatoid arthritis (RA).",C0003873;C0220825;C1705273;C0022646;C0718247;C0947630;C1550655,C0003873;C2930696;C0031843;C1518681;C0022646;C0947630;C0180799;C1320102,144,6512,0,24,12,0.002606194,0.002491183,0,0,0.019097743
NCT00928512,"Efficacy, Safety and Tolerability of AIN457 in Patients With Rheumatoid Arthritis (RA) Taking Methotrexate (MTX)",This study will assess at Week 16 the efficacy and safety of AIN457 at different doses in      patients with active RA despite stable MTX therapy. Treatment will continue up to Week 48      with a safety follow-up at Week 60 to assess the long term efficacy and safety of AIN457      treatment in combination with MTX in RA.,C4684765;C0003873;C0025677;C0025677;C1550655,C0087111;C0087111;C0087111;C0947630;C0025677;C0025677;C3539181;C1320102;C1706074,579,43488,0,90,45,0.002545074,0.003262593,0,0,0.019021872
NCT00152386,A Placebo Controlled Study to Assess Efficacy and Safety of Certolizumab Pegol in the Treatment of Rheumatoid Arthritis,Patients will be assigned to one of three treatment groups. Study medication is administered      over a 52 week study duration.,C0003873;C1872109;C2911690;C0087111;C0032042;C0947630,C0013227;C0087111;C1552601;C1552839;C0947630;C0947630;C1561540;C1550655;C0332534,0,0,0,98,10.88888889,0.002261064,0.002515405,0,0,0.01892811
NCT01061736,Evaluation of Sarilumab (SAR153191/REGN88) on Top of Methotrexate in Rheumatoid Arthritis Patients,Primary Objectives:      Part A (dose ranging study):      To demonstrate that sarilumab (SAR153191/REGN88) on top of MTX was effective on reduction of      signs and symptoms of rheumatoid arthritis at 12 weeks.      Part B (pivotal study):      To demonstrate that sarilumab added to MTX was effective in:        -  reduction of signs and symptoms of rheumatoid arthritis at 24 weeks        -  inhibition of progression of structural damage at 52 weeks        -  improvement in physical function at 16 weeks      Secondary Objectives:      Part B:      To demonstrate that sarilumab added to MTX was effective in induction of a major clinical      response at 52 weeks      To assess the safety of sarilumab added to MTX      To document the pharmacokinetic profile of sarilumab added to MTX in participants with active      rheumatoid arthritis who were inadequate responders to MTX therapy.,C0003873;C0025677;C0220825;C3885145;C1550655,C0003873;C0003873;C0003873;C0516981;C0242656;C0021467;C3885145;C4551656;C3885145;C4551656;C3885145;C0857127;C3885145;C3885145;C1704632;C1301746;C0087111;C0010957;C0947630;C0947630;C0025677;C0025677;C0025677;C0025677;C0025677;C0025677;C0031327;C0018017;C0018017;C0424818;C0424818;C1320102;C3844714;C0027627;C0776963;C0776963;C0776963;C0776963;C3272565,1769,240624,0,51,17,0.002364549,0.002815972,0,0,0.018637916
NCT01120366,Success of Tocilizumab in RA Patients With Remission Induction and Sustained Efficacy After Discontinuation,"~     The objective of this study is to investigate the efficacy and safety of the humanized~     anti-human IL-6 receptor monoclonal antibody tocilizumab (TCZ) either in monotherapy or in~     combination therapy with methotrexate (MTX) in patients with an inadequate response to~     treatment with MTX.~      Furthermore, in patients who have been able to achieve control of disease activity via the~     above therapy, we investigate the possibility of stopping TCZ and verify safety when TCZ is~     restarted after disease recurrence.~   ",C1609165;C0544452;C2732140,C0025677;C1609165;C0012634;C0012634;C0281019;C0034897;C0376495,0,0,-1,27,13.5,0.000455504,0.001207229,0,0,0.018572792
NCT00430495,A Phase 2 Dose-finding Study of Atacicept in Subjects With Rheumatoid Arthritis (AUGUST I),"This was a double-blind, placebo-controlled, parallel-arm, multicentre, prospective      dose-finding trial of the safety and efficacy of atacicept in subjects with active rheumatoid      arthritis who had failed a three month therapeutic trial with a tumor necrosis factor alpha      (TNFa) antagonist due to lack of efficacy.",C0003873;C0037088;C0947630,C0333516;C0003864;C0032042;C0037088;C0456909;C1561542;C0439095;C0446516;C0087111;C0381385;C1320102;C2911690;C0018792;C0018792;C4554418,262,11430,0,28,28,0.002876425,0.002337545,0,0,0.018498633
NCT02941055,ADIRA (Anti-inflammatory Diet In Rheumatoid Arthritis),"Rheumatoid arthritis (RA) is a chronic inflammatory disease that affects 0.5-1% of the      population, and where many patients in spite of modern pharmacological treatment fail to      reach remission. The main goal of the randomized cross-over trial ADIRA (Anti-inflammatory      Diet In Rheumatoid Arthritis) is to test the hypothesis that a diet intervention will      decrease disease activity and improve quality of life in patients with established RA.",C0003873;C0003209;C0012159,C1290886;C0003873;C0003873;C0003209;C0518214;C0184661;C0087111;C0544452;C0012634;C0018017;C0012159;C0392366;C0442797;C0184511;C0001721;C0018792;C4049938,0,0,0,2,2,0.001938907,0.001669327,0,0,0.018400443
NCT01326962,A Study of RoActemra/Actemra (Tocilizumab) in Patients With Rheumatoid Arthritis Who Have an Inadequate Response to DMARDs or Anti-TNF,"This open-label, single arm study will evaluate the safety and efficacy of RoActemra/Actemra      (tocilizumab) in patients with active, moderate to severe rheumatoid arthritis who have an      inadequate response to disease-modifying antirheumatic drugs (DMARDs) or anti-TNF. Patients      will receive RoActemra/Actemra at a dose of 8 mg/kg (max 800 mg) intravenously every 4 weeks      for a total of 6 infusions. Non-biologic DMARD therapy may be continued throughout the study.      Anticipated time on study treatment is 24 weeks.",C0003873;C1609165;C3272237;C1704632;C2740854;C0947630;C1550655;C0242708,C0003873;C0003191;C1521826;C1609165;C3840775;C3272237;C3272237;C0574032;C1704632;C2740854;C0012634;C2740854;C0087111;C0087136;C0205082;C1705425;C0947630;C0242708;C0947630;C0446516;C1550655;C1320102;C0242708;C0220825;C1547226;C1444662,26,616,1,0,0,0.002536391,0.00292678,0,1,0.01838431
NCT01010581,SC12267 (4SC-101) in Combination With Methotrexate in Patients With Rheumatoid Arthritis,"The purpose of the study is to determine the efficacy, safety and pharmacokinetics of SC12267      (4SC-101, 35 mg) in combination with methotrexate in comparison to methotrexate alone in the      treatment of patients suffering from Rheumatoid Arthritis.",C0003873;C0025677;C3811910;C1550655,C0003873;C0031327;C0025677;C0025677;C0087111;C0683278;C0947630;C0439044;C3539181;C4082977,0,0,0,11,11,0.00261008,0.002808548,0,0,0.018360825
NCT00960440,"Study of CP-690,550 Versus Placebo In Rheumatoid Arthritis Patients On Background Methotrexate With Inadequate Response To Tumor Necrosis Factor (TNF) Inhibitors","This study will test if CP-690,550 is safe and effective in rheumatoid arthritis patients      taking methotrexate who have an inadequate response to tumor necrosis factor inhibitor      treatment.",C1168005;C0003873;C0025677;C1704632;C0032042;C0947630;C1550655;C1268567,C0003873;C0333516;C0025677;C0087111;C1704632;C0947630;C0392366;C0003438,505,46284,1,185,23.125,0.002646159,0.002733682,0,0,0.018359101
NCT00088764,Pain and Stress Management for People With Rheumatoid Arthritis,"Self-management of rheumatoid arthritis (RA) symptoms using written emotional disclosure      (ED), coping skills training (CST), or a combination of both may benefit people with RA. The      purpose of this study is to determine the benefits of ED, CST, or CST and ED together in      adults with RA. This study will be conducted at Wayne State University in Detroit, Michigan      and Duke University Medical Center in Durham, North Carolina.",C0003873;C0038435;C0030193;C0376636,C0003873;C0376636;C0849912;C0199168;C3810851;C0947630;C0947630;C1446468;C3539181;C0442694;C1457887;C4082977,0,0,0,10,10,0.001676574,0.001723553,0,0,0.018347147
NCT02638259,Comparative Efficacy and Safety Study of GP2015 and Enbrel?? in Patients With Rheumatoid Arthritis,"Demonstrate equivalent efficacy of GP2015 and EU-authorized Enbrel in patients with moderate      to severe, active (RA) who had an inadequate response to disease modifying anti-rheumatic      drugs (DMARD) including methotrexate (MTX).",C0003873;C0720193;C0947630;C1550655,C0025677;C1704632;C0012634;C0720193;C0205082;C0013227;C0242708;C0025677;C0035435;C1320102;C1524004;C1547226,880,36069,1,0,0,0.002918781,0.002767739,0,1,0.018245446
NCT00124982,Study of Abatacept (BMS-188667) in Subjects With Active Rheumatoid Arthritis on Background Non-biologic DMARDS (Disease Modifying Antirheumatic Drugs) Who Have an Inadequate Response to Anti-TNF Therapy,"The purpose of this study is to summarize the safety and tolerability of abatacept during 6      months of combined treatment with one or more of the background non-biologic disease      modifying anti-rheumatic drugs (DMARDs) approved for rheumatoid arthritis (RA) in subjects      with active RA. Secondary objectives assessed the clinical efficacy of combination treatment,      including disease activity, physical function, and quality of life outcomes.",C0242708;C0003873;C1619966;C1704632;C0087111;C0718247;C0242708;C0947630,C4684765;C0003191;C0003873;C0009429;C0516981;C0518214;C0018017;C1619966;C0087111;C0012634;C0012634;C0947630;C3539181;C1320102;C0027627;C1561542;C0242708;C3272565;C4049938,1589,258464,0,92,18.4,0.002452392,0.002655321,0,0,0.018217798
NCT02278289,Comparative Effectiveness of Ultrasound and Paraffin Therapy in Patients With Carpal Tunnel Syndrome: A Randomized Trial,~     The purpose of this study is to compare the efficacy of combining a wrist orthosis with~     either ultrasound therapy or paraffin bath therapy in treating carpal tunnel syndrome~     patients.~   ,C0007286,C0182181;C0043262;C0007286,0,0,-1,3,3,0.001104937,0.000428755,0,0,0.018126861
NCT00559585,Methotrexate-Inadequate Response Study,~     The purpose of this study is to determine whether a weekly subcutaneous dose of abatacept~     yields clinical efficacy comparable to that of monthly intravenous doses of abatacept in~     participants with rheumatoid arthritis and an inadequate response to current methotrexate~     therapy.~   ,C0025677,C0003873;C1619966;C0025677;C1619966,5173,544275,-1,78,26,0.001484239,0.003464305,0,0,0.017953829
NCT01553305,A Study of the Effect of Supervised Exercise Programme in Patients With Rheumatoid Arthritis,The purpose of this study is to compare the effectiveness of a supervised high-intensity      exercise programme followed by an unsupervised exercise programme to an unsupervised exercise      programme in patients with Rheumatoid Arthritis.,C0003873;C1522704;C0947630;C1550655;C0376691,C0003873;C4553491;C0947630;C0452240;C0452240;C0452240,0,0,0,1,1,0.002595972,0.002646993,0,0,0.017911609
NCT00422227,Study Comparing Etanercept With Usual DMARD Therapy in Subjects With Rheumatoid Arthritis in the Asia Pacific Region,The purpose of this study is to compare the efficacy of etanercept with usual      disease-modifying anti-rheumatic drug (DMARD) therapy in the treatment of moderate to severe      rheumatoid arthritis (RA) over 16 weeks in the Asia Pacific region.,C0003873;C0717758;C0087111;C0947630;C0242708,C0003873;C0717758;C0087111;C0012634;C0087111;C0205082;C0947630;C0242708;C0013227;C0035435;C1547226,297,6900,1,10,5,0.002420016,0.00269057,0,1,0.017808666
NCT00810199,A Study of Tocilizumab and Methotrexate Treatment Strategies (Adding Tocilizumab to Methotrexate Versus Switching to Tocilizumab) in Patients With Active Rheumatoid Arthritis With Inadequate Response to Prior Methotrexate Treatment,"This 2 arm study will compare 2 treatment strategies based on tocilizumab in combination with      methotrexate or placebo in patients with moderate to severe rheumatoid arthritis. Patients      receiving methotrexate treatment will be randomized to receive either a) tocilizumab 8 mg      intravenous (iv) every 4 weeks + methotrexate orally (po) weekly or b) tocilizumab 8 mg iv      every 4 weeks + placebo po weekly. After the first 24 weeks of blinded treatment, treatment      adjustments (increase or decrease of treatment intensity) may be introduced at intervals,      based on response. The anticipated time on study treatment is up to 3 years, and the target      sample size is approximately 470 patients.",C0003873;C0025677;C0025677;C0025677;C1609165;C1609165;C1609165;C0087111;C0087111;C1704632;C0718247;C0947630;C1550655;C0679199;C0231530,C0746573;C0003873;C1521826;C0025677;C0025677;C1609165;C1609165;C1609165;C2945673;C0679199;C0087111;C0087111;C0087111;C0087111;C1704632;C0032042;C0032042;C0205082;C0947630;C0446516;C3539181;C0442797;C1550655;C3840775;C0441621;C0456642;C1547226;C0429028,1391,74102,1,23,11.5,0.002998207,0.002728054,0,1,0.017781319
NCT00976118,Activity of Masitinib (AB1010) in Mild to Moderate Alzheimer's Disease,~     This phase 2 study was designed to evaluate the activity of oral masitinib (AB1010)~     administered at 2 dose levels during 24 weeks to patients with mild to moderate confirmed~     Alzheimer's type disease.~   ,C0002395,C2946261;C0012634,0,0,-1,37,37,0.00232342,0.001044172,0,0,0.017717513
NCT01741493,"A Study in Healthy Adults and Adult Subjects With Rheumatoid Arthritis to Evaluate the Safety, Tolerability and Pharmacokinetics After Multiple Doses of ABT-494","This is a phase 1, randomized, double-blind, placebo-controlled, multiple ascending dose      study in healthy volunteers, multiple dose study in patients with rheumatoid arthritis and      multiple dose study in healthy volunteers.",C0003873;C0031327;C0220825;C0947630,C0003873;C0032042;C0456909;C0947630;C0947630;C0947630;C2911690,0,0,0,8,4,0.002520738,0.002999855,0,0,0.017657796
NCT02287610,A Non-Interventional Study of RAYOS in Adult Patients With Rheumatoid Arthritis,"The overall objective of the study is to assess the effectiveness of switching from      immediate-release prednisone (conventional) therapy to delayed-release prednisone (RAYOS) in      patients with moderately to severely active Rheumatoid Arthritis (RA), managed according to      standard of care in clinical practice settings.",C0003873;C0184661;C0947630;C1550655,C0003873;C2936643;C4553491;C0032952;C0032952;C0018017;C1697779;C0205082;C0237607;C0680255;C0087111;C0680255;C0947630;C0542559;C1320102;C4085643;C0231530;C3272565,24,1050,1,0,0,0.002914164,0.002370982,0,1,0.017621315
NCT02001987,A Study of Tocilizumab (RoActemra) in Tocilizumab-Naive Participants With Rheumatoid Arthritis and Inadequate Response to Non-Biologic Disease-Modifying Antirheumatic Drugs (DMARDs) and/or Biologic Therapy,"This two part, multi-center, open-label, single-arm study will evaluate the efficacy and      safety of tocilizumab as a monotherapy or in combination with methotrexate or other      conventional synthetic disease modifying antirheumatic drugs (csDMARDs) in participants with      moderate to severe active rheumatoid arthritis who have an inadequate response or are      intolerant to non-biologic csDMARDs and/or biologic therapy.",C0242708;C0003873;C0005527;C1609165;C1609165;C3272237;C1704632;C0947630;C0005522;C0242708,C0003873;C0003191;C0005527;C0025677;C1609165;C1704632;C0012634;C0087136;C0205082;C1705425;C0947630;C0446516;C3539181;C1320102;C0404831;C0220825;C1547226;C0231199;C3810841,654,13066,0,0,0,0.002137851,0.002688689,0,1,0.017611874
NCT02639988,Impact of Rheumatoid Arthritis on the Course of Type 2 Diabetes During a Longitudinal Follow-up of 5 Years,~     The purpose of this study is to determine whether patients with rheumatoid arthritis and type~     2 diabetes experience a more severe disease course compared to control patients with~     osteoarthritis and type 2 diabetes~   ,C0003873;C0011847,C0003873;C0596545;C0011847;C0012634;C0011847,0,0,-1,50,50,0.002872905,0.002665384,0,1,0.017575601
NCT00522054,Tai Chi for Patients With Rheumatoid Arthritis,"The purpose of this study was to study the impact of Tai Chi group exercise on physical      function, health and disease activity of patients with RA, and to examine the patients'      experience and perception of Tai Chi.",C0003873;C1550655,C1276393;C0237607;C0030971;C0031843;C0012634;C0947630;C0947630;C0000589;C0031809;C4049938,0,0,0,7,7,0.003768952,0.002274652,0,0,0.017507502
